city,name,country,datejoined,founded,investors,stage,totalraised,industry,valuation
ambler,phenom people,united states,4/7/2021,2011,"sierra ventures, axa venture partners, sigma prime ventures",series d,doll_163.02 m,internet software & services,doll_1.4 b
new york,stash,united states,2/3/2021,2015,"goodwater capital, entree capital, valar ventures",debt,doll_491.85 m,fintech,doll_1.4 b
pune,onecard,india,7/13/2022,2019,"sequoia capital india, hummingbird ventures, matrix partners india",series d,doll_224.62 m,fintech,doll_1.4 b
mountain view,coda,united states,7/8/2021,none,"greylock partners, general catalyst, khosla ventures",none,non e,internet software & services,doll_1.4 b
mumbai,boat,india,10/28/2022,2016,"qualcomm ventures, fireside ventures",series c,doll_236.04 m,consumer & retail,doll_1.4 b
seattle,rad power bikes,united states,10/28/2021,2007,"durable capital partners, cercano management, 	t. rowe price",series d,doll_329.32 m,auto & transportation,doll_1.4 b
london,paddle,united kingdom,5/9/2022,2012,"notion capital, kindred capital, bgf ventures",debt,doll_292.76 m,fintech,doll_1.4 b
pune,rebel foods,india,10/7/2021,2011,"sequoia capital india, lightbox ventures, coatue management",debt - viii,doll_523.18 m,e-commerce & direct-to-consumer,doll_1.4 b
san francisco,clarify health,united states,4/5/2022,2015,"kkr, aspenwood ventures, spark capital",series d,doll_389.94 m,health,doll_1.4 b
seoul,bucketplace,south korea,5/9/2022,2014,"imm investment, mirae asset capital, bond",series d,doll_256.56 m,e-commerce & direct-to-consumer,doll_1.4 b
new york,yotpo,united states,3/18/2021,2011,"bessemer venture partners, vintage investment partners, blumberg capital",corporate minority,doll_436 m,internet software & services,doll_1.4 b
new york,the brandtech group,united states,11/19/2019,none,undisclosed,none,non e,other,doll_1.3 b
tel aviv,firebolt,israel,1/26/2022,2019,"tlv partners, zeev ventures, bessemer venture partners",series c,doll_264 m,data management & analytics,doll_1.4 b
madrid,cabify,spain,1/22/2018,2011,"seaya ventures, otter rock capital, rakuten",corporate minority,doll_523.6 m,auto & transportation,doll_1.4 b
san francisco,envoy,united states,1/11/2022,2020,"andreessen horowitz, initialized capital, triplepoint capital",pre-seed,doll_770 k,internet software & services,doll_1.4 b
beijing,koudai,china,10/23/2014,2010,"new enterprise associates, tiger global management, tencent",series c,doll_362 m,e-commerce & direct-to-consumer,doll_1.4 b
san francisco,kong,united states,12/31/2020,2007,"new enterprise associates, crv, index ventures",series d,doll_170.5 m,internet software & services,doll_1.4 b
new york,away,united states,5/15/2019,2015,"global founders capital, comcast ventures, forerunner ventures",convertible note,doll_181.1 m,e-commerce & direct-to-consumer,doll_1.4 b
new york,symphony,united states,5/16/2017,2014,"bnp paribas, goldman sachs, google",series e,doll_461 m,fintech,doll_1.4 b
shenzhen,hive box,china,1/23/2018,2015,"eastern bell capital, sf holding co, sto express",series b,doll_1.24 b,"supply chain, logistics, & delivery",doll_1.4 b
beijing,yidian zixun,china,10/17/2017,2021,"phoenix new media, tianjin haihe industry fund",unattributed - ii,doll_20.55 m,mobile & telecommunications,doll_1.4 b
stockholm,epidemic sound,sweden,3/11/2021,2009,"eqt partners, blackstone",secondary market,doll_476.14 m,internet software & services,doll_1.4 b
ghent,deliverect,belgium,1/24/2022,2018,"newion partners, smartfin capital, omers ventures",series d,doll_235.89 m,fintech,doll_1.4 b
miami,papa,united states,11/4/2021,2016,"initialized capital, canaan partners, sound ventures",series d,doll_242.05 m,health,doll_1.4 b
bengaluru,amagi,india,3/16/2022,2008,"mayfield, accel, norwest venture partners",series f - ii,doll_336.69 m,internet software & services,doll_1.4 b
austin,sparkcognition,united states,1/25/2022,2013,"march capital partners, temasek, doha venture capital",series d,doll_290.88 m,artificial intelligence,doll_1.4 b
denver,sondermind,united states,7/28/2021,2014,"kickstart fund, general catalyst, drive capital",series c,doll_182.5 m,health,doll_1.42 b
toronto,figment,canada,12/20/2021,2018,"bonfire ventures, two sigma ventures, fj labs",series c,doll_163.84 m,internet software & services,doll_1.4 b
shanghai,ouyeel,china,6/27/2019,2015,taigang venture capital,series b,doll_433.72 m,internet software & services,doll_1.45 b
chicago,m1,united states,7/14/2021,2015,"left lane capital, clocktower technology ventures, jump capital",series e,doll_328.17 m,fintech,doll_1.45 b
new york,justworks,united states,1/28/2020,2012,"index ventures, thrive capital, bain capital ventures",series e,doll_143 m,internet software & services,doll_1.43 b
new york,vts,united states,5/7/2019,2012,"trinity ventures, fifth wall ventures, openview venture partners",series e,doll_452.18 m,internet software & services,doll_1.47 b
san francisco,aleo,united states,2/7/2022,2019,"slow ventures, andreessen horowitz, softbank group",series b,doll_228 m,cybersecurity,doll_1.45 b
hefei,yipin shengxian,china,3/11/2019,2017,"eastern bell capital, capital today, longzhu capital",series d,doll_658.49 m,e-commerce & direct-to-consumer,doll_1.49 b
hangzhou,valgen medtech,china,5/6/2021,2015,"sequoia capital china, china life investment holding company, qiming venture partners",series b,doll_133 m,health,doll_1.43 b
shanghai,bordrin motors,china,6/3/2019,2016,"china grand prosperity investment, csc group",unattributed vc,doll_361 m,auto & transportation,doll_1.48 b
beijing,shukun technology,china,8/16/2021,2017,"marathon venture partners, huagai capital, china creation ventures",series d,doll_247.65 m,artificial intelligence,doll_1.46 b
dc,arcadia,united states,5/10/2022,2014,"boxgroup, energy impact partners, camber creek",unattributed - ii,doll_569.91 m,other,doll_1.48 b
sao paulo,dock,brazil,5/12/2022,1997,"viking global investors, riverwood capital, lightrock",series b,doll_280 m,fintech,doll_1.5 b
san francisco,boba,united states,4/5/2022,2021,"defi technologies, hypersphere ventures, m13",series a,doll_45 m,fintech,doll_1.5 b
boulder,veho,united states,12/21/2021,2016,"general catalyst, origin ventures, fontinalis partners",series b,doll_299.28 m,"supply chain, logistics, & delivery",doll_1.5 b
dc,upside,united states,4/26/2022,2016,"bessemer venture partners, builders vc, general catalyst",series d,doll_165 m,mobile & telecommunications,doll_1.5 b
bellevue,temporal,united states,2/16/2022,2019,"amplify partners, addition, madrona venture group",series b,doll_121.75 m,internet software & services,doll_1.5 b
pune,elasticrun,india,2/7/2022,2016,"kalaari capital, norwest venture partners, prosus ventures",series e,doll_432.11 m,"supply chain, logistics, & delivery",doll_1.5 b
chengdu,juma peisong,china,11/26/2018,2011,"ding xiang capital, new hope fund, sino-ocean capital",series c,doll_281.38 m,"supply chain, logistics, & delivery",doll_1.45 b
london,5ire,united kingdom,7/15/2022,2021,"global emerging markets, sram & mram group, marshland capital",series a,doll_210 m,internet software & services, doll_1.50  b
shenzhen,coocaa,china,3/16/2018,2006,"baidu, tencent holdings",corporate minority - iv,doll_226.6 m,hardware,doll_1.45 b
santa cruz,prometheus,united states,9/23/2021,2018,"bmw i ventures, metaplanet, maersk growth",series b,doll_150 k,other, doll_1.50  b
stockholm,einride,sweden,12/31/2021,2016,"temasek,	build capital partners, 	northzone ventures",series c,doll_650.82 m,auto & transportation,doll_1.44 b
solihull,gymshark,united kingdom,8/14/2020,2012,general atlantic,growth equity,doll_300 m,e-commerce & direct-to-consumer,doll_1.45 b
bellevue,fabric,united states,2/24/2022,2017,"redpoint ventures, norwest venture partners, sierra ventures",series c,doll_292.58 m,e-commerce & direct-to-consumer,doll_1.5 b
palo alto,mashgin,united states,5/9/2022,2014,"new enterprise associates, matrix partmers, susa ventures",series b,doll_62.67 m,artificial intelligence,doll_1.5 b
tallinn,veriff,estonia,1/26/2022,2015,"accel, institutional venture partners, tiger global management",series c,doll_192.32 m,artificial intelligence,doll_1.5 b
san francisco,zeta,united states,5/24/2021,2015,"sodexo ventures, softbank group",series c - ii,doll_303 m,fintech,doll_1.5 b
paris,spendesk,france,1/18/2022,2015,"index ventures, eight roads ventures, general atlantic",series c - ii,doll_300.34 m,fintech,doll_1.5 b
new york,il makiage,united states,1/10/2022,2018,"l catterton, franklin templeton, first light capital group",secondary market,doll_29 m,e-commerce & direct-to-consumer,doll_1.5 b
san francisco,airbyte,united states,12/17/2021,2020,"accel, benchmark, sv angel",none,non e,internet software & services,doll_1.5 b
herzliya,storedot,israel,1/4/2022,2012,"samsung ventures, singulariteam, bp ventures",series d - ii,doll_206 m,other,doll_1.5 b
mountain view,athelas,united states,1/31/2022,2016,"sequoia capital, general catalyst, 	human capital",series b,doll_136.08 m,health,doll_1.5 b
curitiba,olist,brazil,12/15/2021,2015,"redpoint e.ventures, valor capital group, softbank latin america fund",series e,doll_318.75 m,e-commerce & direct-to-consumer,doll_1.5 b
bengaluru,curefit,india,11/10/2021,2016,"chiratae ventures, accel, kalaari capital",series f,doll_679.4 m,health,doll_1.5 b
new york,lusha,united states,11/10/2021,2016,"psg, ion crossover partners",series b,doll_245 m,internet software & services,doll_1.5 b
san francisco,coinlist,united states,10/15/2021,2017,"accomplice, polychain capital, goldentree asset management",series a - ii,doll_169.2 m,fintech,doll_1.5 b
new york,candy.com,united states,10/21/2021,2021,"insight partners, softbank group, connect ventures",series a - ii,doll_100 m,internet software & services,doll_1.5 b
scottsdale,paradox,united states,12/27/2021,2016,"brighton park capital, blue cloud ventures, workday ventures",series c,doll_253.46 m,internet software & services,doll_1.5 b
nashville,built,united states,9/30/2021,2015,"nyca partners, index ventures, technology crossover ventures",unattributed vc,doll_291.74 m,internet software & services,doll_1.5 b
bangkok,ascend money,thailand,9/27/2021,2013,"ant group, charoen pokphand group, bow wave capital",series c,doll_150 m,fintech,doll_1.5 b
new york,andela,united states,9/29/2021,2014,"spark capital, google ventures, cre venture capital",series e,doll_374.61 m,internet software & services,doll_1.5 b
zephyr cove,1047 games,united states,9/14/2021,2017,"vgames, lakestar, galaxy interactive",series b,doll_126.5 m,internet software & services,doll_1.5 b
altrincham,matillion,united kingdom,9/15/2021,2011,"scale venture partners, sapphire ventures, battery ventures",series e - iv,doll_310.32 m,data management & analytics,doll_1.5 b
san francisco,persona,united states,9/15/2021,2018,"coatue management, index ventures, founders fund",series c,doll_217.5 m,cybersecurity,doll_1.5 b
richmond,culture amp,australia,7/29/2021,2011,"felicis ventures, index ventures, blackbird ventures",series f,doll_258.3 m,internet software & services,doll_1.5 b
draper,taxbit,united states,8/4/2021,2018,"insight partners, coinbase ventures, paypal ventures",series b - ii,doll_235.75 m,fintech,doll_1.5 b
cincinnati,pacaso,united states,3/24/2021,2020,"global founders capital, shea ventures, greycroft",option/warrant,doll_1.482 b,fintech,doll_1.5 b
santa barbara,impact.com,united states,7/13/2021,2008,"redpoint ventures, providence equity partners, silversmith capital partners",secondary market,doll_274.15 m,internet software & services,doll_1.5 b
shanghai,yunquna,china,6/29/2021,2015,"source code capital, coatue management, dcm ventures",series d - ii,doll_342.37 m,"supply chain, logistics, & delivery",doll_1.5 b
santiago,notco,chile,7/26/2021,2015,"kaszek ventures, sosv, tiger global management",series d - ii,doll_465.84 m,consumer & retail,doll_1.5 b
tel aviv,next silicon,israel,6/14/2021,2018,"amiti ventures, playground global, aleph",series b,doll_226.6 m,hardware,doll_1.5 b
san francisco,snapdocs,united states,5/25/2021,2012,"sequoia capital, y combinator, f-prime capital",series d,doll_250 m,fintech,doll_1.5 b
san francisco,smartrecruiters,united states,7/20/2021,2010,"mayfield fund, insight partners, rembrandt venture partners",series e,doll_214.55 m,internet software & services,doll_1.5 b
san francisco,chipper cash,united states,5/31/2021,2017,"deciens capital, bezos expeditions, 500 startups",series c - ii,doll_302.6 m,fintech,doll_2 b
mclean,id.me,united states,3/19/2021,2010,"moonshots capital, boxgroup, blu venture investors",debt - ii,doll_273.07 m,cybersecurity,doll_1.5 b
boulder,uplight,united states,3/3/2021,2019,"rubicon technology partners, max ventures, inclusive capital partners",unattributed - ii,doll_72.31 m,other,doll_1.5 b
new york,k health,united states,1/19/2021,2016,"max ventures, mangrove capital partners, 14w",series e,doll_278 m,health,doll_1.5 b
san francisco,strava,united states,11/16/2020,2009,"jackson square ventures, madrone capital partners, sequoia capital",series f,doll_179.85 m,internet software & services,doll_1.5 b
bellevue,zenoti,united states,12/15/2020,2010,"norwest venture partners, accel, tiger global management",series d - ii,doll_341.68 m,internet software & services,doll_1.5 b
paris,ledger,france,6/10/2021,2014,"digital currency group, draper esprit, korelya capital",series c,doll_466.38 m,hardware,doll_1.5 b
san francisco,collective health,united states,6/17/2019,2013,"new enterprise associates, founders fund, google ventures",series f,doll_714 m,fintech,doll_1.5 b
beijing,yijiupi,china,9/20/2018,2014,"source code capital, meituan dianping, tencent holdings",series d - iv,doll_547.27 m,consumer & retail,doll_1.5 b
hangzhou,dt dream,china,6/8/2017,2015,"alibaba group, china everbright investment management, yinxinggu capital",series b,doll_260.35 m,data management & analytics,doll_1.5 b
cambridge,cambridge mobile telematics,united states,12/19/2018,2010,softbank group,corporate minority,doll_502.5 m,auto & transportation,doll_1.5 b
beijing,xiaozhu,china,11/1/2017,2012,"morningside ventures, capital today, joy capital",series f - ii,doll_500 m,travel,doll_1.5 b
hangzhou,jolly information technology,china,5/29/2018,2008,"legend capital, cdh investments, sequoia capital china",series c - ii,doll_100.12 m,e-commerce & direct-to-consumer,doll_1.5 b
shanghai,changingedu,china,10/30/2017,none,"trustbridge partners, idg capital, sequoia capital china",series d,doll_188 m,edtech,doll_1.5 b
beijing,tujia,china,6/17/2015,2015,"ggv capital, qiming venture partnersl",seed vc,non e,travel,doll_1.5 b
northbrook,mu sigma,united states,2/7/2013,2004,"sequoia capital, general atlantic",corporate minority,doll_208 m,data management & analytics,doll_1.5 b
london,gett,united kingdom,5/24/2016,2010,"volkswagen, access industries, vostok new ventures",series g,doll_1.057 b,auto & transportation,doll_1.5 b
shanghai,mofang living,china,4/13/2016,2009,"warburg pincus, aviation industry corporation of china",series d,doll_710 m,e-commerce & direct-to-consumer,doll_1.5 b
cambridge,orna therapeutics,united states,8/16/2022,2019,"mpm capital, astellas venture management, f2 ventures",series b,doll_321 m,health,doll_1.5 b
seattle,first mode,united states,12/7/2022,2018,anglo american,corporate minority,doll_208.5 m,other,doll_1.5 b
quito,kushki,ecuador,6/7/2022,2015,"clocktower technology ventures, dila capital, kaszek ventures",series b - ii,doll_186 m,fintech,doll_1.5 b
new york,openweb,united states,11/9/2021,2012,"insight partners, altair capital, norma investments",series f,doll_383 m,internet software & services,doll_1.5 b
jiangsu,carzone,china,3/1/2019,none,"alibaba group,co-stone venture capital, buhuo venture capital",series d - iii,doll_946.49 m,e-commerce & direct-to-consumer,doll_1.52 b
austin,jasper,united states,10/17/2022,2020,"foundation capital, institutional venture partners, founders capital",other investors,non e,artificial intelligence,doll_1.5 b
new york,bilt rewards,united states,10/25/2022,2021,"camber creek, kairos hq, fifth wall ventures",series b,doll_210.3 m,fintech,doll_1.5 b
hunan,wenheyou,china,4/17/2021,2013,"sequoia capital china, warburg pincus, idg capital",series b,doll_92.44 m,other,doll_1.55 b
chengdu,fresh life style supply chain management,china,3/11/2022,2016,"guiyang venture capital, longfor capital, caogenzhiben group",series b,doll_92.61 m,"supply chain, logistics, & delivery", doll_1.57  b
beijing,baiwang,china,3/25/2019,2015,"guozhong venture capital management, shenzhen capital group, oriental fortune capital",series d,doll_224.35 m,fintech,doll_1.55 b
san francisco,loom,united states,5/20/2021,2016,"kleiner perkins caufield & byers, sequoia capital, general catalyst",series c,doll_198.58 m,internet software & services,doll_1.53 b
austin,icon 3d,united states,2/18/2022,2018,"moderne ventures, oakhouse partners, bjarke ingels group",grant,doll_500.22 m,hardware, doll_1.57  b
shanghai,ximalaya fm,china,9/22/2017,2012,"china creation ventures, sierra ventures, xingwang investment management",series d,doll_70.59 m,mobile & telecommunications,doll_1.52 b
beijing,galaxyspace,china,11/17/2020,2016,"shunwei capital partners, 5y capital, legend capital",series b - iii,non e,mobile & telecommunications,doll_1.58 b
shanghai,iluvatar corex,china,3/1/2021,2015,"centurium capital, cedarlake capital, unicom innovation venture capital",series c - iii,doll_185.52 m,hardware,doll_1.55 b
new york,alloy,united states,9/30/2021,2015,"bessemer venture partners, eniac ventures, canapi ventures",series c - ii,doll_207.92 m,fintech,doll_1.55 b
bryanston,promasidor holdings,south africa,11/8/2016,1979,"ifc, ajinomoto",corporate minority,doll_556 m,consumer & retail,doll_1.59 b
vilnius,nord security,lithuania,4/7/2022,2012,"general catalyst, baltcap, novator partners",series a,doll_100 m,cybersecurity,doll_1.6 b
san francisco,pave,united states,6/28/2022,2019,"y combinator, 	andreessen horowitz, bessemer venture partners",series c,doll_162.98 m,internet software & services,doll_1.6 b
dubai,kitopi,united arab emirates,7/1/2021,2018,"ce-ventures, beco capital, nordstar",series c - ii,doll_802.2 m,"supply chain, logistics, & delivery",doll_1.55 b
san francisco,vanta,united states,6/7/2022,2016,"craft ventures, sequoia capital, verissimo ventures",series b - iii,doll_203 m,cybersecurity,doll_1.6 b
hayward,truepill,united states,10/27/2021,2016,"initialized capital, sound ventures, ti platform management",unattributed,doll_256.06 m,health,doll_1.6 b
dublin,wayflyer,ireland,2/1/2022,2019,"qed investors, dst global, left lane capital",mezzanine,doll_889.2 m,fintech,doll_1.6 b
san francisco,mercury,united states,7/3/2021,2019,"andreessen horowitz, coatue management, clocktower technology ventures",series b,doll_150.93 m,fintech,doll_1.6 b
new york,asapp,united states,5/19/2021,2014,"march capital partners, hof capital, emergence capital partners",series c,doll_312.57 m,artificial intelligence,doll_1.6 b
cambridge,generate biomedicines,united states,11/18/2021,2018,"altitude life science ventures. t. rowe price, morningside venture partners",series b,doll_370 m,health,doll_1.36 b
san francisco,magic eden,united states,6/21/2022,2021,"sequoia capital, lightspeed venture partners, paradigm",unattributed,doll_164.06 m,fintech,doll_1.6 b
boston,ezcater,united states,4/2/2019,2007,"insight venture partners, iconiq capital, launchpad venture group",series d - iii,doll_420.16 m,"supply chain, logistics, & delivery",doll_1.6 b
san francisco,homelight,united states,9/2/2021,2012,"zeev ventures, menlo ventures,crosslink capital",series d - ii,doll_654.6 m,fintech,doll_1.7 b
tokyo,smarthr,japan,6/8/2021,2013,"beenext, world innovation lab, light street capital",series d,doll_222.34 m,fintech,doll_1.6 b
lysaker,cognite,norway,5/19/2021,2016,"technology crossover ventures, accel, aker",secondary market,doll_233.8 m,data management & analytics,doll_1.5 b
san francisco,cresta,united states,3/17/2022,2017,"andreessen horowitz, greylock partners, sequoia capital",series c,doll_151 m,artificial intelligence,doll_1.6 b
san francisco,extend,united states,5/18/2021,2021,"greatpoint ventures, meritech capital partners, paypal ventures",none,non e,fintech,doll_1.36 b
burnaby,clio,canada,4/27/2021,2008,"omers private equity, t. rowe price, technology crossover ventures",series e - ii,doll_415.79 m,internet software & services,doll_1.6 b
sydney,safetyculture,australia,5/3/2021,2004,"blackbird ventures, indexventures, tiger global management",series d,doll_222.81 m,internet software & services,doll_1.6 b
san francisco,monte carlo,united states,5/24/2022,2019,"ggv capital, accel, redpoint ventures",series d,doll_236 m,artificial intelligence,doll_1.6 b
new york,capitolis,united states,3/22/2022,2017,"sequoia capital, index ventures, s capital",series d,doll_281.84 m,fintech,doll_1.6 b
sunnyvale,clari,united states,3/3/2021,2012,"sequoia capital, bain capital ventures, enaya capital",series f,doll_496 m,internet software & services,doll_2.6 b
hangzhou,cao cao mobility,china,1/17/2018,2015,"people electrical appliance group china, zhongrong international trust",series b,doll_968.86 m,auto & transportation,doll_1.6 b
hamilton,afiniti,bermuda,4/14/2017,2006,gam holding,debt - ii,doll_327.2 m,artificial intelligence,doll_1.6 b
waltham,infinidat,united states,4/29/2015,2011,"tpg growth, goldman sachs",series d,doll_325 m,hardware,doll_1.6 b
san francisco,tonal,united states,3/31/2021,2015,"mayfield fund, shasta ventures, l catterton",angel,doll_431.4 m,e-commerce & direct-to-consumer,doll_1.6 b
bengaluru,dealshare,india,1/27/2022,2018,"alpha wave global, matrix partners india, tiger global management",series e - ii,doll_391.52 m,e-commerce & direct-to-consumer,doll_1.7 b
san francisco,transcarent,united states,1/11/2022,2020,"alta partners, general catalyst, jove equity partners",series c,doll_298 m,health,doll_1.62 b
berlin,solarisbank,germany,7/13/2021	,2016,"yabeo capital, sbi investment, vulcan capital",series d,doll_402.46 m,fintech,doll_1.65 b
beijing,jusfoun big data,china,7/9/2018,2010,"boxin capital, dt capital partners, idg capital",unattributed,doll_137.13 m,data management & analytics,doll_1.62 b
san francisco,optimism,united states,3/17/2022,2019,"paradigm, huobi ventures, andreessen horowitz",series b,doll_179.18 m,internet software & services,doll_1.65 b
los angeles,spotter,united states,2/16/2022,2019,"softbank group, access industries, crossbeam venture partners",unattributed vc - ii,doll_229.99 m,fintech,doll_1.7 b
austin,zenbusiness,united states,11/9/2021,2015,"greycroft, lerer hippeau, geekdom fund",unattributed vc - iii,doll_278.21 m,fintech,doll_1.7 b
mountain view,h2o.ai,united states,11/7/2021,2012,"nexus venture partners, transamerica ventures, crane venture partners",none,non e,artificial intelligence,doll_1.7 b
redwood city,reltio,united states,11/4/2021,2011,"crosslink capital, .406 ventures, sapphire ventures",series e,doll_240.5 m,data management & analytics,doll_1.7 b
san francisco,circleci,united states,5/11/2021,2011,"threshold ventures, baseline ventures, harrison metal",series f,doll_312.5 m,internet software & services,doll_1.7 b
hanover,dragos,united states,10/28/2021,2016,"datatribe, energy impact partners, allegiscyber capital",series d,doll_364.2 m,cybersecurity,doll_1.7 b
,finaccel,singapore,8/15/2022,2015,"jungle ventures, square peg capital, openspace ventures",series d,doll_551 m,fintech,doll_1.66 b
new york,redesign health,united states,9/13/2022,2018,"general catalyst, samsung next, cvs health partners",series c,doll_315 m,health,doll_1.7 b
london,multiverse,united kingdom,6/8/2022,2016,"lightspeed venture partners, google ventures, general catalyst",series d,doll_414 m,edtech,doll_1.7 b
chongqing,zhubajie,china,6/16/2015,none,"cybernaut growth fund, idg capital",series c,doll_429.6 m,internet software & services,doll_1.61 b
san francisco,front,united states,6/28/2022,2013,"sequoia capital, uncork capital, salesforce ventures",series d,doll_203.12 m,internet software & services,doll_1.7 b
new york,unite us,united states,3/16/2021,2014,"insight partners, sequoia capital, index ventures",series c,doll_195.3 m,health,doll_1.6 b
san francisco,incredible health,united states,8/17/2022,2017,"obvious ventures, andreessen horowitz, nfx",series b,doll_98.08 m,health,doll_1.65 b
san francisco,pax,united states,10/22/2018,2007,"tao capital partners, global asset capital, tiger global management",series e,doll_544.93 m,consumer & retail,doll_1.7 b
denver,dispatchhealth,united states,3/3/2021,2013,"alta partners, questa capital, echo health ventures",series e,doll_740.96 m,health,doll_1.7 b
selangor,carsome,malaysia,7/12/2021,2015,"gobi partners, 500 startups, ondine capital",other investors,non e,e-commerce & direct-to-consumer,doll_1.7 b
new york,harry's,united states,2/16/2018,2013,"thrive capital, tiger global management, temasek",series e,doll_659.1 m,consumer & retail,doll_1.7 b
new york,alphasense,united states,6/15/2022,2011,"viking global investors, gs growth, blackrock",debt,doll_497.36 m,artificial intelligence,doll_1.7 b
denver,crusoe,united states,4/21/2022,2018,"bain capital ventures, founders fund, winklevoss capital",unattributed,doll_747.5 m,internet software & services,doll_1.75 b
portland,orca security,united states,3/23/2021,2019,"yl ventures, redpoint ventures, ggv capital",series c - ii,doll_632 m,cybersecurity,doll_1.8 b
dakar,wave,senegal,9/7/2021,none,"stripe, founders fund, partech partners",corporate minority,non e,fintech,doll_1.7 b
new york,uniswap,united states,10/13/2022,2018,"a16z crypto, variant fund, paradigm",series b,doll_178.83 m,fintech,doll_1.66 b
san francisco,productboard,united states,2/2/2022,2014,"index ventures, kleiner perkins caufield & byers, bessemer venture partners",series d,doll_261.3 m,internet software & services,doll_1.73 b
