city,name,country,datejoined,founded,investors,stage,totalraised,industry,valuation
louvain-la-neuve,odoo,belgium,7/29/2021,,"summit partners, noshaq, sofinnova partners",,,internet software & services,doll_2.3 b
ho chi minh city,momo,vietnam,12/10/2021,,"goodwater capital, warburg pincus, gs growth",,,fintech,doll_2.27 b
mountain view,zume,united states,11/1/2018,,"softbank group, ame cloud ventures, signalfire",,,consumer & retail,doll_2.25 b
san francisco,algolia,united states,7/28/2021,,"accel, alven capital, storm ventures",,,internet software & services,doll_2.25 b
lehi,pattern,united states,10/6/2021,,"knox lane, ainge advisory, carlson private capital partners",,,internet software & services,doll_2.25 b
san francisco,newfront insurance,united states,4/12/2022,,"founders fund, meritech capital partners, gs growth",,,fintech,doll_2.2 b
unterfoehring,nucom group,germany,2/22/2018,,general atlantic,,,other,doll_2.2 b
seoul,musinsa,south korea,11/11/2019,,sequoia capital,,,e-commerce & direct-to-consumer,doll_2.2 b
new york,current,united states,4/27/2021,,"expa, qed investors, foundation capital",,,fintech,doll_2.2 b
mexico city,bitso,mexico,5/5/2021,,"pantera capital, qed investors, coinbase ventures",,,fintech,doll_2.2 b
new york,gympass,united states,6/12/2019,,"general atlantic, softbank group, atomico",,,internet software & services,doll_2.2 b
san francisco,dialpad,united states,10/6/2020,,"andreessen horowitz, google ventures, section 32",,,internet software & services,doll_2.2 b
beijing,g7 networks,china,2/15/2022,,"eastern bell capital 32, sdic cmc investment management, trustbridge partners",,,"supply chain, logistics, & delivery",doll_2.2 b
mountain view,bloomreach,united states,2/23/2022,,"bain capital ventures, sixth street growth, lightspeed venture partners",,,artificial intelligence,doll_2.2 b
boston,motif foodworks,united states,6/16/2021,,"general atlantic, breakthrough energy ventures, viking global investors",,,consumer & retail , doll_2.20  b
shanghai,huaqin telecom technology,china,10/8/2019,,"zhangjiang haocheng venture capital, walden international, intel capital",,,mobile & telecommunications,doll_2.19 b
colchester,accelerant,united kingdom,1/12/2022,,"deer park road, altamont capital partners, eldridge",,,other,doll_2.19 b
shanghai,hesai tech,china,8/1/2020,,"lightspeed china partners, baidu ventures, qiming venture partners",,,artificial intelligence,doll_2.18 b
shanghai,yitu technology,china,3/8/2018,,"sequoia capital china, banyan capital",,,artificial intelligence,doll_2.17 b
mountain view,addepar,united states,6/15/2021,,"8vc, d1 capital partners, sway ventures",,,fintech,doll_2.17 b
san francisco,qualia,united states,12/21/2020,,"8vc, menlo ventures, tiger global management",,,fintech,doll_2.17 b
san mateo,neo4j,united states,6/17/2021,,"eight roads ventures, one peak partners, creandum",,,data management & analytics,doll_2 b
sao paulo,cloudwalk,brazil,9/8/2021,,"plug and play ventures, valor capital group, dst global",,,fintech,doll_2.15 b
maharashtra,coindcx,india,8/10/2021,,"polychain capital, coinbase ventures, jump capital",,,fintech,doll_2.15 b
pune,firstcry,india,2/7/2020,,"softbank group, saif partners india, valiant capital partners",,,e-commerce & direct-to-consumer,doll_2.1 b
santa clara,eightfold.ai,united states,10/27/2020,,"foundation capital, institutional venture partners, general catalyst",,,internet software & services,doll_2.1 b
gurgaon,urban company,india,4/27/2021,,"vy capital, accel, elevation capital",,,e-commerce & direct-to-consumer,doll_2.1 b
los angeles,recharge,united states,5/6/2021,,"iconiq growth, bain capital ventures, summit partners",,,fintech,doll_2.1 b
mountain view,moveworks,united states,6/30/2021,,"lightspeed venture partners, sapphire ventures, kleiner perkins caufield & byers",,,artificial intelligence ,doll_2.1 b
palo alto,medable,united states,10/26/2021,,"gsr ventures, sapphire ventures, streamlined ventures",,,health,doll_2.1 b
london,gocardless,united kingdom,2/8/2022,,"accel, passion capital, balderton capital",,,fintech,doll_2.1 b
berlin,forto,germany,6/21/2021,,"cherry ventures, northzone ventures, global founders capital",,,"supply chain, logistics, & delivery",doll_2.1 b
orlando,jeeves,united states,3/14/2022,,"tencent holdings, crv, clocktower technology ventures",,,fintech,doll_2.1 b
hong kong,babel finance,hong kong,5/25/2022,,"dragonfly capital, bai capital, 10t fund",,,fintech,doll_2 b
london,bezero,united kingdom,11/14/2022,,"molten ventures, contrarian ventures, hitachi ventures",,,other,doll_2 b
kowloon,trendy group international,hong kong,2/13/2012,,l capital partners,,,consumer & retail,doll_2 b
san francisco,mysten labs,united states,9/8/2022,,"andreessen horowitz, coinbase ventures, circle ventures",,,internet software & services,doll_2 b
chicago,avant,united states,12/17/2012,,"rre ventures, tiger global, august capital",,,artificial intelligence,doll_2 b
shenzhen,tubatu.com,china,3/9/2015,,"sequoia capital china, matrix partners china, 58.com",,,e-commerce & direct-to-consumer,doll_2 b
paris,blablacar,france,9/16/2015,,"accel partners, index ventures, insight venture partners",,,auto & transportation,doll_2 b
beijing,huimin,china,9/5/2016,,"zheshang venture capital, gp capital, western capital management",,,e-commerce & direct-to-consumer,doll_2 b
mountain view,quora,united states,4/21/2017,,"y combinator, matrix partners, benchmark",,,internet software & services,doll_2 b
tokyo,preferred networks,japan,5/17/2018,,"toyota motor corporation, mizuho financial group, fanuc",,,artificial intelligence,doll_2 b
somerville,formlabs,united states,8/1/2018,,"pitango venture capital, dfj growth fund, foundry group",,,hardware,doll_2 b
beijing,4paradigm,china,12/19/2018,,"sequoia capital china, china construction bank, bank of china",,,artificial intelligence,doll_2 b
san francisco,calm,united states,2/6/2019,,"insight venture partners, tpg growth, sound ventures",,,internet software & services,doll_2 b
miami,kaseya,united states,3/27/2019,,"insight partners, tpg alternative & renewable technologies, ireland strategic investment fund",,,cybersecurity,doll_2 b
beijing,mafengwo,china,5/23/2019,,"qiming venture partners, capital today, general atlantic",,,travel,doll_2 b
sunnyvale,druva,united states,6/20/2019,,"nexus venture partners, tenaya capital, sequoia capital",,,data management & analytics,doll_2 b
hangzhou,kujiale,china,10/25/2019,,"ggv capital, idg capital, linear venture",,,internet software & services,doll_2 b
san francisco,appsflyer,united states,1/21/2020,,"magma venture partners, pitango venture capital, qumra capital",,,mobile & telecommunications,doll_2 b
beijing,keep,china,5/19/2020,,"bertelsmann asia investments, ggv capital, morningside venture capital",,,internet software & services,doll_2 b
mountain view,redis labs,united states,8/25/2020,,"viola ventures, dell technologies capital, bain capital ventures",,,data management & analytics,doll_2 b
shenzhen,xingyun group,china,9/24/2020,,"matrix partners china, eastern bell capital, hongtai capital holdings",,,e-commerce & direct-to-consumer,doll_2 b
new york,unqork,united states,10/6/2020,,"blackrock, capitalg, world lab innovation",,,fintech,doll_2 b
san francisco,virta health,united states,12/2/2020,,"caffeinated capital, obvious ventures, venrock",,,health,doll_2 b
dallas,isn,united states,12/17/2020,,blackstone,,,"supply chain, logistics, & delivery",doll_2 b
giv'atayim,earnix,israel,2/21/2021,,"jerusalem venture partners, israel growth partners, insight partners",,,fintech,doll_2 b
shanghai,guoquan shihui,china,3/17/2021,,"tiantu capital, cmb international capital, vision knight capital",,,consumer & retail,doll_2 b
toronto,clearco,canada,4/20/2021,,"highland capital partners, oak hc/ft partners, emergence capital partners",,,fintech,doll_2 b
san francisco,hive,united states,4/21/2021,,"tomales bay capital, bain & company, general catalyst",,,artificial intelligence,doll_2 b
stockholm,kry,sweden,4/27/2021,,"index ventures, creandum, accel",,,health,doll_2 b
irvine,kajabi,united states,5/4/2021,,"meritech capital partners, tiger global management, spectrum equity",,,internet software & services,doll_2 b
san francisco,ethos,united states,5/11/2021,,"sequoia capital, google ventures, accel",,,fintech,doll_2.7 b
london,payfit,united kingdom,1/6/2022,,"accel, frst, kima ventures",,,fintech,doll_2.1 b
beijing,beisen,china,5/11/2021,,"matrix partners china, sequoia capital china, genesis capital",,,internet software & services,doll_2 b
miami,pipe,united states,5/19/2021,,"next47, mac venture capital, finvc",,,fintech,doll_2 b
san francisco,iterable,united states,6/15/2021,,"crv, blue cloud ventures, index ventures",,,internet software & services,doll_2 b
amsterdam,bunq,netherlands,6/18/2021,,undisclosed,,,fintech,doll_2 b
mexico city,clip,mexico,6/10/2021,,"alta ventures mexico, general atlantic, softbank group",,,fintech,doll_2 b
sao paulo,loggi,brazil,6/5/2019,,"qualcomm ventures, softbank group. monashees+",,,"supply chain, logistics, & delivery",doll_2 b
san francisco,mural,united states,7/20/2021,,"insight partners, tiger global management, gradient ventures",,,internet software & services,doll_2 b
leudelange,ocsial,luxembourg,3/4/2019,,"a&nn, rusnano",,,other,doll_2 b
shenzhen,xtalpi,china,8/11/2021,,"tencent holdings, 5y capital, sequoia capital china",,,artificial intelligence,doll_2 b
san francisco,divvy homes,united states,8/13/2021,,"andreessen horowitz, caffeinated capital, scifi vc",,,fintech,doll_2 b
goleta,apeel sciences,united states,5/26/2020,,"upfront ventures, tao capital partners, andreessen horowitz",,,other,doll_2 b
lagos,opay,nigeria,8/23/2021,,"sequoia capital china, source code capital, redpoint ventures china",,,fintech,doll_2 b
santa clara,aviatrix,united states,9/8/2021,,"ignition partners, formation 8, crv",,,internet software & services,doll_2 b
tokyo,smartnews,japan,8/5/2019,,"japan post capital, globis capital partners, atomico",,,mobile & telecommunications,doll_2 b
pennsauken,misfits market,united states,4/21/2021,,"accel, d1 capita partners, greenoaks capital management",,,"supply chain, logistics, & delivery",doll_2 b
new york,spring health,united states,9/16/2021,,"rethink impact, work-bench, rre ventures",,,health,doll_2 b
shanghai,black sesame technologies,china,9/22/2021,,"northern light venture capital, xiaomi, futurex capital",,,artificial intelligence,doll_2 b
,advance intelligence group,singapore,9/23/2021,,"vision plus capital, gsr ventures, zhenfund",,,artificial intelligence,doll_2 b
san francisco,modern treasury,united states,10/6/2021,,"benchmark, altimeter capital, quiet capital",,,fintech,doll_2 b
plantation,magic leap,united states,10/21/2014,,"obvious ventures, qualcomm ventures, andreessen horowitz",,,hardware,doll_2 b
berlin,tier,germany,10/25/2021,,"northzone ventures, white star capital, novator partners",,,travel,doll_2 b
portola valley,clickhouse,united states,10/28/2021,,"lightspeed venture partners, almaz capital partners, altimeter capital",,,data management & analytics,doll_2 b
taguig city,mynt,philippines,11/1/2021,,"insight partners, warburg pincus, ayala corporation",,,fintech,doll_2 b
oakland,everlaw,united states,3/10/2020,,"k9 ventures, menlo ventures, andreessen horowitz",,,internet software & services,doll_2 b
london,zilch,united kingdom,11/10/2021,,"gauss ventures, ventura capital, dmg ventures",,,fintech,doll_2 b
new york,verbit,united states,6/8/2021,,"claltech, vertex ventures, oryzn capital",,,artificial intelligence,doll_2 b
netanya,starkware,israel,11/17/2021,,"sequoia capital, paradigm, pantera capital",,,cybersecurity,doll_8 b
san francisco,netlify,united states,11/17/2021,,"andreessen horowitz, kleiner perkins caufield & byers, eqt ventures",,,internet software & services,doll_2 b
new york,sword health,united states,11/22/2021,,"khosla ventures, green innovations, founders fund",,,health,doll_2 b
dallas,ltk,united states,11/22/2021,,"softbank group, maverick capital",,,internet software & services,doll_2 b
,trax,singapore,7/22/2019,,"hopu investment management, boyu capital, dc thomson ventures",,,artificial intelligence,doll_2 b
croix,exotec,france,1/17/2022,,"breega capital, iris capital, 360 capital partners",,,hardware,doll_2 b
santa clara,dremio,united states,1/6/2021,,"lightspeed venture partners, redpoint ventures, norwest venture partners",,,data management & analytics,doll_2 b
jakarta,akulaku,indonesia,2/15/2022,,"dcm ventures, idg capital, siam commercial bank",,,e-commerce & direct-to-consumer,doll_2 b
santa clara,cloudinary,united states,2/15/2022,,"blackstone, bessemer venture partners",,,internet software & services,doll_2 b
aarhus,lunar,denmark,7/12/2021,,"seed capital, greyhound capital, socii capital",,,fintech,doll_2 b
mumbai,upgrad,india,8/9/2021,,"qualcomm ventures, accel, canaan partners",,,edtech,doll_2.25 b
boston,salsify,united states,4/13/2022,,"matrix partners, north bridge venture partners, venrock",,,internet software & services,doll_2 b
new york,certik,united states,3/31/2022,,"tiger global management, lightspeed venture partners, hillhouse capital management",,,cybersecurity,doll_2 b
shanghai,rox motor,china,4/29/2022,,"sequoia capital china, idg capital, qiming venture partners",,,auto & transportation,doll_2 b
new york,hugging face,united states,5/9/2022,,"betaworks ventures, addition, lux capital",,,artificial intelligence,doll_2 b
cambridge,devo technology,united states,10/26/2021,,"insight partners, kibo ventures, bessemer venture partners",,,data management & analytics,doll_2 b
sveta nedelja,rimac automobili,croatia,6/1/2022,,"porsche, 	investindustrial, softbank group",,,auto & transportation,doll_2 b
beijing,geek+,china,11/21/2018,,"volcanics ventures, vertex ventures china, warburg pincus",,,hardware,doll_2 b
new york,21.co,united states,9/6/2022,,"quiet ventures, etfs capital, collab+currency",,,fintech,doll_2 b
houston,solugen,united states,9/10/2021,,"fifty years fund, refactor capital, temasek",,,other,doll_2 b
seoul,zigbang,south korea,6/7/2022,,"black pearl ventures, stonebridge ventures, yuanta investment korea",,,mobile & telecommunications, doll_1.93 b
paris,ankorstore,france,1/10/2022	,,"global founders capital, aglae ventures, alven capital",,,e-commerce & direct-to-consumer,doll_1.98 b
beijing,fenbi education,china,	2/7/2021,,"trustbridge partners, hony capital, idg capital",,,edtech,doll_1.95 b
new york,invision,united states,11/1/2017,,"firstmark capital, tiger global management, iconiq capital",,,internet software & services,doll_1.9 b
shanghai,edaili,china,2/1/2019,,"k2vc, lightspeed china partners, sky9 capital",,,e-commerce & direct-to-consumer,doll_1.9 b
lehi,mx technologies,united states,1/13/2021,,"point72 ventures, pelion venture partners, commerce ventures",,,fintech,doll_1.9 b
bethesda,aledade,united states,1/19/2021,,"venrock, cvf capital partners, arch venture partners",,,health,doll_1.9 b
bangalore,coinswitch kuber,india,10/6/2021,,"tiger global management, sequoia capital india, ribbit capital",,,fintech,doll_1.9 b
irvine,acorns,united states,3/9/2022,,"e.ventures, bain capital ventures, greycroft",,,fintech,doll_1.9 b
oakland,roofstock,united states,3/10/2022,,"khosla ventures, bain capital ventures, lightspeed venture partners",,,fintech,doll_1.94 b
los angeles,thatgamecompany,united states,3/3/2022,,"benchmark, sequoia capital, tpg capital",,,internet software & services, doll_1.94  b
boston,concertai,united states,3/29/2022,,"sixth street partners, declaration partners, maverick ventures israel",,,artificial intelligence,doll_1.9 b
boca raton,material bank,united states,5/6/2022,,"bain capital ventures, softbank group, fifth wall ventures",,,e-commerce & direct-to-consumer,doll_1.9 b
bruchsal,volocopter,germany,3/4/2022,,"btov partners, geely, intel capital",,,auto & transportation,doll_1.87 b
shanghai,enovate,china,4/15/2019,,automobile industry guidance fund,,,auto & transportation,doll_1.85 b
seoul,megazone,south korea,8/16/2022,,"salesforce ventures, atp investment, kt investment",,,internet software & services,doll_1.83 b
boston,cfgi,united states,9/15/2021,,"the carlyle group, cvc capital partners",,,fintech,doll_1.85 b
new york,zocdoc,united states,8/20/2015,,"founders fund, khosla ventures, goldman sachs",,,health,doll_1.8 b
san francisco,diamond foundry,united states,3/29/2021,,"fashion tech lab, fidelity investments, vast ventures",,,other,doll_1.8 b
atlanta,fullstory,united states,8/4/2021,,"google ventures, kleiner perkins caufield & byers, stripes group",,,internet software & services,doll_1.8 b
jerusalem,lightricks,israel,7/31/2019,,"viola ventures, insight partners, claltech, goldman sachs",,,artificial intelligence,doll_1.8 b
new york,opentrons,united states,9/23/2021,,"sosv, khosla ventures, lerer hippeau",,,hardware,doll_1.8 b
bengaluru,slice,india,11/28/2021,,"gunosy capital, blume ventures, das capital",,,fintech,doll_1.8 b
brooklyn,cambrian biopharma,united states,10/26/2021,,"future ventures, apeiron investment group, moore capital management",,,health,doll_1.79 b
shanghai,aiways,china,4/16/2018,,"jiangsu sha steel group, shanghai puyin industry, funa yuanchuang technology",,,auto & transportation,doll_1.78 b
vancouver,trulioo,canada,6/7/2021,,"blumberg capital, american express ventures, bdc venture capital",,,cybersecurity,doll_1.75 b
gurugram,spinny,india,11/24/2021,,"general catalyst, eleation capital, avenir growth capital",,,e-commerce & direct-to-consumer,doll_1.75 b
denver,crusoe,united states,4/21/2022,,"bain capital ventures, founders fund, winklevoss capital",,,internet software & services,doll_1.75 b
portland,orca security,united states,3/23/2021,,"yl ventures, redpoint ventures, ggv capital",,,cybersecurity,doll_1.8 b
beijing,apus group,china,1/16/2015,,"redpoint ventures, qiming venture partners, chengwei capital",,,mobile & telecommunications,doll_1.73 b
new york,alphasense,united states,6/15/2022,,"viking global investors, gs growth, blackrock",,,artificial intelligence,doll_1.7 b
new york,harry's,united states,2/16/2018,,"thrive capital, tiger global management, temasek",,,consumer & retail,doll_1.7 b
san francisco,pax,united states,10/22/2018,,"tao capital partners, global asset capital, tiger global management",,,consumer & retail,doll_1.7 b
denver,dispatchhealth,united states,3/3/2021,,"alta partners, questa capital, echo health ventures",,,health,doll_1.7 b
greenwood village,pax8,united states,4/11/2022,,"liberty global ventures, sageview capital, blue cloud ventures",,,internet software & services,doll_1.7 b
london,multiverse,united kingdom,6/8/2022,,"lightspeed venture partners, google ventures, general catalyst",,,edtech,doll_1.7 b
san francisco,front,united states,6/28/2022,,"sequoia capital, uncork capital, salesforce ventures",,,internet software & services,doll_1.7 b
new york,redesign health,united states,9/13/2022,,"general catalyst, samsung next, cvs health partners",,,health,doll_1.7 b
cambridge,tessera therapeutics,united states,4/19/2022,,"altitude life science ventures, softbank group, alaska permanent fund",,,health,doll_1.69 b
new york,uniswap,united states,10/13/2022,,"a16z crypto, variant fund, paradigm",,,fintech,doll_1.66 b
,finaccel,singapore,8/15/2022,,"jungle ventures, square peg capital, openspace ventures",,,fintech,doll_1.66 b
new york,unite us,united states,3/16/2021,,"insight partners, sequoia capital, index ventures",,,health,doll_1.6 b
san francisco,circleci,united states,5/11/2021,,"threshold ventures, baseline ventures, harrison metal",,,internet software & services,doll_1.7 b
dakar,wave,senegal,9/7/2021,,"stripe, founders fund, partech partners",,,fintech,doll_1.7 b
paris,vestiaire collective,france,3/1/2021,,"eurazeo, idinvest partners, balderton capital",,,e-commerce & direct-to-consumer,doll_1.7 b
hanover,dragos,united states,10/28/2021,,"datatribe, energy impact partners, allegiscyber capital",,,cybersecurity,doll_1.7 b
redwood city,reltio,united states,11/4/2021,,"crosslink capital, .406 ventures, sapphire ventures",,,data management & analytics,doll_1.7 b
mountain view,h2o.ai,united states,11/7/2021,,"nexus venture partners, transamerica ventures, crane venture partners",,,artificial intelligence,doll_1.7 b
austin,zenbusiness,united states,11/9/2021,,"greycroft, lerer hippeau, geekdom fund",,,fintech,doll_1.7 b
selangor,carsome,malaysia,7/12/2021,,"gobi partners, 500 startups, ondine capital",,,e-commerce & direct-to-consumer,doll_1.7 b
san francisco,productboard,united states,2/2/2022,,"index ventures, kleiner perkins caufield & byers, bessemer venture partners",,,internet software & services,doll_1.7 b
los angeles,spotter,united states,2/16/2022,,"softbank group, access industries, crossbeam venture partners",,,fintech,doll_1.7 b
san francisco,optimism,united states,3/17/2022,,"paradigm, huobi ventures, andreessen horowitz",,,internet software & services,doll_1.65 b
san francisco,incredible health,united states,8/17/2022,,"obvious ventures, andreessen horowitz, nfx",,,health,doll_1.65 b
beijing,jusfoun big data,china,7/9/2018,,"boxin capital, dt capital partners, idg capital",,,data management & analytics,doll_1.62 b
san francisco,transcarent,united states,1/11/2022,,"alta partners, general catalyst, jove equity partners",,,health,doll_1.62 b
bengaluru,dealshare,india,1/27/2022,,"alpha wave global, matrix partners india, tiger global management",,,e-commerce & direct-to-consumer,doll_1.7 b
chongqing,zhubajie,china,6/16/2015,,"cybernaut growth fund, idg capital",,,internet software & services,doll_1.61 b
berlin,solarisbank,germany,7/13/2021	,,"yabeo capital, sbi investment, vulcan capital",,,fintech,doll_1.65 b
santa clara,datastax,united states,5/26/2021	,,"crosslink capital, meritech capital partners, lightspeed venture partners",,,data management & analytics,doll_1.6 b
waltham,infinidat,united states,4/29/2015,,"tpg growth, goldman sachs",,,hardware,doll_1.6 b
hamilton,afiniti,bermuda,4/14/2017,,gam holding,,,artificial intelligence,doll_1.6 b
hangzhou,cao cao mobility,china,1/17/2018,,"people electrical appliance group china, zhongrong international trust",,,auto & transportation,doll_1.6 b
sunnyvale,clari,united states,3/3/2021,,"sequoia capital, bain capital ventures, enaya capital",,,internet software & services,doll_2.6 b
san francisco,tonal,united states,3/31/2021,,"mayfield fund, shasta ventures, l catterton",,,e-commerce & direct-to-consumer,doll_1.6 b
burnaby,clio,canada,4/27/2021,,"omers private equity, t. rowe price, technology crossover ventures",,,internet software & services,doll_1.6 b
sydney,safetyculture,australia,5/3/2021,,"blackbird ventures, indexventures, tiger global management",,,internet software & services,doll_1.6 b
san francisco,monte carlo,united states,5/24/2022,,"ggv capital, accel, redpoint ventures",,,artificial intelligence,doll_1.6 b
san francisco,cresta,united states,3/17/2022,,"andreessen horowitz, greylock partners, sequoia capital",,,artificial intelligence,doll_1.6 b
san francisco,extend,united states,5/18/2021,,"greatpoint ventures, meritech capital partners, paypal ventures",,,fintech,doll_1.36 b
cambridge,generate biomedicines,united states,11/18/2021,,"altitude life science ventures. t. rowe price, morningside venture partners",,,health,doll_1.36 b
lysaker,cognite,norway,5/19/2021,,"technology crossover ventures, accel, aker",,,data management & analytics,doll_1.5 b
new york,asapp,united states,5/19/2021,,"march capital partners, hof capital, emergence capital partners",,,artificial intelligence,doll_1.6 b
tokyo,smarthr,japan,6/8/2021,,"beenext, world innovation lab, light street capital",,,fintech,doll_1.6 b
san francisco,mercury,united states,7/3/2021,,"andreessen horowitz, coatue management, clocktower technology ventures",,,fintech,doll_1.6 b
san francisco,homelight,united states,9/2/2021,,"zeev ventures, menlo ventures,crosslink capital",,,fintech,doll_1.7 b
hayward,truepill,united states,10/27/2021,,"initialized capital, sound ventures, ti platform management",,,health,doll_1.6 b
boston,ezcater,united states,4/2/2019,,"insight venture partners, iconiq capital, launchpad venture group",,,"supply chain, logistics, & delivery",doll_1.6 b
dublin,wayflyer,ireland,2/1/2022,,"qed investors, dst global, left lane capital",,,fintech,doll_1.6 b
new york,capitolis,united states,3/22/2022,,"sequoia capital, index ventures, s capital",,,fintech,doll_1.6 b
vilnius,nord security,lithuania,4/7/2022,,"general catalyst, baltcap, novator partners",,,cybersecurity,doll_1.6 b
san francisco,vanta,united states,6/7/2022,,"craft ventures, sequoia capital, verissimo ventures",,,cybersecurity,doll_1.6 b
san francisco,magic eden,united states,6/21/2022,,"sequoia capital, lightspeed venture partners, paradigm",,,fintech,doll_1.6 b
san francisco,pave,united states,6/28/2022,,"y combinator, 	andreessen horowitz, bessemer venture partners",,,internet software & services,doll_1.6 b
bryanston,promasidor holdings,south africa,11/8/2016,,"ifc, ajinomoto",,,consumer & retail,doll_1.59 b
beijing,galaxyspace,china,11/17/2020,,"shunwei capital partners, 5y capital, legend capital",,,mobile & telecommunications,doll_1.58 b
austin,icon 3d,united states,2/18/2022,,"moderne ventures, oakhouse partners, bjarke ingels group",,,hardware, doll_1.57  b
chengdu,fresh life style supply chain management,china,3/11/2022,,"guiyang venture capital, longfor capital, caogenzhiben group",,,"supply chain, logistics, & delivery", doll_1.57  b
new york,alloy,united states,9/30/2021,,"bessemer venture partners, eniac ventures, canapi ventures",,,fintech,doll_1.55 b
beijing,baiwang,china,3/25/2019,,"guozhong venture capital management, shenzhen capital group, oriental fortune capital",,,fintech,doll_1.55 b
shanghai,iluvatar corex,china,3/1/2021,,"centurium capital, cedarlake capital, unicom innovation venture capital",,,hardware,doll_1.55 b
