,company,valuation,datejoined,country,city,industry,selectinvestors
214,Digit Insurance,$4,1/15/2021,India,Bengaluru,Fintech,"Fairfax Financial Holdings, A91 Partners, TVS Capital"
215,Abnormal Security,$4,5/10/2022,United States,San Francisco,Cybersecurity,"Greylock Partners, Insight Partners,Menlo Ventures"
216,Medlinker,$3.92,7/31/2018,China,Chengdu,Health,"China Health Industry Investment Fund, China Renaissance, and Sequoia Capital China"
217,Intarcia Therapeutics,$3.8,4/1/2014,United States,Boston,Health,"New Enterprise Associates, New Leaf Venture Partners, Charter Venture Capital"
218,StockX,$3.8,6/26/2019,United States,Detroit,E-commerce & direct-to-consumer,"Google Ventures, Battery Ventures, DST Global"
219,MessageBird,$3.8,10/8/2020,Netherlands,Amsterdam,Mobile & telecommunications,"Y Combinator, Atomico, Accel"
220,Convoy,$3.8,9/21/2018,United States,Seattle,"Supply chain, logistics, & delivery","Greylock Partners, capitalG, Y Combinator"
221,Articulate,$3.75,7/1/2021,United States,New York,Edtech,"Blackstone, ICONIQ Growth, General Atlantic"
222,Dutchie,$3.75,3/16/2021,United States,Bend,E-commerce & direct-to-consumer,"Casa Verde Capital, Gron Ventures, Thrity Five Ventures"
223,Cohesity,$3.7,6/11/2018,United States,San Jose,Data management & analytics,"SoftBank Group, Sequoia Capital, Wing Venture Capital"
224,VAST Data,$3.7,4/16/2020,United States,New York,Data management & analytics,"Norwest Venture Partners, Goldman Sachs, Dell Technologies Capital"
225,GOAT,$3.7,9/23/2020,United States,Culver City,E-commerce & direct-to-consumer,"Upfront Ventures, Webb Investment Network, D1 Capital Partners"
226,Noom,$3.7,5/24/2021,United States,New York,Health,"Qualcomm Ventures, Samsung Ventures, Silver Lake"
227,Redwood Materials,$3.7,7/28/2021,United States,Carson City,Other,"Breakthrough Energy Ventures, Capricorn Investment Group, Valor Equity Partners"
228,Papaya Global,$3.7,3/4/2021,United States,New York,Internet software & services,"Bessemer Venture Partners, Insight Partners, New Era Ventures"
229,Abogen,$3.7,11/29/2021,China,Suzhou,Health,"Hillhouse Capital Management, SoftBank Group, Qiming Venture Partners"
230,Harness,$3.7,1/14/2021,United States,San Francisco,Artificial intelligence,"Menlo Ventures, Alkeon Capital Management, Citi Ventures"
231,Whatnot,$3.7,9/16/2021,United States,Marina del Rey,E-commerce & direct-to-consumer,"Y Combinator, Andreessen Horowitz, Wonder Ventures"
232,Autograph,$3.66,1/20/2022,United States,Santa Monica,Internet software & services,01 Advisors. Kleiner Perkins Caufield & Byers. Andreessen Horowitz
233,Relativity,$3.6,3/18/2021,United States,Chicago,Internet software & services,"Silver Lake, ICONIQ Capital"
234,Whoop,$3.6,10/28/2020,United States,Boston,E-commerce & direct-to-consumer,"NextView Ventures, Promus Ventures, Two Sigma Ventures"
235,Applied Intuition,$3.6,10/22/2020,United States,Sunnyvale,Auto & transportation,"Andreessen Horowitz, Lux Capital, General Catalyst"
236,Course Hero,$3.6,2/12/2020,United States,Redwood City,Edtech,"NewView Capital, Maveron, Ridge Ventures"
237,SpotOn,$3.6,5/26/2021,United States,San Francisco,Fintech,"Dragoneer Investment Group, DST Global, Franklin Templeton"
238,Otto Bock HealthCare,$3.52,6/24/2017,Germany,Duderstadt,Health,EQT Partners
239,Indigo Ag,$3.5,9/26/2017,United States,Boston,Artificial intelligence,"Activant Capital Group, Alaska Permanent Fund, Baillie Gifford & Co."
240,HyalRoute,$3.5,5/26/2020,Singapore,,Mobile & telecommunications,Kuang-Chi
241,Rec Room,$3.5,3/23/2021,United States,Seattle,Internet software & services,"First Round Capital, Sequoia Capital, Index Ventures"
242,Commure,$3.5,9/16/2021,United States,San Francisco,Internet software & services,"General Catalyst, HCA Healthcare"
243,Mirakl,$3.5,9/22/2020,France,Paris,E-commerce & direct-to-consumer,"Elaia Partners, 83North, Felix Capital"
244,Tekion,$3.5,10/21/2020,United States,San Ramon,Internet software & services,"Airbus Ventures, Index Ventures, Advent International"
245,Celsius Network,$3.5,10/12/2021,United States,Hoboken,Fintech,"WestCap Group, Caisse de depot et placement du Quebec"
246,GoStudent,$3.5,6/22/2021,Austria,Vienna,Edtech,"DN Capital, Left Lane Capital, Coatue Management"
247,Highspot,$3.5,2/22/2021,United States,Seattle,Internet software & services,"Madrona Venture Group, Shasta Ventures, Salesforce Ventures"
248,Handshake,$3.5,5/12/2021,United States,San Francisco,Internet software & services,"Kleiner Perkins Caufield & Byers, Lightspeed Venture Partners, True Ventures"
249,ChargeBee Technologies,$3.5,4/20/2021,United States,San Francisco,Fintech,"Insight Partners, Tiger Global Management, Accel"
250,Flock Safety,$3.5,7/13/2021,United States,Atlanta,Hardware,"Matrix Partners, Initialized Capital, Tiger Global Management"
251,Helion Energy,$3.50,11/5/2021,United States,Redmond,Other,"Mithril Capital Management, Y Combinator, Capricorn Investment Group"
252,Acronis,$3.5,9/18/2019,Switzerland,Schaffhausen,Cybersecurity,"Goldman Sachs, VebVentures, Insight Partners"
253,Unacademy,$3.44,9/2/2020,India,Bengaluru,Edtech,"Blume Ventures, Nexus Venture Partners, Sequoia Capital India"
254,MoonPay,$3.4,11/22/2021,United States,Miami,Fintech,"New Enterprise Associates, Coatue Management, Tiger Global Management"
255,Upstox,$3.4,11/29/2021,India,Mumbai,Fintech,"Tiger Global Management, Kalaari Capital"
256,Improbable,$3.36,5/11/2017,United Kingdom,London,Other,"Andreessen Horowitz, SoftBank Group, Temasek Holdings"
257,Youxia Motors,$3.35,4/2/2018,China,Shanghai,Auto & transportation,"China Environmental Protection Industry, China Fortune Ocean"
258,OwnBackup,$3.35,1/28/2021,United States,Englewood Cliffs,Data management & analytics,"Insight Partners, Salesforce Ventures, Vertex Ventures"
259,Starburst,$3.35,1/6/2021,United States,Boston,Data management & analytics,"Index Ventures, Coatue Management, Andreessen Horowitz"
260,Starling Bank,$3.34,3/8/2021,United Kingdom,London,Fintech,"JTC Group, Qatar Investment Authority, Fidelity Investment"
261,ECARX,$3.31,10/26/2020,China,Wuhan,Auto & transportation,"Geely, SIG Asia Investments, China State Capital Venture Capital Fund"
262,Sila Nanotechnologies,$3.3,4/16/2019,United States,Alameda,Other,"Bessemer Venture Partners, Sutter Hill Ventures, Matrix Partners"
263,Scopely,$3.3,10/29/2019,United States,Culver City,Mobile & telecommunications,"Greycroft, Sands Capital, Revolution Growth"
264,Komodo Health,$3.3,5/22/2020,United States,San Francisco,Health,"Andreessen Horowitz, IA Ventures, Felicis Ventures"
265,Kurly,$3.3,7/9/2021,South Korea,Seoul,"Supply chain, logistics, & delivery","Sequoia Capital China, DST Global, DST Global"
266,Cars24,$3.3,11/24/2020,India,Gurgaon,E-commerce & direct-to-consumer,"Moore Strategic Ventures, DST Global, Sequoia Capital India"
267,BlockDaemon,$3.25,9/21/2021,United States,Los Angeles,Fintech,"BOLDstart Ventures, Lerer Hippeau, Kenetic Capital"
268,Dadi Cinema,$3.24,5/11/2016,China,Shenzhen,Other,Alibaba Pictures Group
269,Aiven,$3.21,10/18/2021,Finland,Helsinki,Internet software & services,"Institutional Venture Partners, Atomico, Earlybird Venture Capital"
270,Astera Labs,$3.2,11/17/2022,United States,Santa Clara,Hardware,"Intel Capital, Sutter Hill Ventures, VentureTech"
271,Thumbtack,$3.2,9/29/2015,United States,San Francisco,E-commerce & direct-to-consumer,"Tiger Global, Sequoia Capital, Google Capital"
272,Cedar,$3.2,3/9/2021,United States,New York,Fintech,"Thrive Capital, Founders Fund, Cocnord Health Partners"
273,Eruditus Executive Education,$3.2,8/12/2021,India,Mumbai,Edtech,"Sequoia Capital India, Softbank, Bertelsmann India Investments"
274,Blockstream,$3.2,8/24/2021,Canada,Vancouver,Fintech,"AME Cloud Ventures, Future Perfect Ventures, Blockchain Capital"
275,Innovaccer,$3.2,2/19/2021,United States,San Francisco,Health,"M12, WestBridge Capital, Lightspeed Venture Partners"
276,Ironclad,$3.2,1/18/2022,United States,Sacramento,Internet software & services,"Accel, Sequoia Capital, Y Combinator"
277,Skims,$3.2,4/9/2021,United States,Los Angeles,E-commerce & direct-to-consumer,"Thrive Capital, Alliance Consumer Growth, Imaginary Ventures"
278,Eikon Therapeutics, $3.2,1/6/2022,United States,Hayward,Health,"The Column Group, Foresite Capital, Foresite Capital"
279,Retool,$3.2,12/22/2021,United States,San Francisco,Internet software & services,Sequoia Capital
280,Verkada,$3.2,1/29/2020,United States,San Mateo,Cybersecurity,"next47, First Round Capital, Sequoia Capital"
281,PsiQuantum,$3.15,7/27/2021,United States,Palo Alto,Hardware,"Playground Global, M12, BlackRock"
282,Udaan,$3.1,9/4/2018,India,Bengaluru,"Supply chain, logistics, & delivery","DST Global, Lightspeed Venture Partners, Microsoft ScaleUp"
283,HighRadius,$3.1,1/7/2020,United States,Houston,Fintech,"Susquehanna Growth Equity, Citi Ventures, ICONIQ Capital"
284,Nuvemshop,$3.1,8/17/2021,Brazil,Sao Paulo,E-commerce & direct-to-consumer,"Kaszek Ventures, Qualcomm Ventures, Accel"
285,Yixia,$3,11/24/2015,China,Beijing,Mobile & telecommunications,"Sequoia Capital China, Sina Weibo, Kleiner Perkins Caufield & Byers, Redpoint Ventures"
286,Traveloka,$3,1/1/2017,Indonesia,Jakarta,Travel,"Global Founders Capital, East Ventures, Expedia Inc."
287,SouChe Holdings,$3,11/1/2017,China,Hangzhou,E-commerce & direct-to-consumer,"Morningside Ventures, Warburg Pincus, CreditEase Fintech Investment Fund"
288,BGL Group,$3,11/24/2017,United Kingdom,Peterborough,Fintech,CPP Investment Board
289,Circle,$3,5/15/2018,United States,Boston,Fintech,"General Catalyst, Digital Currency Group, Accel"
290,Zuoyebang,$3,7/18/2018,China,Beijing,Edtech,"Sequoia Capital China, Xiang He Capital, GGV Capital"
291,FlixMobility,$3,7/18/2019,Germany,Munich,Auto & transportation,"Holtzbrinck Ventures, Unternehmertum Venture Capital, General Atlantic"
292,Wildlife Studios,$3,12/5/2019,Brazil,Sao Paulo,Other,"Benchmark, Bessemer Venture Partners"
293,ApplyBoard,$3.2,5/5/2020,Canada,Kitchener,Edtech,"Artiman Ventures, Plug and Play Ventures, Anthos Capital"
294,Forter,$3,11/19/2020,United States,New York,Cybersecurity,"Sequoia Capital Israel, Scale Venture Partners, Commerce Ventures"
295,Calendly,$3,1/26/2021,United States,Atlanta,Internet software & services,"ICONIQ Capital, OpenView Venture Partners"
296,BlockFi,$3,3/11/2021,United States,Jersey City,Fintech,"ConsenSys Ventures, Valar Ventures, PUC"
297,ActiveCampaign,$3,4/21/2021,United States,Chicago,Internet software & services,"Silversmith Capital Partners, Susquehanna Growth Equity, Tiger Global Management"
298,CMR Surgical,$3,9/17/2019,United Kingdom,Cambridge,Health,"Cambridge Innovation Capital, LGT Capital Partners, Escala Capital"
299,Lucid Software,$3,6/29/2021,United States,South Jordan,Internet software & services,"Spectrum Equity, ICONIQ Capital, Grayhawk Capital"
300,Age of Learning,$3,5/3/2016,United States,Glendale,Edtech,Iconiq Capital
301,Carbon Health,$3,7/21/2021,United States,San Francisco,Health,"Brookfield Asset Management, Blackstone, Data Collective"
302,Contentful,$3,7/28/2021,Germany,Berlin,Internet software & services,"Balderton Capital, General Catalyst, Tiger Global Management"
303,LaunchDarkly,$3,8/10/2021,United States,Oakland,Internet software & services,"Uncork Capital, Threshold Ventures, Bloomberg Beta"
304,Seismic,$3,12/18/2018,United States,San Diego,Internet software & services,"Jackson Square Ventures, General Atlantic, Lightspeed Venture Partners"
305,Grafana Labs,$3,3/25/2021,United States,New York,Internet software & services,"Lightspeed Venture Partners, Lead Edge Capital, Coatue Management"
306,Gorillas,$3.1,3/25/2021,Germany,Berlin,"Supply chain, logistics, & delivery","Coatue Management, Atlantic Food Labs, DST Global"
307,Sky Mavis,$3,10/4/2021,Vietnam,Ho Chi Minh City,Internet software & services,"Fabric Ventures, 500 Global, Standard Crypto"
308,Outschool,$3,4/14/2021,United States,San Francisco,Edtech,"Uniion Square Ventures, Tiger Global Management, Lightspeed Venture Capital"
309,TradingView,$3,10/14/2021,United States,Westerville,Fintech,"Tiger Global Management, Insight Partners, Jump Capital"
310,Groww,$3,4/7/2021,India,Bengaluru,Fintech,"Tiger Global Management, Sequoia Capital India, Ribbit Capital"
311,Podium,$3,4/7/2020,United States,Lehi,Internet software & services,"Accel, Summit Partners, Google Ventures"
312,Via,$3.3,3/30/2020,United States,New York,Auto & transportation,"83North, RiverPark Ventures, Pitango Venture Capital"
313,Anchorage Digital,$3,12/15/2021,United States,San Francisco,Fintech,"Andreessen Horowitz, Blockchain Capital, Lux Capital"
314,Inxeption,$3,1/13/2022,United States,San Francisco,Fintech,"Coatue Management, BMO Capital, Schonfeld Strategic Advisors"
315,Lattice,$3,3/23/2021,United States,San Francisco,Internet software & services,"Khosla Ventures, Thrive Capital, Y Combinator"
316,Flutterwave,$3,3/9/2021,United States,San Francisco,Fintech,"Green Visor Capital, CRE Venture Capital, Greycroft"
317,Amber Group,$3,6/21/2021,Hong Kong,,Fintech,"Tiger Global Management, Tiger Brokers, DCM Ventures"
318,Cross River Bank,$3,2/11/2022,United States,Fort Lee,Fintech,"Battery Ventures, Andreessen Horowitz, Ribbit Capital"
319,Remote,$3,7/13/2021,United States,San Francisco,Fintech,"Index Ventures, Sequoia Capital, General Catalyst"
320,Sentry,$3,2/18/2021,United States,San Francisco,Other,"New Enterprise Associates, Accel, Bond"
321,Kraken,$2.92,6/25/2019,United States,San Francisco,Fintech,"Bnk To The Future, Trammell Ventures, SBI Investment"
322,OpenAI,$2.92,7/22/2019,United States,San Francisco,Artificial intelligence,Khosla Ventures
323,Workrise,$2.9,9/30/2019,United States,Austin,Internet software & services,"Founders Fund, Quantum Energy Partners, Bedrock Capital"
324,Loft,$2.9,1/3/2020,Brazil,Sao Paulo,E-commerce & direct-to-consumer,"Monashees+, Andreessen Horowitz, QED Investors"
325,DriveWealth,$2.85,8/20/2021,United States,Chatham,Fintech,"Point72 Ventures, Route 66 Ventures, Accel"
326,Flink,$2.85,12/1/2021,Germany,Berlin,E-commerce & direct-to-consumer,"Mubadala Capital, Bond, Prosus Ventures"
327,Alan,$2.85,4/19/2021,France,Paris,Fintech,"Index Ventures, Temasek, Portag3 Ventures"
328,Meicai,$2.8,6/22/2016,China,Beijing,Mobile & telecommunications,"Tiger Global Management, Blue Lake Capital, ZhenFund"
329,Zipline,$2.8,5/20/2019,United States,South San Francisco,"Supply chain, logistics, & delivery","Sequoia Capital, Baillie Gifford & Co., Google Ventures"
330,Graphcore,$2.77,12/18/2018,United Kingdom,Bristol,Artificial intelligence,"Dell Technologies Capital, Pitango Venture Capital, Amadeus Capital Partners"
331,Illumio,$2.75,4/14/2015,United States,Sunnyvale,Cybersecurity,"Data Collective, Formation 8, General Catalyst Partners"
332,MasterClass,$2.75,5/13/2021,United States,San Francisco,Edtech,"Institutional Venture Partners, New Enterprise Associates, Javelin Venture Partners"
333,Dream Games,$2.75,6/30/2021,Turkey,Istanbul,Mobile & telecommunications,"Makers Fund, Index Ventures, Inova Ventures Participacees"
334,Transmit Security,$2.74,6/22/2021,Israel,Tel Aviv,Cybersecurity,"General Atlantic, Insight Partners, Vintage Investment Partners"
335,Hozon Auto,$3.95,2/22/2022,China,Shanghai,Auto & transportation,"HD Capital, Qihoo 360 Technology, China Fortune Land Development"
336,Tradeshift,$2.7,5/30/2018,United States,San Francisco,Fintech,"Notion Capital, Scentan Ventures, Kite Ventures"
337,Nextiva,$2.7,9/14/2021,United States,Scottsdale,Internet software & services,Goldman Sachs Asset Management
338,Tridge,$2.7,8/24/2022,South Korea,Seoul,Internet software & services,"Forest Partners, Softbank Ventures Asia"
339,o9 Solutions,$2.7,4/28/2020,United States,Dallas,Artificial intelligence,KKR
340,Thought Machine,$2.7,11/29/2021,United Kingdom,London,Fintech,"British Patient Capital, SEB Venture Capital, IQ Capital"
341,BackBase,$2.66,6/9/2022,Netherlands,Amsterdam,Fintech,Motive Partners
342,ManoMano,$2.6,7/5/2021,France,Paris,E-commerce & direct-to-consumer,"General Atlantic, Piton Capital, Partech Partners"
343,Sourcegraph,$2.62,7/13/2021,United States,San Francisco,Internet software & services,"Redpoint Ventures, Goldcrest Capital, Insight Partners"
344,Pendo,$2.6,10/17/2019,United States,Raleigh,Internet software & services,"Contour Venture Partners, Battery Ventures, Core Capital Partners"
345,Plume,$2.6,2/23/2021,United States,Palo Alto,Internet software & services,"Insight Partners, Jackson Square Ventures, Liberty Gloval Ventures"
346,Moglix,$2.6,5/17/2021,Singapore,,E-commerce & direct-to-consumer,"Jungle Ventures, Accel, Venture Highway"
347,Axonius,$2.6,3/1/2021,United States,New York,Cybersecurity,"Vertex Ventures Israel, Bessemer Venture Partners, Emerge"
348,Xinchao Media,$2,4/9/2018,China,Chengdu,Internet software & services,"JD.com, Baidu, Vision Plus Capital"
349,JumpCloud,$2.62,9/13/2021,United States,Louisville,Data management & analytics,"Foundry Group, General Atlantic, BlackRock"
350,Unico,$2.6,8/3/2021,Brazil,Sao Paulo,Artificial intelligence,"Big Bets, General Atlantic, SOFTBANK Latin America Ventures"
351,Oura,$2.55,4/5/2022,Finland,Oulu,Health,"Forerunner Ventures, Lifeline Ventures, MSD Capital"
352,Eat Just,$2.59,11/30/2017,United States,San Francisco,Consumer & retail,"Khosla Ventures, Horizons Ventures, Founders Fund"
353,Cribl,$2.5,8/25/2021,United States,San Francisco,Data management & analytics,"Institutional Venture Partners, CRV, Sequoia Capital"
354,Jetti Resources,$2.5,10/24/2022,United States,Boulder,Other,"BMW i Ventures, BHP Ventures"
355,Vista Global,$2.5,8/23/2017,United Arab Emirates,Dubai,Other,Rhone Capital
356,BYTON,$2.5,4/20/2018,China,Nanjing,Auto & transportation,"FAW Group, Tencent Holdings, Tus Holdings"
357,Side,$2.5,3/22/2021,United States,San Francisco,Internet software & services,"Coatue Managemeny, Trinity Ventures, Matrix Partners"
358,Infra.Market,$2.5,2/25/2021,India,Thane,E-commerce & direct-to-consumer,"Accel, Tiger Global Management, Nexus Venture Partners"
359,Varo Bank,$2.5,9/9/2021,United States,San Francisco,Fintech,"Warburg Pincus, The Rise Fund, HarbourVest Partners"
360,Cato Networks,$2.5,11/17/2020,Israel,Tel Aviv,Cybersecurity,"Aspect Ventures, SingTel Innov8, Greylock Partners"
361,Aura,$2.5,6/9/2021,United States,Burlington,Cybersecurity,"Warburg Pincus, General Catalyst"
362,Vercel,$2.5,6/23/2021,United States,San Francisco,Internet software & services,"CRV, Accel, Google Ventures"
363,Sysdig,$2.5,4/28/2021,United States,San Francisco,Cybersecurity,"Accel, Bain Capital Ventures, Insight Partners"
364,Zetwerk,$2.68,8/20/2021,India,Bengaluru,Internet software & services,"Sequoia Capital India, Kae Capital, Accel"
365,Uniphore,$2.5,2/16/2022,United States,Palo Alto,Artificial Intelligence,"Chiratae Ventures, March Capital Partners, National Grid Partners"
366,Somatus,$2.5,2/23/2022,United States,McLean,Health,"The Blue Venture Fund, Flare Capital Partners, Longitude Capital"
367,Immutable,$2.5,3/7/2022,Australia,Sydney,Fintech,"Fabric Ventures, AirTree Ventures, Temasek"
368,A24 Films,$2.5,3/9/2022,United States,New York,Other,"Stripes Group, Neuberger Berman"
369,SiFive,$2.5,3/16/2022,United States,San Mateo,Hardware,"Sutter Hill Ventures, Osage University Partners, Spark Capital"
370,Games24x7,$2.5,3/30/2022,India,Mumbai,Internet software & services,"Tiger Global Management, The Raine Group, Malabar Investments"
371,Fetch Rewards,$2.5,3/31/2021,United States,Madison,E-commerce & direct-to-consumer,"Greycroft, Loeb.NYC, DST Global"
372,Coda Payments,$2.5,4/15/2022,Singapore,,Fintech,"GIC. Apis Partners, Insight Partners"
373,DriveNets,$2.5,1/27/2021,Israel,Ra'anana,Internet software & services,"Bessemer Venture Partners, Pitango Venture Capital, D1 Capital Partners"
374,Hibob,$2.45,10/12/2021,Israel,Tel Aviv,Internet software & services,"Bessemer Venture Partners, Eight Roads Ventures, Battery Ventures"
375,Uala,$2.45,8/13/2021,Argentina,Buenos Aires,Fintech,"Soros Fund Management, Ribbit Capital, Monashees+"
376,Mobile Premier League,$2.45,9/15/2021,India,Bengaluru,Internet software & services,"Sequoia Capital India, RTP Global, Go-Ventures"
377,Cybereason,$2.44,8/6/2019,United States,Boston,Cybersecurity,"SoftBank Group, CRV, Spark Capital"
378,Cgtz,$2.41,2/21/2017,China,Hangzhou,Fintech,"Shunwei Capital Partners, China Media Group, Guangzhou Huiyin Aofeng Equity Investment Fund"
379,Star Charge,$2.41,5/19/2021,China,Changzhou,Auto & transportation,"Shunwei Capital Partners, China Media Group, Guangzhou Huiyin Aofeng Equity Investment Fund"
380,EquipmentShare,$2.41,5/1/2020,United States,Columbia,Fintech,"Romulus Capital, Insight Partners, RedBird Capital Partners"
381,Carbon,$2.4,8/20/2015,United States,Redwood City,Hardware,"Google Ventures, Sequoia Capital, Wakefield Group"
382,Rokt,$2.4,12/16/2021,United States,New York,Internet software & services,"Square Peg Capital, TDM Growth Partners, Tiger Global Management"
383,PolicyBazaar,$2.4,5/6/2019,India,Gurgaon,Fintech,"Info Edge, Softbank Capital"
384,Paxos,$2.4,4/29/2021,United States,New York,Fintech,"Liberty City Ventures, RRE Ventures, Mithril Capital Management"
385,Exabeam,$2.4,6/1/2021,United States,Foster City,Cybersecurity,"Norwest Venture Partners, Aspect Ventures, Lightspeed Venture Partners"
386,BitSight Technologies,$2.4,9/13/2021,United States,Boston,Cybersecurity,"Menlo Ventures, GGV Capital, Flybridge Capital Partners"
387,Trumid,$2.4,7/15/2020,United States,New York,Fintech,"T. Rowe Price, Dragoneer Investment Group, BlackRock"
388,ABL Space Systems,$2.4,3/25/2021,United States,El Segundo,Other,"T. Rowe Price, Lockheed Martin Ventures, Fidelity Investment"
389,HoneyBook,$2.4,5/4/2021,United States,San Francisco,Internet software & services,"Norwest Venture Partners, Hillsven Capital, Aleph"
390,Beta Technologies,$2.4,4/19/2022,United States,South Burlington,Other,"The Rise Fund, Fidelity Investments. RedBird Capital Partners"
391,Project44,$2.62,6/1/2021,United States,Chicago,"Supply chain, logistics, & delivery","Emergence Capital Partners, 8VC, Chicago Ventures"
392,Freenome,$2.62,8/26/2020,United States,South San Francisco,Health,"Andreessen Horowitz, Data Collective, Roche Venture Fund"
393,ManyPets,$2.35,6/1/2021,United Kingdom,London,Fintech,"Octopus Ventures, Munich Re Ventures, CommerzVentures"
394,Jobandtalent,$2.35,12/1/2021,Spain,Madrid,Internet software & services,"Kibo Ventures, SoftBank Group, Atomico"
395,WEMAKEPRICE,$2.34,9/9/2015,South Korea,Seoul,E-commerce & direct-to-consumer,"IMM Investment, NXC"
396,Biren Technology,$2.32,8/18/2020,China,Shanghai,Hardware,"V FUND, IDG Capital, Green Pine Capital Partners"
397,Voodoo,$2.31,8/17/2020,France,Paris,Other,"Tencent Holdings, Goldman Sachs"
398,Uptake,$2.3,10/27/2015,United States,Chicago,Artificial intelligence,"Revolution, New Enterprise Associates, Caterpillar"
399,Motive,$2.85,4/23/2019,United States,San Francisco,"Supply chain, logistics, & delivery","Google Ventures, Index Ventures, Scale Venture Partners"
400,Greenlight,$2.3,9/24/2020,United States,Atlanta,Fintech,"Relay Ventures, TTV Capital, Canapi Ventures"
401,Bowery Farming,$2.3,5/25/2021,United States,New York,Other,"Temasek, Google Ventures, General Catalyst"
402,Odoo,$2.3,7/29/2021,Belgium,Louvain-la-Neuve,Internet software & services,"Summit Partners, Noshaq, Sofinnova Partners"
403,MoMo,$2.27,12/10/2021,Vietnam,Ho Chi Minh City,Fintech,"Goodwater Capital, Warburg Pincus, GS Growth"
404,Zume,$2.25,11/1/2018,United States,Mountain View,Consumer & retail,"Softbank Group, AME Cloud Ventures, SignalFire"
405,Algolia,$2.25,7/28/2021,United States,San Francisco,Internet software & services,"Accel, Alven Capital, Storm Ventures"
406,Pattern,$2.25,10/6/2021,United States,Lehi,Internet software & services,"Knox Lane, Ainge Advisory, Carlson Private Capital Partners"
407,Newfront Insurance,$2.2,4/12/2022,United States,San Francisco,Fintech,"Founders Fund, Meritech Capital Partners, GS Growth"
408,NuCom Group,$2.2,2/22/2018,Germany,Unterfoehring,Other,General Atlantic
409,MUSINSA,$2.2,11/11/2019,South Korea,Seoul,E-commerce & direct-to-consumer,Sequoia Capital
410,Current,$2.2,4/27/2021,United States,New York,Fintech,"Expa, QED Investors, Foundation Capital"
411,Bitso,$2.2,5/5/2021,Mexico,Mexico City,Fintech,"Pantera Capital, QED Investors, Coinbase Ventures"
412,Gympass,$2.2,6/12/2019,United States,New York,Internet software & services,"General Atlantic, SoftBank Group, Atomico"
413,Dialpad,$2.2,10/6/2020,United States,San Francisco,Internet software & services,"Andreessen Horowitz, Google Ventures, Section 32"
414,G7 Networks,$2.2,2/15/2022,China,Beijing,"Supply chain, logistics, & delivery","Eastern Bell Capital 32, SDIC CMC Investment Management, Trustbridge Partners"
415,BloomReach,$2.2,2/23/2022,United States,Mountain View,Artificial intelligence,"Bain Capital Ventures, Sixth Street Growth, Lightspeed Venture Partners"
416,Motif FoodWorks, $2.20 ,6/16/2021,United States,Boston,Consumer & retail ,"General Atlantic, Breakthrough Energy Ventures, Viking Global Investors"
417,Huaqin Telecom Technology,$2.19,10/8/2019,China,Shanghai,Mobile & telecommunications,"Zhangjiang Haocheng Venture Capital, Walden International, Intel Capital"
418,Accelerant,$2.19,1/12/2022,United Kingdom,Colchester,Other,"Deer Park Road, Altamont Capital Partners, Eldridge"
419,Hesai Tech,$2.18,8/1/2020,China,Shanghai,Artificial intelligence,"Lightspeed China Partners, Baidu Ventures, Qiming Venture Partners"
420,YITU Technology,$2.17,3/8/2018,China,Shanghai,Artificial intelligence,"Sequoia Capital China, Banyan Capital"
421,Addepar,$2.17,6/15/2021,United States,Mountain View,Fintech,"8VC, D1 Capital Partners, Sway Ventures"
422,Qualia,$2.17,12/21/2020,United States,San Francisco,Fintech,"8VC, Menlo Ventures, Tiger Global Management"
423,Neo4j,$2,6/17/2021,United States,San Mateo,Data management & analytics,"Eight Roads Ventures, One Peak Partners, Creandum"
