,company,valuation,datejoined,country,city,industry,selectinvestors
844,Venafi,$1.15,12/10/2020,United States,Salt Lake City,Cybersecurity,"Pelion Venture Partners, Foundation Capital, Thoma Bravo"
845,Guideline,$1.15,6/16/2021,United States,San Mateo,Fintech,"Pelion Venture Partners, Foundation Capital, Thoma Bravo"
846,Rebellion Defense,$1.15,9/16/2021,United States,Washington DC,Artificial intelligence,"Venrock, Innovation Endeavors, Insights Partners"
847,Elemy,$1.15,10/6/2021,United States,San Francisco,Health,"General Catalyst, Bling Capital, Felicis Ventures"
848,Happy Money,$1.15,2/8/2022,United States,Tustin,Fintech,"FirstMark Capital, Anthemis, CMFG Ventures"
849,TELD,$1.12,12/16/2019,China,Qingdao,Fintech,"China Reform Fund, Gaopeng Capital, Jinhui Xingye"
850,DANA,$1.13,8/10/2022,Indonesia,Jakarta,Fintech,"Ant Group, Lazada, Sinar Mas Indonesia"
851,At-Bay,$1.12,7/27/2021,United States,Mountain View,Fintech,"Lightspeed Venture Partners, Khosla Ventures, Munich Re Ventures"
852,Visby Medical, $1.12 ,3/1/2022,United States,San Jose,Health,"Artiman Ventures, Pitango Venture Capital, Valo Ventures"
853,Invoca, $1.1,6/14/2022,United States,Santa Barbara,Artificial intelligence,"Upfront Ventures, Accel, Industry Ventures"
854,Wasabi, $1.1,9/27/2022,United States,Boston,Internet software & services,"Forestay Capital, Alumni Ventures, NTT DoCoMo Ventures"
855,Flexe, $1,4/21/2022,United States,Seattle,"Supply chain, logistics, & delivery","Redpoint Ventures, Prologis Ventures, Madrona Venture Group"
856,TangoMe,$1.1,3/20/2014,United States,Mountain View,Mobile & telecommunications,"Draper Fisher Jurtson, Qualcomm Ventures, Alibaba Group"
857,AppDirect,$1.1,10/7/2015,United States,San Francisco,E-commerce & direct-to-consumer,"Mithril, iNovia Capital, Foundry Group"
858,Juanpi,$1.1,4/14/2016,China,Wuhan,E-commerce & direct-to-consumer,"Tiantu Capital, SAIF Partners China, Newsion Venture Capital"
859,OVH,$1.1,8/15/2016,France,Roubaix,Other,"KKR, TowerBrook Capital Partners"
860,GetYourGuide,$1.1,5/16/2019,Germany,Berlin,Travel,"Spark Capital, Highland Europe, Sunstone Capital"
861,Ivalua,$1.1,5/21/2019,United States,Redwood City,Fintech,"Ardian, Tiger Global Management, KKR"
862,Sisense,$1.1,1/9/2020,United States,New York,Data management & analytics,"Opus Capital, Genesis Partners, Battery Ventures"
863,Pharmapacks,$1.1,11/12/2020,United States,Islandia,E-commerce & direct-to-consumer,The Carlyle Group
864,Sennder,$1.1,1/14/2021,Germany,Berlin,"Supply chain, logistics, & delivery","Accelm Scania Growth Capital, Lakestar"
865,Nexthink,$1.1,2/8/2021,Switzerland,Prilly,Data management & analytics,"Auriga, Galeo Ventures, Highland Europe"
866,Zego,$1.1,3/9/2021,United Kingdom,London,Fintech,"LocalGlobe, Balderton Capital, Target Global"
867,Rightway,$1.1,3/30/2021,United States,New York,Health,"Thrive Capital, Khosla Ventures, Tiger Global Management"
868,Sunbit,$1.1,5/20/2021,United States,Los Angeles,Fintech,"Zeev Ventures, Group11, Chicago Ventures"
869,Qingting FM,$1.1,6/2/2021,China,Shanghai,Internet software & services,"China Culture Industrial Investment Fund, We Capital, China Minsheng Investment Group"
870,G2,$1.1,6/22/2021,United States,Chicago,Internet software & services,"Pritzker Group Venture Capital, Accel, Hyde Park Venture Partners"
871,Hailo,$1,10/12/2021,Israel,Tel Aviv,Artificial intelligence,"Glory Ventures, Maniv Mobility"
872,Caribou,$1.1,5/23/2022,United States,Denver,Fintech," CMFG Ventures, Accomplice, Moderne Ventures"
873,Nowports,$1.1,5/24/2022,Mexico,Monterrey,"Supply chain, logistics, & delivery"," Monashees+, Foundation Capital, Base10 Partners"
874,People.ai,$1.1,8/11/2021,United States,San Francisco,Internet software & services,"GGV Capital, Lightspeed Venture Partners, ICONIQ Capital"
875,Carousell,$1.1,9/15/2021,Singapore,,E-commerce & direct-to-consumer,"500 Global, Rakuten Ventures, Golden Gate Ventures"
876,apna,$1.1,9/15/2021,India,Bengaluru,Internet software & services,"Sequoia Capital India, Rocketship.vc, Lightspeed India Partners"
877,Karat,$1.1,10/13/2021,United States,Seattle,Internet software & services,"8VC, Norwest Venture Partners, Tiger Global Management"
878,Enpal,$1.1,10/18/2021,Germany,Berlin,Internet software & services,"HV Capital, Softbank Group, BlackRock"
879,Acko General Insurance,$1.1,10/28/2021,India,Bengaluru,Fintech,"Intact Ventures, Munich Re Ventures, General Atlantic"
880,Daily Harvest,$1.1,11/16/2021,United States,New York,E-commerce & direct-to-consumer,"M13, Lightspeed Venture Partners, Lone Pine Capital"
881,The Bank of London,$1.1,11/30/2021,United Kingdom,London,Fintech,"Mangrove Capital Partners,14W. ForgeLight"
882,Fundbox,$1.1,11/30/2021,United States,San Francisco,Fintech,"Khosla Ventures, General Catalyst, Blumberg Capital"
883,Turing,$1.1,12/20/2021,United States,Palo Alto,Internet software & services,"Foundation Capital, 	Frontier Ventures, AltaIR Capital"
884,GlobalBees,$1.1,12/28/2021,India,New Delhi,E-commerce & direct-to-consumer,"Chiratae Ventures, SoftBank Group, Trifecta Capital"
885,LEAD School,$1.1,1/13/2022,India,Andheri,Edtech,"WestBridge Capital, GSV Ventures, Elevar Equity"
886,eSentire,$1.1,2/22/2022,Canada,Waterloo,Cybersecurity,"Edison Partners, Georgian Partners, VentureLink"
887,Beyond Identity,$1.1,2/22/2022,United States,New York,Cybersecurity,"New Enterprise Associates, Koch Disruptive Technologies, Evolution Equity Partners"
888,Staffbase,$1.1,3/15/2022,Germany,Chemnitz,Internet software & services,"Insight Partners, e.ventures, General Atlantic"
889,Chief,$1.1,3/31/2022	,United States,New York,Other,"General Catalyst, Inspired Capital, Flybridge Capital Partners"
890,IntelyCare,$1.1,4/6/2022,United States,Quincy,Health,"Kaiser Permanente Ventures, Endeavour Vision, LRVHealth"
891,Teleport,$1.1,5/3/2022,United States,Oakland,Cybersecurity,"Kleiner Perkins Caufield & Byers, s28 Capital, Insight Partners"
892,Imply Data,$1.1,5/17/2022,United States,Burlingame,Data management & analytics,"Andreessen Horowitz, Bessemer Venture Partners, Khosla Ventures,"
893,Material Security,$1.1,5/11/2022,United States,Redwood City,Cybersecurity,"Andreessen Horowitz, Founders Fund"
894,PhysicsWallah,$1.1,6/7/2022,India,Uttar Pradesh,Edtech,"GSV Ventures, WestBridge Capital"
895,Recover,$1.1,6/9/2022,Spain,Banyeres de Mariola,Other,"Goldman Sachs Asset Management, STORY3 Capital Partners"
896,Purplle,$1.1,6/9/2022,India,Mumbai,E-commerce & direct-to-consumer,"Blume Ventures, JSW Ventures, IvyCap Ventures"
897,CAIS,$1.1,1/11/2022	,United States,New York,Fintech,"Franklin Templeton, Motive Partners. Apollo Global Management"
898,Nxin,$1.08,9/18/2018,China,Beijing,Internet software & services,"Beijing Juneng Hesheng Industry Investment Fund, Beijing Shuju Xinrong Fund"
899,UISEE Technology,$1.08,1/25/2021,China,Beijing,"Supply chain, logistics, & delivery","Shenzhen Capital Group, Robert Bosch Venture Capital, SeptWolves Ventures"
900,56PINGTAI,$1.08,1/25/2021,China,Shanghai,"Supply chain, logistics, & delivery","QF Capital, QC Capital, Unicom Innovation Venture Capital"
901,Cirkul,$1.07,6/13/2022,United States,Sarasota,Consumer & retail,"AF Ventures, Siddhi Capital, SC.Holdings"
902,Radius Payment Solutions,$1.07,11/27/2017,United Kingdom,Crewe,Fintech,Inflexion Private Equity
903,Rivigo,$1.07,7/11/2019,India,Gurgaon,"Supply chain, logistics, & delivery","SAIF Partners India, Warburg Pincus, Trifecta Capital Advisors"
904,Mamaearth,$1.07,12/28/2021,India,Gurgaon,E-commerce & direct-to-consumer,"Fireside Ventures, Sequoia Capital India, Stellaris Venture Partners"
905,0x,$1.05,4/26/2022,United States,San Francisco,Fintech,"Jump Capital, Pantera Capital, Greylock Partners"
906,Jiuxian,$1.05,7/30/2015,China,Beijing,E-commerce & direct-to-consumer,"Sequoia Capital China, Rich Land Capital, Merrysunny Wealth"
907,Instabase,$1.05,10/21/2019,United States,San Francisco,Data management & analytics,"New Enterprise Associates, Greylock Partners, Andreessen Horowitz"
908,Sendbird,$1.05,4/6/2021,United States,San Mateo,Mobile & telecommunications,"FundersClub, Y Combinator, Tiger Global Management"
909,Density,$1.05,11/10/2021,United States,San Francisco,Hardware,"Founders Fund, Upfront Ventures, 	01 Advisors"
910,Mixpanel,$1.05,11/15/2021,United States,San Francisco,Internet software & services,"Bain Capital Tech Opportunities, Andreessen Horowitz, Sequoia Capital"
911,Branch,$1.05,3/1/2022,United States,Columbus,Fintech,"American Family Ventures, Greycroft, SignalFire"
912,Aprogen,$1.04,5/31/2019,South Korea,Seongnam-Si,Health,"Lindeman Asia Investment, Nichi-Iko Pharmaceutical"
913,OrCam Technologies,$1.03,2/20/2018,Israel,Jerusalem,Artificial intelligence,"Intel Capital, Aviv Venture Capital"
914,Ample,$1.02,11/11/2021,United States,San Francisco,Hardware,"Shell Ventures, Blackstone, Moore Strategic Ventures"
915,Leap Motor,$1.01,11/20/2018,China,Hangzhou,Auto & transportation,"Sequoia Capital China, Gopher Asset Management, Shanghai Electric Group"
916,Wheel,$1.01,1/19/2022,United States,Austin,Health,"Silverton Partners, Tusk Ventures, CRV"
917,Flow,$1,8/15/2022,United States,New York,Fintech,Andreessen Horowitz
918,Xanadu,$1,11/9/2022,Canada,Toronto,Hardware,"BDC Capital, Georgian, Bessemer Venture Partners"
919,LINE MAN Wongnai,$1,9/26/2022,Thailand,Bangkok,E-commerce & direct-to-consumer,"BRV Capital Management, Bualuang Ventures"
920,Celestia,$1,10/19/2022,Liechtenstein,Vaduz,Internet software & services,"Placeholder Capital, Coinbase Ventures, Binance Ventures"
921,Stability AI,$1,10/5/2022,United Kingdom,London,Artificial intelligence,"Lightspeed Venture Partners, Coatue Management"
922,Vesttoo,$1,10/25/2022,Israel,Tel Aviv-Yafo,Fintech,"Mouro Capital, Hanaco Venture Capital, Gramercy Ventures"
923,Satispay,$1,9/28/2022,Italy,Milan,Fintech,"Lightrock, Greyhound Capital, Endeavor"
924,Paystand,$1,8/2/2022,United States,Scotts Valley,Fintech,"BlueRun Ventures, LEAP Global Partners, Cervin Ventures"
925,Turntide Technologies,$1,6/15/2022,United States,Sunnyvale,Auto & transportation,"Meson Capital Partners, Fifth Wall Ventures, OGCI Climate Investments"
926,EcoVadis,$1,6/14/2022,France,Paris,"Supply chain, logistics, & delivery","Astorg Partners, Princeville Global, Beyond Net Zero"
927,TransferMate,$1,5/22/2022,Ireland,Kilkenny,Fintech,Railway Pension Trustee Co. Ltd.
928,Lookout,$1,10/10/2013,United States,San Francisco,Cybersecurity,"Accel Partners, Greylock Partners, Lowercase Capital"
929,Perimeter 81,$1,6/6/2022,Israel,Tel Aviv,Cybersecurity,"Insight Partners, Toba Capital, Spring Ventures"
930,Snapdeal,$1,5/21/2014,India,New Delhi,E-commerce & direct-to-consumer,"SoftBankGroup, Blackrock, Alibaba Group"
931,TechStyle Fashion Group,$1,8/29/2014,United States,El Segundo,E-commerce & direct-to-consumer,"Matrix Partners, Passport Capital, Rho Ventures"
932,Zebec,$1,8/29/2022,United States,San Francisco,Fintech,"Resolute Ventures, Shima Capital, Circle Ventures"
933,InMobi,$1,12/2/2014,India,Bengaluru,Mobile & telecommunications,"Kleiner Perkins Caufield & Byers, Softbank Corp., Sherpalo Ventures"
934,LinkSure Network,$1,1/1/2015,China,Shanghai,Mobile & telecommunications,N/A
935,Red Ventures,$1,1/7/2015,United States,Fort Mill,Other,"Silver Lake Partners, General Atlantic"
936,BeiBei,$1,1/22/2015,China,Hangzhou,E-commerce & direct-to-consumer,"Banyan Capital, New Horizon Capital, IDG Capital Partners"
937,Lamabang,$1,3/6/2015,China,Shenzhen,E-commerce & direct-to-consumer,"5Y Capital, Matrix Partners China, K2VC"
938,JimuBox,$1,4/21/2015,China,Beijing,Fintech,"Matrix Partners China, Ventech China, Shunwei Capital Partners"
939,FXiaoKe,$1,7/2/2015,China,Beijing,Mobile & telecommunications,"IDG Capital, Northern Light Venture Capital, DCM Ventures"
940,Vox Media,$1,8/12/2015,United States,Washington,Internet software & services,"Accel Partners, Comcast Ventures, General Atlantic"
941,Mia.com,$1,9/8/2015,China,Beijing,E-commerce & direct-to-consumer,"Sequoia Capital China, ZhenFund, K2 Ventures"
942,58 Daojia,$1,10/12/2015,China,Beijing,Internet software & services,"KKR, Alibaba Group, Ping An Insurance"
943,Womai,$1,10/12/2015,China,Beijing,E-commerce & direct-to-consumer,"SAIF Partners China, Baidu, IDG Capital"
944,HuJiang,$1,10/29/2015,China,Shanghai,Edtech,"China Minsheng Investment, Baidu, Wanxin Media"
945,iTutorGroup,$1,11/18/2015,China,Shanghai,Edtech,"QiMing Venture Partners, Temasek Holdings, Silverlink Capital"
946,MindMaze,$1,1/28/2016,Switzerland,Lausanne,Health,Hinduja Group
947,iCarbonX,$1,4/12/2016,China,Shenzhen,Artificial intelligence,"Tencent, Vcanbio"
948,SMS Assist,$1,6/7/2016,United States,Chicago,Internet software & services,"Goldman Sachs, Insights Venture Partners, Pritzker Group Venture Capital"
949,Kendra Scott,$1,12/21/2016,United States,Austin,Consumer & retail,"Berkshire Partners, Norwest Venture Partners"
950,Mobvoi,$1,4/6/2017,China,Beijing,Consumer & retail,"Sequoia Capital China, SIG Asia Investments, ZhenFund"
951,Zhuan Zhuan,$1,4/18/2017,China,Beijing,E-commerce & direct-to-consumer,"58.com, Tencent Holdings"
952,Modernizing Medicine,$1,5/10/2017,United States,Boca Raton,Health,"Warburg Pincus, Summit Partners, Sands Capital"
953,Zhaogang,$1,6/29/2017,China,Shanghai,E-commerce & direct-to-consumer,"K2 Ventures, Matrix Partners China, IDG Capital"
954,DianRong,$1,8/2/2017,China,Shanghai,E-commerce & direct-to-consumer,"Standard Chartered, FinSight Ventures, Affirma Capital"
955,Cell C,$1,8/7/2017,South Africa,Midrand,Mobile & telecommunications,"Blue Label Telecoms, Net1 UEPS Technologies"
956,YH Global,$1,9/21/2017,China,Shenzhen,"Supply chain, logistics, & delivery","Co-Energy Finance, Grandland"
957,Revolution Precrafted,$1,10/23/2017,Philippines,Manila,Other,"K2 Global, 500 Startups"
958,WeLab,$1,11/8/2017,Hong Kong,,Fintech,"Sequoia Capital China, ING, Alibaba Entrepreneurs Fund"
959,Maimai,$1,11/15/2017,China,Beijing,Mobile & telecommunications,"Morningside Venture Capital, IDG Capital, DCM Ventures"
960,Dxy.cn,$1,4/10/2018,China,Hangzhou,Health,"Tencent Holdings, DCM Ventures"
961,HMD Global,$1,5/21/2018,Finland,Espoo,Mobile & telecommunications,Ginko Ventures
962,Huike Group,$1,5/24/2018,China,Beijing,Edtech,"Fosun RZ Capital, Oceanwide Holdings, Shenzhen Qianhe Capital Management Co."
963,China Cloud,$1,6/11/2018,China,Wuxi,Hardware,"V Star Capital, GF Xinde Investment Management Co., Haitong Leading Capital Management"
964,LinkDoc Technology,$1,7/5/2018,China,Beijing,Health,"China Investment Corporation, New Enterprise Associates"
965,MediaMath,$1,7/10/2018,United States,New York,Internet software & services,"Silicon Valley Bank, QED Investors, European Founders Fund"
966,Movile,$1,7/12/2018,Brazil,Sao Paulo,Mobile & telecommunications,"Innova Capital - FIP, 3G Capital Management, Prosus Ventures"
967,Pat McGrath Labs,$1,7/16/2018,United States,New York,Consumer & retail,"One Luxury Group, Eurazeo"
968,Wacai,$1,7/18/2018,China,Hangzhou,Mobile & telecommunications,"Qiming Venture Partners, China Broadband Capital, CDH Investments"
969,FlashEx,$1,8/27/2018,China,Beijing,"Supply chain, logistics, & delivery","Prometheus Capital, Matrix Partners China, JD Capital Management"
970,Banma Network Technologies,$1,9/13/2018,China,Shanghai,Auto & transportation,"Yunfeng Capital, SDIC Innovation Investment Management, Shang Qi Capital"
971,Tresata,$1,10/10/2018,United States,Charlotte,Fintech,GCP Capital Partners
972,Momenta,$1,10/17/2018,China,Beijing,Artificial intelligence,"Sinovation Ventures, Tencent Holdings, Sequoia Capital China"
973,Hosjoy,$1,10/18/2018,China,Nanjing,E-commerce & direct-to-consumer,"U.S.-China Green Fund, Founder H Fund, Richland Equities"
974,Omio,$1,10/23/2018,Germany,Berlin,Travel,"Lakestar, Battery Ventures, New Enterprise Associates"
975,TERMINUS Technology,$1,10/25/2018,China,Beijing,Hardware,"China Everbright Limited, IDG Capital, iFLYTEK"
976,BitFury,$1,11/6/2018,Netherlands,Amsterdam,Hardware,"Georgian Co-Investment Fund, iTech Capital, Galaxy Digital"
977,REEF Technology,$1,12/10/2018,United States,Miami,"Supply chain, logistics, & delivery","Target Global, UBS Asset Management, Mubadala Capital"
978,Globality,$1,1/22/2019,United States,Menlo Park,Artificial intelligence,SoftBank Group
979,Ynsect,$1,2/21/2019,France,Evry,Other,"Astanor Ventures, Upfront Ventures, IDInvest Partners"
980,Intellifusion,$1,3/22/2019,China,Shenzhen,Artificial intelligence,"BOC International, TopoScend Capital, Hongxiu VC"
981,Poizon,$1,4/29/2019,China,Shanghai,Mobile & telecommunications,"DST Global, Sequoia Capital China, Gaorong Capital"
982,VTS,$1,5/7/2019,United States,New York,Internet software & services,"Trinity Ventures, Fifth Wall Ventures, OpenView Venture Partners"
983,SITECH DEV,$1,5/16/2019,China,Guiyang,Other,China Prosperity Capital
984,KnowBox,$1,5/30/2019,China,Beijing,Edtech,"TAL Education Group, Legend Star, Alibaba Group"
985,Yanolja,$1,6/10/2019,South Korea,Seoul,Travel,"SBI Investment Korea, Partners Investment, GIC"
986,Meero,$1,6/18/2019,France,Paris,Artificial intelligence,"Aglae Ventures, Global Founders Capital, Alven Capital"
987,Ibotta,$1,8/6/2019,United States,Denver,Fintech,"Koch Disruptive Technologies, Teamworthy Ventures, GGV Capital"
988,C2FO,$1,8/7/2019,United States,Leawood,Fintech,"Union Square Ventures, Summerhill Venture Partners, Mithril Capital Management"
989,Numbrs,$1,8/22/2019,Switzerland,Zurich,Fintech,"Investment Corporation of Dubai, Centralway"
990,EBANX,$1,10/16/2019,Brazil,Curitiba,Fintech,"FTV Capital, Endeavor"
991,KK Group,$3,10/23/2019,China,Dongguan,E-commerce & direct-to-consumer,"Matrix Partners China, Bright Venture Capita, Shenzhen Capital Group"
992,Alto Pharmacy,$1,1/30/2020,United States,San Francisco,Health,"Jackson Square Ventures, Greenoaks Capital Management, Softbank Group"
993,Hotmart,$1,3/17/2020,Netherlands,Amsterdam,E-commerce & direct-to-consumer,"Technology Crossover Ventures, Alkeon Capital Management, General Atlantic"
994,Emerging Markets Property Group,$1,4/28/2020,United Arab Emirates,Dubai,Other,"OLX Group, KCK Group, EXOR Seeds"
995,Quizlet,$1,5/13/2020,United States,San Francisco,Edtech,"Union Square Ventures, Altos Ventures, Costanoa Ventures"
996,Orca Bio,$1,6/17/2020,United States,Menlo Park,Health,"Lightspeed Venture Partners, Data Collective, 8VC"
997,Infobip,$1,7/30/2020,Croatia,Vodnjan,Mobile & telecommunications,One Equity Partners
998,Zwift,$1,9/16/2020,United States,Long Beach,E-commerce & direct-to-consumer,"Novator Partners, True, Causeway Media Partners"
999,Playco,$1,9/21/2020,Japan,Tokyo,Other,"Sozo Ventures, Caffeinated Capital, Sequoia Capital"
1000,Gousto,$1.7,11/3/2020,United Kingdom,London,"Supply chain, logistics, & delivery","MMC Ventures, BGF Ventures, Unilever Ventures"
1001,Alation,$1.7,6/3/2021,United States,Redwood City,Internet software & services,"Costanoa Ventures, Data Collective, Salesforce Ventures"
1002,Boom Supersonic,$1,12/16/2020,United States,Englewood,Other,"WRVI Capital, Caffeinated Capital, Y Combinator"
1003,Quantum Metric,$1,1/7/2021,United States,Colorado Springs,Data management & analytics,"Insight Partners, Bain Capital Ventures"
1004,News Break,$1,1/7/2021,United States,Mountain View,Internet software & services,"IDG Capital, Francisco Partners, ZhenFund"
1005,MadeiraMadeira,$1,1/7/2021,Brazil,Parana,E-commerce & direct-to-consumer,"Flybridge Capital Partners, SoftBank Group, Monashees+"
1006,PPRO,$1,1/19/2021,United Kingdom,London,Fintech,"Wellington Management, Eurazeo, Citi Ventures"
1007,Splashtop,$1,1/27/2021,United States,San Jose,Internet software & services,"Storm Ventures, DFJ DragonFund, New Enterprise Associates"
1008,Flash Express,$1,2/1/2021,Thailand,Bangkok,"Supply chain, logistics, & delivery","SCB 10X, Krungsri Finnovate, eWTP Capital"
1009,Axiom Space,$1,2/16/2021,United States,Houston,Other,"C5 Capital, Hemisphere Ventures, The Venture Collective"
1010,Locus Robotics,$1,2/17/2021,United States,Wilmington,Hardware,"Scale Venture Partners, Bond, Tiger Global Management"
1011,Standard,$1,2/17/2021,United States,San Francisco,Artificial intelligence,"CRV, Y Combinator, Initialized Capital"
1012,WeBull,$1,2/18/2021,China,Changsha,Fintech,"Bojiang Capital, Hongdao Capital, Mobai Capital"
1013,Skydio,$1,2/25/2021,United States,Redwood City,"Supply chain, logistics, & delivery","Andreessen Horowitz, Andreessen Horowitz, Institutional Venture Partners, Accel"
1014,Newsela,$1,2/25/2021,United States,New York,Edtech,"Owl Ventures, Technology Crossover Ventures, Tao Capital Partners"
1015,Aqua Security,$1,3/10/2021,Israel,Ramat Gan,Cybersecurity,"TLV Partners, Lightspeed Venture Partners, M12"
1016,PatSnap,$1,3/16/2021,Singapore,,Internet software & services,"Sequoia Capital China, Shunwei Capital Partners, Qualgro"
1017,Evidation,$1,3/22/2021,United States,San Mateo,Health,"B Capital Group,, GE Ventures, McKesson Ventures"
1018,Sidecar Health,$1,1/26/2021,United States,El Segundo,Fintech,"GreatPoint Ventures, Tiger Global Management, Menlo Ventures"
1019,Feedzai,$1,3/24/2021,United States,San Mateo,Artificial intelligence,"Global Founders Capital, Shea Ventures, Greycroft"
1020,Yunxuetang,$1,3/29/2021,China,Suzhou,Edtech,"Matrix Partners China, Sequoia Capital China, Hundreds Capital"
1021,Cameo,$1,3/30/2021,United States,Chicago,Internet software & services,"Lightspeed Venture Partners, Kleiner Perkins Caufield & Byers, Origin Ventures"
1022,Hyperchain,$1,4/11/2021,China,Hangzhou,Fintech,"Yinhong Equity Investment Fund, E Fund, Ideal International"
1023,The Zebra,$1,4/12/2021,United States,Austin,E-commerce & direct-to-consumer,"Silverton Partners, Accel, Ballast Point Ventures"
1024,Clearcover,$1,4/13/2021,United States,Chicago,Fintech,"American Family Ventures, Cox Enterprises, OMERS Ventures"
1025,Groq,$1,4/14/2021,United States,Mountain View,Artificial intelligence,"TDK Ventures, Social Capital, D1 Capital Partners"
1026,Fiture,$1,4/14/2021,China,Chengdu,Health,"Bertelsmann Asia Investments, Sequoia Capital China, NIO Capital"
1027,Injective Protocol,$1,4/20/2021,United States,New York,Fintech,"Pantera Capital, Cadenza Ventures, BlockTower Capital"
1028,Sift,$1,4/22/2021,United States,San Francisco,Artificial intelligence,"Union Square Ventures, Insight Partners, Spark Capital"
1029,SaltPay,$1,4/9/2021,United Kingdom,London,Fintech,"Tiger Global Management, Hedosophia"
1030,Capsule,$1,4/28/2021,United States,New York,Health,"Thrive Capital, Durable Capital Partners, G Squared"
1031,MOLOCO,$1.5,4/29/2021,United States,Redwood City,Artificial intelligence,"Smilegate Investment, DSC Investments, KTB Ventures"
1032,Inari,$1.5,5/12/2021,United States,Cambridge,Other,"Flagship Pioneering, Alexandria Venture Investments, Investment Corporation of Dubai"
1033,Mux,$1,4/30/2021,United States,San Francisco,Internet software & services,"Accel, Cobalt Capital, Andreessen Horowitz"
1034,XForcePlus,$1,6/1/2021,China,Shanghai,Internet software & services,"Eastern Bell Capital, Danhua Capital, MSA Capital"
1035,Firefly Aerospace,$1.1,5/4/2021,United States,Cedar Park,Other,"XBTO Ventures, Raven One Ventures, SK Ventures"
1036,Augustinus Bader,$1,11/9/2022,London,United Kingdom,Consumer & retail,General Atlantic
1037,Shift Technology,$1,5/6/2021,France,Paris,Artificial intelligence,"Griffin Gaming Partners, Andreessen Horowitz, Battery Ventures"
1038,TensTorrent,$1,5/5/2021,Canada,Toronto,Artificial intelligence,"Eclipse Ventures, Fidelity Investments, Moore Capital Management"
1039,Zihaiguo,$1,5/6/2021,China,Chongqing,Consumer & retail,"Xingwang Investment Management, China Capital Investment Group, Matrix Partners China"
1040,Forte Labs,$1.73,5/12/2021,United States,San Francisco,Fintech,"Iris Capital, Accel, Elaia Partners"
1041,Axtria,$1,5/13/2021,United States,Berkeley Heights,Data management & analytics,"Helion Venture Partners, Bain Capital Tech Opportunities, Sequoia Capital India"
1042,Amount,$1,5/17/2021,United States,Chicago,Fintech,"Invus Group, Hanaco Venture Capital, WestCap Group"
1043,Vise,$1,5/18/2021,United States,New York,Fintech,"Sequoia Capital, Founders Fund, Bling Capital"
1044,Printful,$1,5/24/2021,United States,Charlotte,Other,Bregal Sagemount
1045,Matrixport,$1.05,6/1/2021,Singapore,,Fintech,"Dragonfly Captial, Qiming Venture Partners, DST Global"
1046,Shippo,$1,6/2/2021,United States,San Francisco,"Supply chain, logistics, & delivery","Version One Ventures, Uncork Capital, Bessemer Venture Partners"
1047,Thirty Madison,$1,6/2/2021,United States,New York,Health,"Northzone Ventures, Maveron, Johnson & Johnson Innovation"
1048,LetsGetChecked,$1,6/7/2021,Ireland,Dublin,Health,"Optum Ventures, Qiming Venture Partners, Transformation Capital"
1049,EcoFlow,$1,6/10/2021,China,Shenzhen,Hardware,"Delian Capital, China International Capital Corporation, Sequoia Capital China"
1050,Carro,$1,6/14/2021,Singapore,,E-commerce & direct-to-consumer,"SingTel Innov8, Alpha JWC Ventures, Golden Gate Ventures"
1051,Tractable,$1,6/16/2021,United Kingdom,London,Artificial intelligence,"Insight Partners, Ignition Partners, Georgian Partners"
1052,Xiaoe Tech,$1,6/15/2021,China,Shenzhen,Internet software & services,"GGV Capital, Hillhouse Capital Management, IDG Capital"
1053,Bringg,$1,6/16/2021,Israel,Tel Aviv,"Supply chain, logistics, & delivery","Salesforce Ventures, next47, Pereg Ventures"
1054,Claroty,$1,6/17/2021,United States,New York,Cybersecurity,"Bessemer Venture Partners, MoreVC, Team8"
1055,JoyTunes,$1,6/21/2021,Israel,Tel Aviv,Edtech,"Genesis Partners, Aleph, Insight Partners"
1056,Aircall,$1,6/23/2021,United States,New York,Internet software & services,"Balderton Capital, Next World Capital, Draper Esprit"
1057,Worldcoin,$1,6/29/2021,United States,San Francisco,Fintech,"Day One Ventures, Coinbase Ventures, Andreessen Horowitz"
1058,SmartAsset,$1,6/24/2021,United States,New York,Fintech,"Javelin Venture Partners, TTV Capital, Peterson Ventures"
