,company,valuation,datejoined,country,city,industry,selectinvestors
424,CloudWalk,$2.15,9/8/2021,Brazil,Sao Paulo,Fintech,"Plug and Play Ventures, Valor Capital Group, DST Global"
425,CoinDCX,$2.15,8/10/2021,India,Maharashtra,Fintech,"Polychain Capital, Coinbase Ventures, Jump Capital"
426,FirstCry,$2.1,2/7/2020,India,Pune,E-commerce & direct-to-consumer,"SoftBank Group, SAIF Partners India, Valiant Capital Partners"
427,Eightfold.ai,$2.1,10/27/2020,United States,Santa Clara,Internet software & services,"Foundation Capital, Institutional Venture Partners, General Catalyst"
428,Urban Company,$2.1,4/27/2021,India,Gurgaon,E-commerce & direct-to-consumer,"VY Capital, Accel, Elevation Capital"
429,ReCharge,$2.1,5/6/2021,United States,Los Angeles,Fintech,"ICONIQ Growth, Bain Capital Ventures, Summit Partners"
430,Moveworks,$2.1,6/30/2021,United States,Mountain View,Artificial intelligence ,"Lightspeed Venture Partners, Sapphire Ventures, Kleiner Perkins Caufield & Byers"
431,Medable,$2.1,10/26/2021,United States,Palo Alto,Health,"GSR Ventures, Sapphire Ventures, Streamlined Ventures"
432,GoCardless,$2.1,2/8/2022,United Kingdom,London,Fintech,"Accel, Passion Capital, Balderton Capital"
433,Forto,$2.1,6/21/2021,Germany,Berlin,"Supply chain, logistics, & delivery","Cherry Ventures, Northzone Ventures, Global Founders Capital"
434,Jeeves,$2.1,3/14/2022,United States,Orlando,Fintech,"Tencent Holdings, CRV, Clocktower Technology Ventures"
435,Babel Finance,$2,5/25/2022,Hong Kong,Hong Kong,Fintech,"Dragonfly Capital, BAI Capital, 10T Fund"
436,BeZero,$2,11/14/2022,United Kingdom,London,Other,"Molten Ventures, Contrarian Ventures, Hitachi Ventures"
437,Trendy Group International,$2,2/13/2012,Hong Kong,Kowloon,Consumer & retail,L Capital Partners
438,Mysten Labs,$2,9/8/2022,United States,San Francisco,Internet software & services,"Andreessen Horowitz, Coinbase Ventures, Circle Ventures"
439,Avant,$2,12/17/2012,United States,Chicago,Artificial intelligence,"RRE Ventures, Tiger Global, August Capital"
440,Tubatu.com,$2,3/9/2015,China,Shenzhen,E-commerce & direct-to-consumer,"Sequoia Capital China, Matrix Partners China, 58.com"
441,BlaBlaCar,$2,9/16/2015,France,Paris,Auto & transportation,"Accel Partners, Index Ventures, Insight Venture Partners"
442,HuiMin,$2,9/5/2016,China,Beijing,E-commerce & direct-to-consumer,"Zheshang Venture Capital, GP Capital, Western Capital Management"
443,Quora,$2,4/21/2017,United States,Mountain View,Internet software & services,"Y Combinator, Matrix Partners, Benchmark"
444,Preferred Networks,$2,5/17/2018,Japan,Tokyo,Artificial intelligence,"Toyota Motor Corporation, Mizuho Financial Group, FANUC"
445,Formlabs,$2,8/1/2018,United States,Somerville,Hardware,"Pitango Venture Capital, DFJ Growth Fund, Foundry Group"
446,4Paradigm,$2,12/19/2018,China,Beijing,Artificial intelligence,"Sequoia Capital China, China Construction Bank, Bank of China"
447,Calm,$2,2/6/2019,United States,San Francisco,Internet software & services,"Insight Venture Partners, TPG Growth, Sound Ventures"
448,Kaseya,$2,3/27/2019,United States,Miami,Cybersecurity,"Insight Partners, TPG Alternative & Renewable Technologies, Ireland Strategic Investment Fund"
449,Mafengwo,$2,5/23/2019,China,Beijing,Travel,"Qiming Venture Partners, Capital Today, General Atlantic"
450,Druva,$2,6/20/2019,United States,Sunnyvale,Data management & analytics,"Nexus Venture Partners, Tenaya Capital, Sequoia Capital"
451,Kujiale,$2,10/25/2019,China,Hangzhou,Internet software & services,"GGV Capital, IDG Capital, Linear Venture"
452,AppsFlyer,$2,1/21/2020,United States,San Francisco,Mobile & telecommunications,"Magma Venture Partners, Pitango Venture Capital, Qumra Capital"
453,Keep,$2,5/19/2020,China,Beijing,Internet software & services,"Bertelsmann Asia Investments, GGV Capital, Morningside Venture Capital"
454,Redis Labs,$2,8/25/2020,United States,Mountain View,Data management & analytics,"Viola Ventures, Dell Technologies Capital, Bain Capital Ventures"
455,Xingyun Group,$2,9/24/2020,China,Shenzhen,E-commerce & direct-to-consumer,"Matrix Partners China, Eastern Bell Capital, Hongtai Capital Holdings"
456,Unqork,$2,10/6/2020,United States,New York,Fintech,"Blackrock, capitalG, World Lab Innovation"
457,Virta Health,$2,12/2/2020,United States,San Francisco,Health,"Caffeinated Capital, Obvious Ventures, Venrock"
458,ISN,$2,12/17/2020,United States,Dallas,"Supply chain, logistics, & delivery",Blackstone
459,Earnix,$2,2/21/2021,Israel,Giv'atayim,Fintech,"Jerusalem Venture Partners, Israel Growth Partners, Insight Partners"
460,Guoquan Shihui,$2,3/17/2021,China,Shanghai,Consumer & retail,"Tiantu Capital, CMB International Capital, Vision Knight Capital"
461,Clearco,$2,4/20/2021,Canada,Toronto,Fintech,"Highland Capital Partners, Oak HC/FT Partners, Emergence Capital Partners"
462,Hive,$2,4/21/2021,United States,San Francisco,Artificial intelligence,"Tomales Bay Capital, Bain & Company, General Catalyst"
463,KRY,$2,4/27/2021,Sweden,Stockholm,Health,"Index Ventures, Creandum, Accel"
464,Kajabi,$2,5/4/2021,United States,Irvine,Internet software & services,"Meritech Capital Partners, Tiger Global Management, Spectrum Equity"
465,Ethos,$2.7,5/11/2021,United States,San Francisco,Fintech,"Sequoia Capital, Google Ventures, Accel"
466,PayFit,$2.1,1/6/2022,United Kingdom,London,Fintech,"Accel, frst, Kima Ventures"
467,Beisen,$2,5/11/2021,China,Beijing,Internet software & services,"Matrix Partners China, Sequoia Capital China, Genesis Capital"
468,Pipe,$2,5/19/2021,United States,Miami,Fintech,"next47, MaC Venture Capital, FinVC"
469,Iterable,$2,6/15/2021,United States,San Francisco,Internet software & services,"CRV, Blue Cloud Ventures, Index Ventures"
470,Bunq,$2,6/18/2021,Netherlands,Amsterdam,Fintech,Undisclosed
471,Clip,$2,6/10/2021,Mexico,Mexico City,Fintech,"Alta Ventures Mexico, General Atlantic, SoftBank Group"
472,Loggi,$2,6/5/2019,Brazil,Sao Paulo,"Supply chain, logistics, & delivery","Qualcomm Ventures, SoftBank Group. Monashees+"
473,MURAL,$2,7/20/2021,United States,San Francisco,Internet software & services,"Insight Partners, Tiger Global Management, Gradient Ventures"
474,OCSiAl,$2,3/4/2019,Luxembourg,Leudelange,Other,"A&NN, Rusnano"
475,XtalPi,$2,8/11/2021,China,Shenzhen,Artificial intelligence,"Tencent Holdings, 5Y Capital, Sequoia Capital China"
476,Divvy Homes,$2,8/13/2021,United States,San Francisco,Fintech,"Andreessen Horowitz, Caffeinated Capital, SciFi VC"
477,Apeel Sciences,$2,5/26/2020,United States,Goleta,Other,"Upfront Ventures, Tao Capital Partners, Andreessen Horowitz"
478,Opay,$2,8/23/2021,Nigeria,Lagos,Fintech,"Sequoia Capital China, Source Code Capital, Redpoint Ventures China"
479,Aviatrix,$2,9/8/2021,United States,Santa Clara,Internet software & services,"Ignition Partners, Formation 8, CRV"
480,SmartNews,$2,8/5/2019,Japan,Tokyo,Mobile & telecommunications,"Japan Post Capital, Globis Capital Partners, Atomico"
481,Misfits Market,$2,4/21/2021,United States,Pennsauken,"Supply chain, logistics, & delivery","Accel, D1 Capita Partners, Greenoaks Capital Management"
482,Spring Health,$2,9/16/2021,United States,New York,Health,"Rethink Impact, Work-Bench, RRE Ventures"
483,Black Sesame Technologies,$2,9/22/2021,China,Shanghai,Artificial intelligence,"Northern Light Venture Capital, Xiaomi, FutureX Capital"
484,Advance Intelligence Group,$2,9/23/2021,Singapore,,Artificial intelligence,"Vision Plus Capital, GSR Ventures, ZhenFund"
485,Modern Treasury,$2,10/6/2021,United States,San Francisco,Fintech,"Benchmark, Altimeter Capital, Quiet Capital"
486,Magic Leap,$2,10/21/2014,United States,Plantation,Hardware,"Obvious Ventures, Qualcomm Ventures, Andreessen Horowitz"
487,Tier,$2,10/25/2021,Germany,Berlin,Travel,"Northzone Ventures, White Star Capital, Novator Partners"
488,ClickHouse,$2,10/28/2021,United States,Portola Valley,Data management & analytics,"Lightspeed Venture Partners, Almaz Capital Partners, Altimeter Capital"
489,Mynt,$2,11/1/2021,Philippines,Taguig City,Fintech,"Insight Partners, Warburg Pincus, Ayala Corporation"
490,Everlaw,$2,3/10/2020,United States,Oakland,Internet software & services,"K9 Ventures, Menlo Ventures, Andreessen Horowitz"
491,Zilch,$2,11/10/2021,United Kingdom,London,Fintech,"Gauss Ventures, Ventura Capital, dmg ventures"
492,VerbIT,$2,6/8/2021,United States,New York,Artificial intelligence,"ClalTech, Vertex Ventures, Oryzn Capital"
493,StarkWare,$8,11/17/2021,Israel,Netanya,Cybersecurity,"Sequoia Capital, Paradigm, Pantera Capital"
494,Netlify,$2,11/17/2021,United States,San Francisco,Internet software & services,"Andreessen Horowitz, Kleiner Perkins Caufield & Byers, EQT Ventures"
495,SWORD Health,$2,11/22/2021,United States,New York,Health,"Khosla Ventures, Green Innovations, Founders Fund"
496,LTK,$2,11/22/2021,United States,Dallas,Internet software & services,"SoftBank Group, Maverick Capital"
497,Trax,$2,7/22/2019,Singapore,,Artificial intelligence,"Hopu Investment Management, Boyu Capital, DC Thomson Ventures"
498,Exotec,$2,1/17/2022,France,Croix,Hardware,"Breega Capital, Iris Capital, 360 Capital Partners"
499,Dremio,$2,1/6/2021,United States,Santa Clara,Data management & analytics,"Lightspeed Venture Partners, Redpoint Ventures, Norwest Venture Partners"
500,Akulaku,$2,2/15/2022,Indonesia,Jakarta,E-commerce & direct-to-consumer,"DCM Ventures, IDG Capital, Siam Commercial Bank"
501,Cloudinary,$2,2/15/2022,United States,Santa Clara,Internet software & services,"Blackstone, Bessemer Venture Partners"
502,Lunar,$2,7/12/2021,Denmark,Aarhus,Fintech,"SEED Capital, Greyhound Capital, Socii Capital"
503,UpGrad,$2.25,8/9/2021,India,Mumbai,Edtech,"Qualcomm Ventures, Accel, Canaan Partners"
504,Salsify,$2,4/13/2022,United States,Boston,Internet software & services,"Matrix Partners, North Bridge Venture Partners, Venrock"
505,CertiK,$2,3/31/2022,United States,New York,Cybersecurity,"Tiger Global Management, Lightspeed Venture Partners, Hillhouse Capital Management"
506,ROX Motor,$2,4/29/2022,China,Shanghai,Auto & transportation,"Sequoia Capital China, IDG Capital, Qiming Venture Partners"
507,Hugging Face,$2,5/9/2022,United States,New York,Artificial intelligence,"Betaworks Ventures, Addition, Lux Capital"
508,Devo Technology,$2,10/26/2021,United States,Cambridge,Data management & analytics,"Insight Partners, Kibo Ventures, Bessemer Venture Partners"
509,Rimac Automobili,$2,6/1/2022,Croatia,Sveta Nedelja,Auto & transportation,"Porsche, 	InvestIndustrial, SoftBank Group"
510,Geek+,$2,11/21/2018,China,Beijing,Hardware,"Volcanics Ventures, Vertex Ventures China, Warburg Pincus"
511,21.co,$2,9/6/2022,United States,New York,Fintech,"Quiet Ventures, ETFS Capital, Collab+Currency"
512,Solugen,$2,9/10/2021,United States,Houston,Other,"Fifty Years Fund, Refactor Capital, Temasek"
513,ZigBang, $1.93,6/7/2022,South Korea,Seoul,Mobile & telecommunications,"Black Pearl Ventures, Stonebridge Ventures, Yuanta Investment Korea"
514,Ankorstore,$1.98,1/10/2022	,France,Paris,E-commerce & direct-to-consumer,"Global Founders Capital, Aglae Ventures, Alven Capital"
515,Fenbi Education,$1.95,	2/7/2021,China,Beijing,Edtech,"Trustbridge Partners, Hony Capital, IDG Capital"
516,InVision,$1.9,11/1/2017,United States,New York,Internet software & services,"FirstMark Capital, Tiger Global Management, ICONIQ Capital"
517,eDaili,$1.9,2/1/2019,China,Shanghai,E-commerce & direct-to-consumer,"K2VC, Lightspeed China Partners, Sky9 Capital"
518,MX Technologies,$1.9,1/13/2021,United States,Lehi,Fintech,"Point72 Ventures, Pelion Venture Partners, Commerce Ventures"
519,Aledade,$1.9,1/19/2021,United States,Bethesda,Health,"Venrock, CVF Capital Partners, ARCH Venture Partners"
520,CoinSwitch Kuber,$1.9,10/6/2021,India,Bangalore,Fintech,"Tiger Global Management, Sequoia Capital India, Ribbit Capital"
521,Acorns,$1.9,3/9/2022,United States,Irvine,Fintech,"e.ventures, Bain Capital Ventures, Greycroft"
522,Roofstock,$1.94,3/10/2022,United States,Oakland,Fintech,"Khosla Ventures, Bain Capital Ventures, Lightspeed Venture Partners"
523,thatgamecompany, $1.94 ,3/3/2022,United States,Los Angeles,Internet software & services,"Benchmark, Sequoia Capital, TPG Capital"
524,ConcertAI,$1.9,3/29/2022,United States,Boston,Artificial Intelligence,"Sixth Street Partners, Declaration Partners, Maverick Ventures Israel"
525,Material Bank,$1.9,5/6/2022,United States,Boca Raton,E-commerce & direct-to-consumer,"Bain Capital Ventures, SoftBank Group, Fifth Wall Ventures"
526,Volocopter,$1.87,3/4/2022,Germany,Bruchsal,Auto & transportation,"btov Partners, Geely, Intel Capital"
527,ENOVATE,$1.85,4/15/2019,China,Shanghai,Auto & transportation,Automobile Industry Guidance Fund
528,MEGAZONE,$1.83,8/16/2022,South Korea,Seoul,Internet software & services,"Salesforce Ventures, ATP Investment, kt investment"
529,CFGI,$1.85,9/15/2021,United States,Boston,Fintech,"The Carlyle Group, CVC Capital Partners"
530,ZocDoc,$1.8,8/20/2015,United States,New York,Health,"Founders Fund, Khosla Ventures, Goldman Sachs"
531,Diamond Foundry,$1.8,3/29/2021,United States,San Francisco,Other,"Fashion Tech Lab, Fidelity Investments, Vast Ventures"
532,FullStory,$1.8,8/4/2021,United States,Atlanta,Internet software & services,"Google Ventures, Kleiner Perkins Caufield & Byers, Stripes Group"
533,Lightricks,$1.8,7/31/2019,Israel,Jerusalem,Artificial intelligence,"Viola Ventures, Insight Partners, ClalTech, Goldman Sachs"
534,Opentrons,$1.8,9/23/2021,United States,New York,Hardware,"SOSV, Khosla Ventures, Lerer Hippeau"
535,Slice,$1.8,11/28/2021,India,Bengaluru,Fintech,"Gunosy Capital, Blume Ventures, Das Capital"
536,Cambrian BioPharma,$1.79,10/26/2021,United States,Brooklyn,Health,"Future Ventures, Apeiron Investment Group, Moore Capital Management"
537,AIWAYS,$1.78,4/16/2018,China,Shanghai,Auto & transportation,"Jiangsu Sha Steel Group, Shanghai Puyin Industry, Funa Yuanchuang Technology"
538,Trulioo,$1.75,6/7/2021,Canada,Vancouver,Cybersecurity,"Blumberg Capital, American Express Ventures, BDC Venture Capital"
539,Spinny,$1.75,11/24/2021,India,Gurugram,E-commerce & direct-to-consumer,"General Catalyst, Eleation Capital, Avenir Growth Capital"
540,Crusoe,$1.75,4/21/2022,United States,Denver,Internet software & services,"Bain Capital Ventures, Founders Fund, Winklevoss Capital"
541,Orca Security,$1.8,3/23/2021,United States,Portland,Cybersecurity,"YL Ventures, Redpoint Ventures, GGV Capital"
542,Apus Group,$1.73,1/16/2015,China,Beijing,Mobile & telecommunications,"Redpoint Ventures, QiMing Venture Partners, Chengwei Capital"
543,AlphaSense,$1.7,6/15/2022,United States,New York,Artificial intelligence,"Viking Global Investors, GS Growth, BlackRock"
544,Harry's,$1.7,2/16/2018,United States,New York,Consumer & retail,"Thrive Capital, Tiger Global Management, Temasek"
545,PAX,$1.7,10/22/2018,United States,San Francisco,Consumer & retail,"Tao Capital Partners, Global Asset Capital, Tiger Global Management"
546,DispatchHealth,$1.7,3/3/2021,United States,Denver,Health,"Alta Partners, Questa Capital, Echo Health Ventures"
547,Pax8,$1.7,4/11/2022,United States,Greenwood Village,Internet software & services,"Liberty Global Ventures, Sageview Capital, Blue Cloud Ventures"
548,Multiverse,$1.7,6/8/2022,United Kingdom,London,Edtech,"Lightspeed Venture Partners, Google Ventures, General Catalyst"
549,Front,$1.7,6/28/2022,United States,San Francisco,Internet software & services,"Sequoia Capital, Uncork Capital, Salesforce Ventures"
550,Redesign Health,$1.7,9/13/2022,United States,New York,Health,"General Catalyst, Samsung NEXT, CVS Health Partners"
551,Tessera Therapeutics,$1.69,4/19/2022,United States,Cambridge,Health,"Altitude Life Science Ventures, SoftBank Group, Alaska Permanent Fund"
552,Uniswap,$1.66,10/13/2022,United States,New York,Fintech,"A16z Crypto, Variant Fund, Paradigm"
553,FinAccel,$1.66,8/15/2022,Singapore,,Fintech,"Jungle Ventures, Square Peg Capital, OpenSpace Ventures"
554,Unite Us,$1.6,3/16/2021,United States,New York,Health,"Insight Partners, Sequoia Capital, Index Ventures"
555,CircleCI,$1.7,5/11/2021,United States,San Francisco,Internet software & services,"Threshold Ventures, Baseline Ventures, Harrison Metal"
556,Wave,$1.7,9/7/2021,Senegal,Dakar,Fintech,"Stripe, Founders Fund, Partech Partners"
557,Vestiaire Collective,$1.7,3/1/2021,France,Paris,E-commerce & direct-to-consumer,"Eurazeo, IDInvest Partners, Balderton Capital"
558,Dragos,$1.7,10/28/2021,United States,Hanover,Cybersecurity,"DataTribe, Energy Impact Partners, AllegisCyber Capital"
559,Reltio,$1.7,11/4/2021,United States,Redwood City,Data management & analytics,"Crosslink Capital, .406 Ventures, Sapphire Ventures"
560,H2O.ai,$1.7,11/7/2021,United States,Mountain View,Artificial intelligence,"Nexus Venture Partners, Transamerica Ventures, Crane Venture Partners"
561,ZenBusiness,$1.7,11/9/2021,United States,Austin,Fintech,"Greycroft, Lerer Hippeau, Geekdom Fund"
562,Carsome,$1.7,7/12/2021,Malaysia,Selangor,E-commerce & direct-to-consumer,"Gobi Partners, 500 Startups, Ondine Capital"
563,Productboard,$1.7,2/2/2022,United States,San Francisco,Internet software & services,"Index Ventures, Kleiner Perkins Caufield & Byers, Bessemer Venture Partners"
564,Spotter,$1.7,2/16/2022,United States,Los Angeles,Fintech,"SoftBank Group, Access Industries, Crossbeam Venture Partners"
565,Optimism,$1.65,3/17/2022,United States,San Francisco,Internet software & services,"Paradigm, Huobi Ventures, Andreessen Horowitz"
566,Incredible Health,$1.65,8/17/2022,United States,San Francisco,Health,"Obvious Ventures, Andreessen Horowitz, NFX"
567,Jusfoun Big Data,$1.62,7/9/2018,China,Beijing,Data management & analytics,"Boxin Capital, DT Capital Partners, IDG Capital"
568,Transcarent,$1.62,1/11/2022,United States,San Francisco,Health,"Alta Partners, General Catalyst, Jove Equity Partners"
569,DealShare,$1.7,1/27/2022,India,Bengaluru,E-commerce & direct-to-consumer,"Alpha Wave Global, Matrix Partners India, Tiger Global Management"
570,Zhubajie,$1.61,6/16/2015,China,Chongqing,Internet software & services,"Cybernaut Growth Fund, IDG Capital"
571,solarisBank,$1.65,7/13/2021	,Germany,Berlin,Fintech,"Yabeo Capital, SBI Investment, Vulcan Capital"
572,DataStax,$1.6,5/26/2021	,United States,Santa Clara,Data management & analytics,"Crosslink Capital, Meritech Capital Partners, Lightspeed Venture Partners"
573,Infinidat,$1.6,4/29/2015,United States,Waltham,Hardware,"TPG Growth, Goldman Sachs"
574,Afiniti,$1.6,4/14/2017,Bermuda,Hamilton,Artificial intelligence,GAM Holding
575,Cao Cao Mobility,$1.6,1/17/2018,China,Hangzhou,Auto & transportation,"People Electrical Appliance Group China, Zhongrong International Trust"
576,Clari,$2.6,3/3/2021,United States,Sunnyvale,Internet software & services,"Sequoia Capital, Bain Capital Ventures, enaya Capital"
577,Tonal,$1.6,3/31/2021,United States,San Francisco,E-commerce & direct-to-consumer,"Mayfield Fund, Shasta Ventures, L Catterton"
578,Clio,$1.6,4/27/2021,Canada,Burnaby,Internet software & services,"OMERS Private Equity, T. Rowe Price, Technology Crossover Ventures"
579,SafetyCulture,$1.6,5/3/2021,Australia,Sydney,Internet software & services,"Blackbird Ventures, IndexVentures, Tiger Global Management"
580,Monte Carlo,$1.6,5/24/2022,United States,San Francisco,Artificial intelligence,"GGV Capital, Accel, Redpoint Ventures"
581,Cresta,$1.6,3/17/2022,United States,San Francisco,Artificial Intelligence,"Andreessen Horowitz, Greylock Partners, Sequoia Capital"
582,Extend,$1.36,5/18/2021,United States,San Francisco,Fintech,"GreatPoint Ventures, Meritech Capital Partners, PayPal Ventures"
583,Generate Biomedicines,$1.36,11/18/2021,United States,Cambridge,Health,"Altitude Life Science Ventures. T. Rowe Price, Morningside Venture Partners"
584,Cognite,$1.5,5/19/2021,Norway,Lysaker,Data management & analytics,"Technology Crossover Ventures, Accel, Aker"
585,ASAPP,$1.6,5/19/2021,United States,New York,Artificial intelligence,"March Capital Partners, HOF Capital, Emergence Capital Partners"
586,SmartHR,$1.6,6/8/2021,Japan,Tokyo,Fintech,"BEENEXT, World Innovation Lab, Light Street Capital"
587,Mercury,$1.6,7/3/2021,United States,San Francisco,Fintech,"Andreessen Horowitz, Coatue Management, Clocktower Technology Ventures"
588,HomeLight,$1.7,9/2/2021,United States,San Francisco,Fintech,"Zeev Ventures, Menlo Ventures,Crosslink Capital"
589,Truepill,$1.6,10/27/2021,United States,Hayward,Health,"Initialized Capital, Sound Ventures, TI Platform Management"
590,ezCater,$1.6,4/2/2019,United States,Boston,"Supply chain, logistics, & delivery","Insight Venture Partners, ICONIQ Capital, Launchpad Venture Group"
591,Wayflyer,$1.6,2/1/2022,Ireland,Dublin,Fintech,"QED Investors, DST Global, Left Lane Capital"
592,Capitolis,$1.6,3/22/2022,United States,New York,Fintech,"Sequoia Capital, Index Ventures, S Capital"
593,Nord Security,$1.6,4/7/2022,Lithuania,Vilnius,Cybersecurity,"General Catalyst, BaltCap, Novator Partners"
594,Vanta,$1.6,6/7/2022,United States,San Francisco,Cybersecurity,"Craft Ventures, Sequoia Capital, Verissimo Ventures"
595,Magic Eden,$1.6,6/21/2022,United States,San Francisco,Fintech,"Sequoia Capital, Lightspeed Venture Partners, Paradigm"
596,Pave,$1.6,6/28/2022,United States,San Francisco,Internet software & services,"Y Combinator, 	Andreessen Horowitz, Bessemer Venture Partners"
597,Promasidor Holdings,$1.59,11/8/2016,South Africa,Bryanston,Consumer & retail,"IFC, Ajinomoto"
598,GalaxySpace,$1.58,11/17/2020,China,Beijing,Mobile & telecommunications,"Shunwei Capital Partners, 5Y Capital, Legend Capital"
599,ICON 3D, $1.57 ,2/18/2022,United States,Austin,Hardware,"Moderne Ventures, Oakhouse Partners, Bjarke Ingels Group"
600,Fresh Life Style Supply Chain Management, $1.57 ,3/11/2022,China,Chengdu,"Supply chain, logistics, & delivery","Guiyang Venture Capital, Longfor Capital, CAOGENZHIBEN GROUP"
601,Alloy,$1.55,9/30/2021,United States,New York,Fintech,"Bessemer Venture Partners, Eniac Ventures, Canapi Ventures"
602,Baiwang,$1.55,3/25/2019,China,Beijing,Fintech,"Guozhong Venture Capital Management, Shenzhen Capital Group, Oriental Fortune Capital"
603,Iluvatar CoreX,$1.55,3/1/2021,China,Shanghai,Hardware,"Centurium Capital, Cedarlake Capital, Unicom Innovation Venture Capital"
604,Wenheyou,$1.55,4/17/2021,China,Hunan,Other,"Sequoia Capital China, Warburg Pincus, IDG Capital"
605,Kitopi,$1.55,7/1/2021,United Arab Emirates,Dubai,"Supply chain, logistics, & delivery","CE-Ventures, BECO Capital, Nordstar"
606,Loom,$1.53,5/20/2021,United States,San Francisco,Internet software & services,"Kleiner Perkins Caufield & Byers, Sequoia Capital, General Catalyst"
607,Ximalaya FM,$1.52,9/22/2017,China,Shanghai,Mobile & telecommunications,"China Creation Ventures, Sierra Ventures, Xingwang Investment Management"
608,Carzone,$1.52,3/1/2019,China,Jiangsu,E-commerce & direct-to-consumer,"Alibaba Group,Co-Stone Venture Capital, Buhuo Venture Capital"
609,Gokin Solar,$1.51,4/13/2022,China,Zhuhai,Other,"IDG Capital, Puluo Capital, Midea Capital"
610,OpenWeb,$1.5,11/9/2021,United States,New York,Internet software & services,"Insight Partners, AltaIR Capital, Norma Investments"
611,bolttech,$1.5,7/1/2021,Singapore,,Fintech,"Mundi Ventures, Doqling Capital Partners, Activant Capital"
612,Bilt Rewards,$1.5,10/25/2022,United States,New York,Fintech,"Camber Creek, Kairos HQ, Fifth Wall Ventures"
613,Mu Sigma,$1.5,2/7/2013,United States,Northbrook,Data management & analytics,"Sequoia Capital, General Atlantic"
614,Kushki,$1.5,6/7/2022,Ecuador,Quito,Fintech,"Clocktower Technology Ventures, DILA Capital, Kaszek Ventures"
615,Jasper,$1.5,10/17/2022,United States,Austin,Artificial intelligence,"Foundation Capital, Institutional Venture Partners, Founders Capital"
616,Orna Therapeutics,$1.5,8/16/2022,United States,Cambridge,Health,"MPM Capital, Astellas Venture Management, F2 Ventures"
617,TuJia,$1.5,6/17/2015,China,Beijing,Travel,"GGV Capital, QiMing Venture Partnersl"
618,Mofang Living,$1.5,4/13/2016,China,Shanghai,E-commerce & direct-to-consumer,"Warburg Pincus, Aviation Industry Corporation of China"
619,Gett,$1.5,5/24/2016,United Kingdom,London,Auto & transportation,"Volkswagen, Access Industries, Vostok New Ventures"
620,DT Dream,$1.5,6/8/2017,China,Hangzhou,Data management & analytics,"Alibaba Group, China Everbright Investment Management, Yinxinggu Capital"
621,Changingedu,$1.5,10/30/2017,China,Shanghai,Edtech,"Trustbridge Partners, IDG Capital, Sequoia Capital China"
622,XiaoZhu,$1.5,11/1/2017,China,Beijing,Travel,"Morningside Ventures, Capital Today, JOY Capital"
623,JOLLY Information Technology,$1.5,5/29/2018,China,Hangzhou,E-commerce & direct-to-consumer,"Legend Capital, CDH Investments, Sequoia Capital China"
624,Yijiupi,$1.5,9/20/2018,China,Beijing,Consumer & retail,"Source Code Capital, Meituan Dianping, Tencent Holdings"
625,Cambridge Mobile Telematics,$1.5,12/19/2018,United States,Cambridge,Auto & transportation,SoftBank Group
626,Collective Health,$1.5,6/17/2019,United States,San Francisco,Fintech,"New Enterprise Associates, Founders Fund, Google Ventures"
627,Strava,$1.5,11/16/2020,United States,San Francisco,Internet software & services,"Jackson Square Ventures, Madrone Capital Partners, Sequoia Capital"
628,Zenoti,$1.5,12/15/2020,United States,Bellevue,Internet software & services,"Norwest Venture Partners, Accel, Tiger Global Management"
629,K Health,$1.5,1/19/2021,United States,New York,Health,"Max Ventures, Mangrove Capital Partners, 14W"
630,Uplight,$1.5,3/3/2021,United States,Boulder,Other,"Rubicon Technology Partners, Max Ventures, Inclusive Capital Partners"
631,ID.me,$1.5,3/19/2021,United States,McLean,Cybersecurity,"Moonshots Capital, BoxGroup, Blu Venture Investors"
632,Snapdocs,$1.5,5/25/2021,United States,San Francisco,Fintech,"Sequoia Capital, Y Combinator, F-Prime Capital"
633,Chipper Cash,$2,5/31/2021,United States,San Francisco,Fintech,"Deciens Capital, Bezos Expeditions, 500 Startups"
634,Ledger,$1.5,6/10/2021,France,Paris,Hardware,"Digital Currency Group, Draper Esprit, Korelya Capital"
