,company,valuation,datejoined,country,city,industry,selectinvestors
404,zume,doll_2.25 b,11/1/2018,united states,mountain view,consumer & retail,"softbank group, ame cloud ventures, signalfire"
405,algolia,doll_2.25 b,7/28/2021,united states,san francisco,internet software & services,"accel, alven capital, storm ventures"
406,pattern,doll_2.25 b,10/6/2021,united states,lehi,internet software & services,"knox lane, ainge advisory, carlson private capital partners"
407,newfront insurance,doll_2.2 b,4/12/2022,united states,san francisco,fintech,"founders fund, meritech capital partners, gs growth"
408,nucom group,doll_2.2 b,2/22/2018,germany,unterfoehring,other,general atlantic
409,musinsa,doll_2.2 b,11/11/2019,south korea,seoul,e-commerce & direct-to-consumer,sequoia capital
410,current,doll_2.2 b,4/27/2021,united states,new york,fintech,"expa, qed investors, foundation capital"
411,bitso,doll_2.2 b,5/5/2021,mexico,mexico city,fintech,"pantera capital, qed investors, coinbase ventures"
412,gympass,doll_2.2 b,6/12/2019,united states,new york,internet software & services,"general atlantic, softbank group, atomico"
413,dialpad,doll_2.2 b,10/6/2020,united states,san francisco,internet software & services,"andreessen horowitz, google ventures, section 32"
414,g7 networks,doll_2.2 b,2/15/2022,china,beijing,"supply chain, logistics, & delivery","eastern bell capital 32, sdic cmc investment management, trustbridge partners"
415,bloomreach,doll_2.2 b,2/23/2022,united states,mountain view,artificial intelligence,"bain capital ventures, sixth street growth, lightspeed venture partners"
416,motif foodworks, doll_2.20  b,6/16/2021,united states,boston,consumer & retail ,"general atlantic, breakthrough energy ventures, viking global investors"
417,huaqin telecom technology,doll_2.19 b,10/8/2019,china,shanghai,mobile & telecommunications,"zhangjiang haocheng venture capital, walden international, intel capital"
418,accelerant,doll_2.19 b,1/12/2022,united kingdom,colchester,other,"deer park road, altamont capital partners, eldridge"
419,hesai tech,doll_2.18 b,8/1/2020,china,shanghai,artificial intelligence,"lightspeed china partners, baidu ventures, qiming venture partners"
420,yitu technology,doll_2.17 b,3/8/2018,china,shanghai,artificial intelligence,"sequoia capital china, banyan capital"
421,addepar,doll_2.17 b,6/15/2021,united states,mountain view,fintech,"8vc, d1 capital partners, sway ventures"
422,qualia,doll_2.17 b,12/21/2020,united states,san francisco,fintech,"8vc, menlo ventures, tiger global management"
423,neo4j,doll_2 b,6/17/2021,united states,san mateo,data management & analytics,"eight roads ventures, one peak partners, creandum"
424,cloudwalk,doll_2.15 b,9/8/2021,brazil,sao paulo,fintech,"plug and play ventures, valor capital group, dst global"
425,coindcx,doll_2.15 b,8/10/2021,india,maharashtra,fintech,"polychain capital, coinbase ventures, jump capital"
426,firstcry,doll_2.1 b,2/7/2020,india,pune,e-commerce & direct-to-consumer,"softbank group, saif partners india, valiant capital partners"
427,eightfold.ai,doll_2.1 b,10/27/2020,united states,santa clara,internet software & services,"foundation capital, institutional venture partners, general catalyst"
428,urban company,doll_2.1 b,4/27/2021,india,gurgaon,e-commerce & direct-to-consumer,"vy capital, accel, elevation capital"
429,recharge,doll_2.1 b,5/6/2021,united states,los angeles,fintech,"iconiq growth, bain capital ventures, summit partners"
430,moveworks,doll_2.1 b,6/30/2021,united states,mountain view,artificial intelligence ,"lightspeed venture partners, sapphire ventures, kleiner perkins caufield & byers"
431,medable,doll_2.1 b,10/26/2021,united states,palo alto,health,"gsr ventures, sapphire ventures, streamlined ventures"
432,gocardless,doll_2.1 b,2/8/2022,united kingdom,london,fintech,"accel, passion capital, balderton capital"
433,forto,doll_2.1 b,6/21/2021,germany,berlin,"supply chain, logistics, & delivery","cherry ventures, northzone ventures, global founders capital"
434,jeeves,doll_2.1 b,3/14/2022,united states,orlando,fintech,"tencent holdings, crv, clocktower technology ventures"
435,babel finance,doll_2 b,5/25/2022,hong kong,hong kong,fintech,"dragonfly capital, bai capital, 10t fund"
436,bezero,doll_2 b,11/14/2022,united kingdom,london,other,"molten ventures, contrarian ventures, hitachi ventures"
437,trendy group international,doll_2 b,2/13/2012,hong kong,kowloon,consumer & retail,l capital partners
438,mysten labs,doll_2 b,9/8/2022,united states,san francisco,internet software & services,"andreessen horowitz, coinbase ventures, circle ventures"
439,avant,doll_2 b,12/17/2012,united states,chicago,artificial intelligence,"rre ventures, tiger global, august capital"
440,tubatu.com,doll_2 b,3/9/2015,china,shenzhen,e-commerce & direct-to-consumer,"sequoia capital china, matrix partners china, 58.com"
441,blablacar,doll_2 b,9/16/2015,france,paris,auto & transportation,"accel partners, index ventures, insight venture partners"
442,huimin,doll_2 b,9/5/2016,china,beijing,e-commerce & direct-to-consumer,"zheshang venture capital, gp capital, western capital management"
443,quora,doll_2 b,4/21/2017,united states,mountain view,internet software & services,"y combinator, matrix partners, benchmark"
444,preferred networks,doll_2 b,5/17/2018,japan,tokyo,artificial intelligence,"toyota motor corporation, mizuho financial group, fanuc"
445,formlabs,doll_2 b,8/1/2018,united states,somerville,hardware,"pitango venture capital, dfj growth fund, foundry group"
446,4paradigm,doll_2 b,12/19/2018,china,beijing,artificial intelligence,"sequoia capital china, china construction bank, bank of china"
447,calm,doll_2 b,2/6/2019,united states,san francisco,internet software & services,"insight venture partners, tpg growth, sound ventures"
448,kaseya,doll_2 b,3/27/2019,united states,miami,cybersecurity,"insight partners, tpg alternative & renewable technologies, ireland strategic investment fund"
449,mafengwo,doll_2 b,5/23/2019,china,beijing,travel,"qiming venture partners, capital today, general atlantic"
450,druva,doll_2 b,6/20/2019,united states,sunnyvale,data management & analytics,"nexus venture partners, tenaya capital, sequoia capital"
451,kujiale,doll_2 b,10/25/2019,china,hangzhou,internet software & services,"ggv capital, idg capital, linear venture"
452,appsflyer,doll_2 b,1/21/2020,united states,san francisco,mobile & telecommunications,"magma venture partners, pitango venture capital, qumra capital"
453,keep,doll_2 b,5/19/2020,china,beijing,internet software & services,"bertelsmann asia investments, ggv capital, morningside venture capital"
454,redis labs,doll_2 b,8/25/2020,united states,mountain view,data management & analytics,"viola ventures, dell technologies capital, bain capital ventures"
455,xingyun group,doll_2 b,9/24/2020,china,shenzhen,e-commerce & direct-to-consumer,"matrix partners china, eastern bell capital, hongtai capital holdings"
456,unqork,doll_2 b,10/6/2020,united states,new york,fintech,"blackrock, capitalg, world lab innovation"
457,virta health,doll_2 b,12/2/2020,united states,san francisco,health,"caffeinated capital, obvious ventures, venrock"
458,isn,doll_2 b,12/17/2020,united states,dallas,"supply chain, logistics, & delivery",blackstone
459,earnix,doll_2 b,2/21/2021,israel,giv'atayim,fintech,"jerusalem venture partners, israel growth partners, insight partners"
460,guoquan shihui,doll_2 b,3/17/2021,china,shanghai,consumer & retail,"tiantu capital, cmb international capital, vision knight capital"
461,clearco,doll_2 b,4/20/2021,canada,toronto,fintech,"highland capital partners, oak hc/ft partners, emergence capital partners"
462,hive,doll_2 b,4/21/2021,united states,san francisco,artificial intelligence,"tomales bay capital, bain & company, general catalyst"
463,kry,doll_2 b,4/27/2021,sweden,stockholm,health,"index ventures, creandum, accel"
464,kajabi,doll_2 b,5/4/2021,united states,irvine,internet software & services,"meritech capital partners, tiger global management, spectrum equity"
465,ethos,doll_2.7 b,5/11/2021,united states,san francisco,fintech,"sequoia capital, google ventures, accel"
466,payfit,doll_2.1 b,1/6/2022,united kingdom,london,fintech,"accel, frst, kima ventures"
467,beisen,doll_2 b,5/11/2021,china,beijing,internet software & services,"matrix partners china, sequoia capital china, genesis capital"
468,pipe,doll_2 b,5/19/2021,united states,miami,fintech,"next47, mac venture capital, finvc"
469,iterable,doll_2 b,6/15/2021,united states,san francisco,internet software & services,"crv, blue cloud ventures, index ventures"
470,bunq,doll_2 b,6/18/2021,netherlands,amsterdam,fintech,undisclosed
471,clip,doll_2 b,6/10/2021,mexico,mexico city,fintech,"alta ventures mexico, general atlantic, softbank group"
472,loggi,doll_2 b,6/5/2019,brazil,sao paulo,"supply chain, logistics, & delivery","qualcomm ventures, softbank group. monashees+"
473,mural,doll_2 b,7/20/2021,united states,san francisco,internet software & services,"insight partners, tiger global management, gradient ventures"
474,ocsial,doll_2 b,3/4/2019,luxembourg,leudelange,other,"a&nn, rusnano"
475,xtalpi,doll_2 b,8/11/2021,china,shenzhen,artificial intelligence,"tencent holdings, 5y capital, sequoia capital china"
476,divvy homes,doll_2 b,8/13/2021,united states,san francisco,fintech,"andreessen horowitz, caffeinated capital, scifi vc"
477,apeel sciences,doll_2 b,5/26/2020,united states,goleta,other,"upfront ventures, tao capital partners, andreessen horowitz"
478,opay,doll_2 b,8/23/2021,nigeria,lagos,fintech,"sequoia capital china, source code capital, redpoint ventures china"
479,aviatrix,doll_2 b,9/8/2021,united states,santa clara,internet software & services,"ignition partners, formation 8, crv"
480,smartnews,doll_2 b,8/5/2019,japan,tokyo,mobile & telecommunications,"japan post capital, globis capital partners, atomico"
481,misfits market,doll_2 b,4/21/2021,united states,pennsauken,"supply chain, logistics, & delivery","accel, d1 capita partners, greenoaks capital management"
482,spring health,doll_2 b,9/16/2021,united states,new york,health,"rethink impact, work-bench, rre ventures"
483,black sesame technologies,doll_2 b,9/22/2021,china,shanghai,artificial intelligence,"northern light venture capital, xiaomi, futurex capital"
484,advance intelligence group,doll_2 b,9/23/2021,singapore,,artificial intelligence,"vision plus capital, gsr ventures, zhenfund"
485,modern treasury,doll_2 b,10/6/2021,united states,san francisco,fintech,"benchmark, altimeter capital, quiet capital"
486,magic leap,doll_2 b,10/21/2014,united states,plantation,hardware,"obvious ventures, qualcomm ventures, andreessen horowitz"
487,tier,doll_2 b,10/25/2021,germany,berlin,travel,"northzone ventures, white star capital, novator partners"
488,clickhouse,doll_2 b,10/28/2021,united states,portola valley,data management & analytics,"lightspeed venture partners, almaz capital partners, altimeter capital"
489,mynt,doll_2 b,11/1/2021,philippines,taguig city,fintech,"insight partners, warburg pincus, ayala corporation"
490,everlaw,doll_2 b,3/10/2020,united states,oakland,internet software & services,"k9 ventures, menlo ventures, andreessen horowitz"
491,zilch,doll_2 b,11/10/2021,united kingdom,london,fintech,"gauss ventures, ventura capital, dmg ventures"
492,verbit,doll_2 b,6/8/2021,united states,new york,artificial intelligence,"claltech, vertex ventures, oryzn capital"
493,starkware,doll_8 b,11/17/2021,israel,netanya,cybersecurity,"sequoia capital, paradigm, pantera capital"
494,netlify,doll_2 b,11/17/2021,united states,san francisco,internet software & services,"andreessen horowitz, kleiner perkins caufield & byers, eqt ventures"
495,sword health,doll_2 b,11/22/2021,united states,new york,health,"khosla ventures, green innovations, founders fund"
496,ltk,doll_2 b,11/22/2021,united states,dallas,internet software & services,"softbank group, maverick capital"
497,trax,doll_2 b,7/22/2019,singapore,,artificial intelligence,"hopu investment management, boyu capital, dc thomson ventures"
498,exotec,doll_2 b,1/17/2022,france,croix,hardware,"breega capital, iris capital, 360 capital partners"
499,dremio,doll_2 b,1/6/2021,united states,santa clara,data management & analytics,"lightspeed venture partners, redpoint ventures, norwest venture partners"
500,akulaku,doll_2 b,2/15/2022,indonesia,jakarta,e-commerce & direct-to-consumer,"dcm ventures, idg capital, siam commercial bank"
501,cloudinary,doll_2 b,2/15/2022,united states,santa clara,internet software & services,"blackstone, bessemer venture partners"
502,lunar,doll_2 b,7/12/2021,denmark,aarhus,fintech,"seed capital, greyhound capital, socii capital"
503,upgrad,doll_2.25 b,8/9/2021,india,mumbai,edtech,"qualcomm ventures, accel, canaan partners"
504,salsify,doll_2 b,4/13/2022,united states,boston,internet software & services,"matrix partners, north bridge venture partners, venrock"
505,certik,doll_2 b,3/31/2022,united states,new york,cybersecurity,"tiger global management, lightspeed venture partners, hillhouse capital management"
506,rox motor,doll_2 b,4/29/2022,china,shanghai,auto & transportation,"sequoia capital china, idg capital, qiming venture partners"
507,hugging face,doll_2 b,5/9/2022,united states,new york,artificial intelligence,"betaworks ventures, addition, lux capital"
508,devo technology,doll_2 b,10/26/2021,united states,cambridge,data management & analytics,"insight partners, kibo ventures, bessemer venture partners"
509,rimac automobili,doll_2 b,6/1/2022,croatia,sveta nedelja,auto & transportation,"porsche, 	investindustrial, softbank group"
510,geek+,doll_2 b,11/21/2018,china,beijing,hardware,"volcanics ventures, vertex ventures china, warburg pincus"
511,21.co,doll_2 b,9/6/2022,united states,new york,fintech,"quiet ventures, etfs capital, collab+currency"
512,solugen,doll_2 b,9/10/2021,united states,houston,other,"fifty years fund, refactor capital, temasek"
513,zigbang, doll_1.93 b,6/7/2022,south korea,seoul,mobile & telecommunications,"black pearl ventures, stonebridge ventures, yuanta investment korea"
514,ankorstore,doll_1.98 b,1/10/2022	,france,paris,e-commerce & direct-to-consumer,"global founders capital, aglae ventures, alven capital"
515,fenbi education,doll_1.95 b,	2/7/2021,china,beijing,edtech,"trustbridge partners, hony capital, idg capital"
516,invision,doll_1.9 b,11/1/2017,united states,new york,internet software & services,"firstmark capital, tiger global management, iconiq capital"
517,edaili,doll_1.9 b,2/1/2019,china,shanghai,e-commerce & direct-to-consumer,"k2vc, lightspeed china partners, sky9 capital"
518,mx technologies,doll_1.9 b,1/13/2021,united states,lehi,fintech,"point72 ventures, pelion venture partners, commerce ventures"
519,aledade,doll_1.9 b,1/19/2021,united states,bethesda,health,"venrock, cvf capital partners, arch venture partners"
520,coinswitch kuber,doll_1.9 b,10/6/2021,india,bangalore,fintech,"tiger global management, sequoia capital india, ribbit capital"
521,acorns,doll_1.9 b,3/9/2022,united states,irvine,fintech,"e.ventures, bain capital ventures, greycroft"
522,roofstock,doll_1.94 b,3/10/2022,united states,oakland,fintech,"khosla ventures, bain capital ventures, lightspeed venture partners"
523,thatgamecompany, doll_1.94  b,3/3/2022,united states,los angeles,internet software & services,"benchmark, sequoia capital, tpg capital"
524,concertai,doll_1.9 b,3/29/2022,united states,boston,artificial intelligence,"sixth street partners, declaration partners, maverick ventures israel"
525,material bank,doll_1.9 b,5/6/2022,united states,boca raton,e-commerce & direct-to-consumer,"bain capital ventures, softbank group, fifth wall ventures"
526,volocopter,doll_1.87 b,3/4/2022,germany,bruchsal,auto & transportation,"btov partners, geely, intel capital"
527,enovate,doll_1.85 b,4/15/2019,china,shanghai,auto & transportation,automobile industry guidance fund
528,megazone,doll_1.83 b,8/16/2022,south korea,seoul,internet software & services,"salesforce ventures, atp investment, kt investment"
529,cfgi,doll_1.85 b,9/15/2021,united states,boston,fintech,"the carlyle group, cvc capital partners"
530,zocdoc,doll_1.8 b,8/20/2015,united states,new york,health,"founders fund, khosla ventures, goldman sachs"
531,diamond foundry,doll_1.8 b,3/29/2021,united states,san francisco,other,"fashion tech lab, fidelity investments, vast ventures"
532,fullstory,doll_1.8 b,8/4/2021,united states,atlanta,internet software & services,"google ventures, kleiner perkins caufield & byers, stripes group"
533,lightricks,doll_1.8 b,7/31/2019,israel,jerusalem,artificial intelligence,"viola ventures, insight partners, claltech, goldman sachs"
534,opentrons,doll_1.8 b,9/23/2021,united states,new york,hardware,"sosv, khosla ventures, lerer hippeau"
535,slice,doll_1.8 b,11/28/2021,india,bengaluru,fintech,"gunosy capital, blume ventures, das capital"
536,cambrian biopharma,doll_1.79 b,10/26/2021,united states,brooklyn,health,"future ventures, apeiron investment group, moore capital management"
537,aiways,doll_1.78 b,4/16/2018,china,shanghai,auto & transportation,"jiangsu sha steel group, shanghai puyin industry, funa yuanchuang technology"
538,trulioo,doll_1.75 b,6/7/2021,canada,vancouver,cybersecurity,"blumberg capital, american express ventures, bdc venture capital"
539,spinny,doll_1.75 b,11/24/2021,india,gurugram,e-commerce & direct-to-consumer,"general catalyst, eleation capital, avenir growth capital"
540,crusoe,doll_1.75 b,4/21/2022,united states,denver,internet software & services,"bain capital ventures, founders fund, winklevoss capital"
541,orca security,doll_1.8 b,3/23/2021,united states,portland,cybersecurity,"yl ventures, redpoint ventures, ggv capital"
542,apus group,doll_1.73 b,1/16/2015,china,beijing,mobile & telecommunications,"redpoint ventures, qiming venture partners, chengwei capital"
543,alphasense,doll_1.7 b,6/15/2022,united states,new york,artificial intelligence,"viking global investors, gs growth, blackrock"
544,harry's,doll_1.7 b,2/16/2018,united states,new york,consumer & retail,"thrive capital, tiger global management, temasek"
545,pax,doll_1.7 b,10/22/2018,united states,san francisco,consumer & retail,"tao capital partners, global asset capital, tiger global management"
546,dispatchhealth,doll_1.7 b,3/3/2021,united states,denver,health,"alta partners, questa capital, echo health ventures"
547,pax8,doll_1.7 b,4/11/2022,united states,greenwood village,internet software & services,"liberty global ventures, sageview capital, blue cloud ventures"
548,multiverse,doll_1.7 b,6/8/2022,united kingdom,london,edtech,"lightspeed venture partners, google ventures, general catalyst"
549,front,doll_1.7 b,6/28/2022,united states,san francisco,internet software & services,"sequoia capital, uncork capital, salesforce ventures"
550,redesign health,doll_1.7 b,9/13/2022,united states,new york,health,"general catalyst, samsung next, cvs health partners"
551,tessera therapeutics,doll_1.69 b,4/19/2022,united states,cambridge,health,"altitude life science ventures, softbank group, alaska permanent fund"
552,uniswap,doll_1.66 b,10/13/2022,united states,new york,fintech,"a16z crypto, variant fund, paradigm"
553,finaccel,doll_1.66 b,8/15/2022,singapore,,fintech,"jungle ventures, square peg capital, openspace ventures"
554,unite us,doll_1.6 b,3/16/2021,united states,new york,health,"insight partners, sequoia capital, index ventures"
555,circleci,doll_1.7 b,5/11/2021,united states,san francisco,internet software & services,"threshold ventures, baseline ventures, harrison metal"
556,wave,doll_1.7 b,9/7/2021,senegal,dakar,fintech,"stripe, founders fund, partech partners"
557,vestiaire collective,doll_1.7 b,3/1/2021,france,paris,e-commerce & direct-to-consumer,"eurazeo, idinvest partners, balderton capital"
558,dragos,doll_1.7 b,10/28/2021,united states,hanover,cybersecurity,"datatribe, energy impact partners, allegiscyber capital"
559,reltio,doll_1.7 b,11/4/2021,united states,redwood city,data management & analytics,"crosslink capital, .406 ventures, sapphire ventures"
560,h2o.ai,doll_1.7 b,11/7/2021,united states,mountain view,artificial intelligence,"nexus venture partners, transamerica ventures, crane venture partners"
561,zenbusiness,doll_1.7 b,11/9/2021,united states,austin,fintech,"greycroft, lerer hippeau, geekdom fund"
562,carsome,doll_1.7 b,7/12/2021,malaysia,selangor,e-commerce & direct-to-consumer,"gobi partners, 500 startups, ondine capital"
563,productboard,doll_1.7 b,2/2/2022,united states,san francisco,internet software & services,"index ventures, kleiner perkins caufield & byers, bessemer venture partners"
564,spotter,doll_1.7 b,2/16/2022,united states,los angeles,fintech,"softbank group, access industries, crossbeam venture partners"
565,optimism,doll_1.65 b,3/17/2022,united states,san francisco,internet software & services,"paradigm, huobi ventures, andreessen horowitz"
566,incredible health,doll_1.65 b,8/17/2022,united states,san francisco,health,"obvious ventures, andreessen horowitz, nfx"
567,jusfoun big data,doll_1.62 b,7/9/2018,china,beijing,data management & analytics,"boxin capital, dt capital partners, idg capital"
568,transcarent,doll_1.62 b,1/11/2022,united states,san francisco,health,"alta partners, general catalyst, jove equity partners"
569,dealshare,doll_1.7 b,1/27/2022,india,bengaluru,e-commerce & direct-to-consumer,"alpha wave global, matrix partners india, tiger global management"
570,zhubajie,doll_1.61 b,6/16/2015,china,chongqing,internet software & services,"cybernaut growth fund, idg capital"
571,solarisbank,doll_1.65 b,7/13/2021	,germany,berlin,fintech,"yabeo capital, sbi investment, vulcan capital"
572,datastax,doll_1.6 b,5/26/2021	,united states,santa clara,data management & analytics,"crosslink capital, meritech capital partners, lightspeed venture partners"
573,infinidat,doll_1.6 b,4/29/2015,united states,waltham,hardware,"tpg growth, goldman sachs"
574,afiniti,doll_1.6 b,4/14/2017,bermuda,hamilton,artificial intelligence,gam holding
575,cao cao mobility,doll_1.6 b,1/17/2018,china,hangzhou,auto & transportation,"people electrical appliance group china, zhongrong international trust"
576,clari,doll_2.6 b,3/3/2021,united states,sunnyvale,internet software & services,"sequoia capital, bain capital ventures, enaya capital"
577,tonal,doll_1.6 b,3/31/2021,united states,san francisco,e-commerce & direct-to-consumer,"mayfield fund, shasta ventures, l catterton"
578,clio,doll_1.6 b,4/27/2021,canada,burnaby,internet software & services,"omers private equity, t. rowe price, technology crossover ventures"
579,safetyculture,doll_1.6 b,5/3/2021,australia,sydney,internet software & services,"blackbird ventures, indexventures, tiger global management"
580,monte carlo,doll_1.6 b,5/24/2022,united states,san francisco,artificial intelligence,"ggv capital, accel, redpoint ventures"
581,cresta,doll_1.6 b,3/17/2022,united states,san francisco,artificial intelligence,"andreessen horowitz, greylock partners, sequoia capital"
582,extend,doll_1.36 b,5/18/2021,united states,san francisco,fintech,"greatpoint ventures, meritech capital partners, paypal ventures"
583,generate biomedicines,doll_1.36 b,11/18/2021,united states,cambridge,health,"altitude life science ventures. t. rowe price, morningside venture partners"
584,cognite,doll_1.5 b,5/19/2021,norway,lysaker,data management & analytics,"technology crossover ventures, accel, aker"
585,asapp,doll_1.6 b,5/19/2021,united states,new york,artificial intelligence,"march capital partners, hof capital, emergence capital partners"
586,smarthr,doll_1.6 b,6/8/2021,japan,tokyo,fintech,"beenext, world innovation lab, light street capital"
587,mercury,doll_1.6 b,7/3/2021,united states,san francisco,fintech,"andreessen horowitz, coatue management, clocktower technology ventures"
588,homelight,doll_1.7 b,9/2/2021,united states,san francisco,fintech,"zeev ventures, menlo ventures,crosslink capital"
589,truepill,doll_1.6 b,10/27/2021,united states,hayward,health,"initialized capital, sound ventures, ti platform management"
590,ezcater,doll_1.6 b,4/2/2019,united states,boston,"supply chain, logistics, & delivery","insight venture partners, iconiq capital, launchpad venture group"
591,wayflyer,doll_1.6 b,2/1/2022,ireland,dublin,fintech,"qed investors, dst global, left lane capital"
592,capitolis,doll_1.6 b,3/22/2022,united states,new york,fintech,"sequoia capital, index ventures, s capital"
593,nord security,doll_1.6 b,4/7/2022,lithuania,vilnius,cybersecurity,"general catalyst, baltcap, novator partners"
594,vanta,doll_1.6 b,6/7/2022,united states,san francisco,cybersecurity,"craft ventures, sequoia capital, verissimo ventures"
595,magic eden,doll_1.6 b,6/21/2022,united states,san francisco,fintech,"sequoia capital, lightspeed venture partners, paradigm"
596,pave,doll_1.6 b,6/28/2022,united states,san francisco,internet software & services,"y combinator, 	andreessen horowitz, bessemer venture partners"
597,promasidor holdings,doll_1.59 b,11/8/2016,south africa,bryanston,consumer & retail,"ifc, ajinomoto"
598,galaxyspace,doll_1.58 b,11/17/2020,china,beijing,mobile & telecommunications,"shunwei capital partners, 5y capital, legend capital"
599,icon 3d, doll_1.57  b,2/18/2022,united states,austin,hardware,"moderne ventures, oakhouse partners, bjarke ingels group"
600,fresh life style supply chain management, doll_1.57  b,3/11/2022,china,chengdu,"supply chain, logistics, & delivery","guiyang venture capital, longfor capital, caogenzhiben group"
601,alloy,doll_1.55 b,9/30/2021,united states,new york,fintech,"bessemer venture partners, eniac ventures, canapi ventures"
602,baiwang,doll_1.55 b,3/25/2019,china,beijing,fintech,"guozhong venture capital management, shenzhen capital group, oriental fortune capital"
603,iluvatar corex,doll_1.55 b,3/1/2021,china,shanghai,hardware,"centurium capital, cedarlake capital, unicom innovation venture capital"
604,wenheyou,doll_1.55 b,4/17/2021,china,hunan,other,"sequoia capital china, warburg pincus, idg capital"
