09-wissel-name,10-DeBiGa-name
a limited,ingram micro (uk) limited
a limited,marketing facilities management ltd
a & p (estates & investments) limited,software ltd.
a and u investments limited,speneo technologies ltd
acris court 27 a limited,software add-ons limited
a property limited,software acumen limited
a r king discretionary settlement,software acquisitions ltd
a k inspiring ltd,software acquisitions & licensing limited
a & fn overseas holdings limited,software academy limited
a a abbey roofing & building contractors ltd,nell+lola ltd
a a a curry house ltd,software analysis and design limited
a a adams limited,software alliance services limited
a a a eagles ltd,software alliance limited
a a a letting & maintenance ltd,software alchemy limited
a a a motors limited,software alex coding limited
a a & a autos ltd,software ag (uk) limited
aa & a constructions ltd,software agility limited
a a & a investments limited,software affair limited
"a, a & a property ltd",software advice service limited
a a & a stephen (burpham) ltd.,software analysis solutions limited
aa & a traders ltd,software and business intelligence solutions ltd
a a & b ltd,software and logistics ltd
a a & d fraser limited,software and integration services associates limited
a a & e services ltd,software analytics limited
a a & eva limited,software & motor uk ltd
a a & f ltd,software and management group ltd
a a & g m enterprises ltd,software & marketing solution limited
a a & k enterprises limited,software & dev ltd
a a & k lettings limited,software & design innovations ltd
a a & s investments llp,software and website solutions ltd
a a & s j faulkner limited,software and code ltd
a a  &  s  properties limited,software & consulting europe ltd
a a and t (wm) ltd,software antelope ltd
a a and z properties ltd,software & design limited
a. a. annoh ltd.,software & system link ltd
a a anyamele & sons limited,software & support media ltd
a a appliance service limited,software and process applications limited
a aaran ltd,software & sail design limited
a. a. arbitrage ltd,software and network solutions ltd.
a a arborists limited,software application professionals limited
a a a scaffold limited,software artists ltd
a a a scaffold yorkshire ltd,software associates limited
a a a s enterprise ltd,software automation international ltd
a a autos slough limited,software associates international ltd
a a autovan leisure ltd,software asset solutions limited
a a bah limited,software aspects limited
a a bailey ltd,software assistance limited
a a bakers (scotland) ltd.,software asia ltd
a a ballantyne (properties) ltd,software brokers ltd
a  a  ball  services limited,software brands limited
a a b automotive limited,software a s limited
a. abbott and sons (rushden) limited,software box limited
a a b communication limited,software brain ltd
a abdikarim transport ltd,software base limited
a abdullah logistics limited,software automation solutions ltd
a abdurrahman it consultant ltd,software by adam limited
a a beer limited,software by firth limited
a abeidi limited,software by design ltd
a a b electrical and plumbing contractors ltd,software business ltd
a abercrombie limited,software business partners limited
a a bespoke woodwork ltd,software center distribution limited
a a b estates limited,software buddy consultancy limited
a a blow investments limited,software buddies limited
a a boilers ltd,software cellular network limited
a a bolton properties ltd,software by smith ltd
a a bond & sons limited,software center black limited
a a bradley builders limited,software by numbers limited
a abraham limited,software bytes ltd
a a bramley limited,software capital limited
a a brothers limited,software competitiveness international ltd
a a brown limited,software coders limited
a abu limited,software cloud consulting ltd
a abubakar engineering ltd,software city limited
a a buckingham limited,software cloud limited
a a builders manchester limited,software centre limited
a a building services limited,software compliance holdings ltd
a a bush electrical limited,software concepts limited
a a butler security ltd,software compliance limited
a academy tutorials ltd,software compliance properties ltd
a a cannon limited,software consultancy service limited
a a canopies & ventilation services ltd,software consultancy ltd
a a canopy and ventilation cleaning ltd,software constructors limited
a a carpentry & builders limited,software connextions ltd
a a carpets and furniture store limited,software consulting and development ltd
a a carrots limited,software connections (ni) ltd
a a cars (nw) ltd,software confidence ltd
a a castle ltd,software connexion limited
a a catering equipment services limited,software concepts limited
a a c carmen ltd,software consult global ltd
a accountants limited,software consultants (tetbury) limited
a a c finance limited,software consulting group limited
a a chapman ltd,software consultants private limited
a a chefani limited,software consultant ltd
a. a. chemical cleaning company limited,software consultancy solutions ltd
a achim ltd,software contingency limited
a acklam (consulting) ltd,software control & design ltd
a ackroyd tm ltd,software contractors ltd
a. a. c management (uk) limited,software contracting ltd
a a collins electrical limited,software co-operative limited
a. a. column limited,software cornwall ltd
a a commercial properties ltd,software creations limited
a a communications (leicester) ltd,software craft and testing uk cic
a a consortium ltd,software cruncher limited
a a constable ltd,software craftsmanship limited
a a consultancy 1 limited,software counts ltd
a a consult services pro ltd,software cpanel ltd
a a cooling limited,software crafts limited
a a cooper ltd,software design ltd
a a c performance ltd,software delivery solutions limited
a acquisitions ltd,software defined consultancy ltd
a a creatvie ltd,software defences ltd
a a c renewables & plumbing limited,software delights limited
a a croydon holdings limited,software defined storage limited
a a cunningham limited,software deals ltd
a a curries in a hurry ltd,software design & consulting limited
a adam ltd,software design laboratory limited
a. adams & son limited,software design & implementation ltd
a. adams (haulage) ltd,software design plus ltd
a adams supervisory solutions limited,software design and engineering ltd
a adan marketing ltd,software developer solutions ltd
a- (a dash) ltd,software design & build limited
a a davies & co limited,software design systems ltd
a adcock investments,software designs (southern) limited
a addicott plumbing and heating services limited,software design smart ltd
a a decorators limited,software development design & consultancy limited
a. adelekan limited,software designs limited
a a delights limited,software development in derbyshire limited
a a delivery express ltd,software development consultants ltd
a a developments cornwall limited,software development consultancy ltd
a a d heating limited,software development & ecommerce solutions ltd
a a dips limited,software development & consulting ltd
a a dixon ltd,software developments limited
a adkins touring limited,software development services ltd
a adly limited,software devices limited
a a dowson ltd,software development solutions limited
a a d plumbing ltd,software dialog direct limited
a a drains ltd,software dynamix ltd
a a d surveying services limited,software dynamics (uk) ltd
a. a. duboss ltd,software dynamics limited
a a duff ltd,software dojo ltd
a advertising ltd,software division limited
a advisors ltd,software engineering and entrepreneurship development group ltd
a a e associates limited,software engineering limited
aae electrical ltd,software dinkum ltd
a a electrical contractors (solway) limited,software distributors ltd
a a electrical (east anglia) ltd,software engineering consultancy ltd
a a electrical installations ltd,software engine ltd
a a electrical services limited,software engineering experts limited
a a empire ltd,software  education limited
a a enterprise property ltd,software efficiency ltd
a a essex holdings limited,software eats the world ltd
a aesthetic clinic london ltd,software escape ltd
a aesthetics treatments ltd,software engineering solutions ltd
a a express solutions limited,software engineering logic ltd
a a express travel ltd,software engineering technology ltd
a a f accountancy ltd,software fabrik ltd
a a fashionwear ltd,software entity limited
a a fayli ltd,software enterprises (uk) limited
a a fencing limited,software experts group ltd
a. a. fine casting limited,software experts ltd
a a flags limited,software experience limited
a a f m s limited,software evolution limited
a a ford limited,software everything limited
a a f properties ltd,software focus international ltd
a a freeman & son ltd,software (europe) limited
a afridi limited,software escrow solutions limited
a afriyie ltd,software factory limited(the)
a a frozen food limited,software focus limited
a agafitei studio ltd,software 51 ltd
a a garage ltd,software for domain experts ltd
a a garden services limited,software for information theoretic applications limited
a a gardner & sons limited,software for data analysis limited
a a gas (midlands) ltd,software friends ltd
a a gbolade limited,software 4 all ltd
a a general haulage limited,software 4 u limited
a a gill limited,software for data analysis (finance) limited
a a gillespie limited,software for healthcare limited
a a glaze limited,software for solutions ltd
a a glazing (bristol) limited,software foundation limited
a. a. gledhill management services limited,software for numbers limited
a a global enterprise limited,software for sales limited
a a  global medical services ltd,software for people limited
a a g l trading limited,software genics ltd
a a goldstein ltd,software generation ltd
a a greere ltd,software genesis group limited
a a g rentals limited,software generation holdings limited
a a group uk holdings limited,software game play ltd
a a g training and consultancy limited,software fusion technologies limited
a a guest rooms ltd,software fusion limited
a ahad & co ltd,software genie limited
a a hair ltd,software guru ltd
a a halal meat limited,software guidance & assistance limited
a a halal meat & grocery ltd,software imaging technology limited
a. a. harper limited,software hatch ltd
a a hassim investments limited,software impact limited
a a haulage limited,software hamsters ltd
a a hazara builders ltd,software imaging group limited
a. a health care forever ltd,software heads limited
a aheer wy ltd,software house limited
a a h engineering services  limited,software hunter ltd
a a henry limited,software imaging limited
a a henry & sons limited,software hothouse ltd
a a h improvements limited,software hosting limited
a a h l ltd,software innovators ltd
a ahmad pharma limited,software informatics limited
a. ahmed & co (acctt) ltd,software innovations uk limited
a ahmed consulting ltd,software innovations limited
a ahmed medical ltd,software infotech ltd
a ahmed solutions ltd,software inspire limited
a. a. holmes limited,software in real time limited
a a homes ltd,software in partnership trustee limited
a a homes and housing ltd,software is us ltd
a a homes and housing (aylesbury) limited,software island limited
a a homes and housing (basildon) limited,software insight solutions limited
a a homes and housing basildon property ltd,software job ltd
a a homes and housing(coach house) ltd,software in partnership limited
a a homes and housing construction ltd,software ip limited
a a homes and housing(coombe farm) ltd,software integrators limited
a a homes and housing (coombe lodge) ltd,software integration management limited
a a homes and housing (croydon) limited,software installation limited
a a homes and housing (croydon) property limited,software landscape limited
a a homes and housing (cygnet house) limited,software into action limited
a a homes and housing (exchange court) limited,software languages ltd.
a a homes and housing (5 sydenham road) limited,software lab solutions ltd
a a homes and housing guildhall (portsmouth) limited,software know how ltd
a a homes and housing( hippodrome) ltd,software keys-sk ltd
a a homes and housing ( leslie ) limited,software kingdom limited
a a homes and housing (liverpool ) limited,software market ltd
a a homes and housing ( metro point ) limited,software licence consulting ltd
a a homes and housing (metro point) property limited,software links limited
a a homes and housing ( north west) ltd,software leaders limited
a a homes and housing (portsmouth) limited,software management tools uk ltd
a a homes and housing (premier) limited,software major limited
a a homes and housing (sutton) ltd,software management ltd
a a homes and housing(trafalgar) ltd,software machines limited
a a homes (yorkshire) ltd,software maintenance limited
a a housing limited,software micro ltd
a a howard limited,software luminiuos ltd
a a h planning consultants ltd,software medical devices limited
a a h software ltd,software media ltd
a a hutton llp,software media ltd
a a hydraulics limited,software medical informatics limited
a. a. ibrahim ltd,software mb limited
a a i building services limited,software might limited
a. a. i. fire systems ltd.,software-matters (software solutions) ltd
a a independent television productions limited,software masters ltd
a a installations limited,software minions limited
a a installation services limited,software mindscapes ltd
a. ainsworth & sons (jewellers) limited,software migrations limited
a ainsworth surveyors ltd,software of excellence united kingdom limited
a a integrated limited,software of excellence uk holdings limited
a a international ltd,software news ltd
a a interpreting service ltd,software network solutions ltd
a aird associates limited,software modernization technologies limited
a aird exchange ltd,software mountain limited
a. a. i. security systems ltd.,software mosaic limited
a a jacob ltd,software partners limited
a ajadi consulting ltd,software owl ltd
a ajadi property management ltd,software paradise ltd
a a jamal tax consultants limited,software overflow solution ltd
a a j building services ltd,software outsourcing services sos limited
a a jewellers ltd,software plan limited
a a jewitt and sons limited,software plus limited
a a j r solutions limited,software planet group ltd.
a akanni ltd,software power tools limited
a a kaya ltd,software perimeters ltd
a akbor consultancy ltd,software project solutions limited
a a kear electrical services limited,software projects ltd
a a k haulage limited,software programming solutions limited
a a k healthcare limited,software professional services limited
a akhtar ltd,software product development global ltd
a a konior limited,software productions ltd
a akonko limited,software pro company limited
a a krish medics limited,software primitives limited
a a krupski ltd,software quality limited
a a late shop limited,software publishing roll limited
a alavi limited,software quality assurance (management) limited
a a law (lancashire) ltd,software qa consulting ltd
a albrow engineering ltd,software quality solutions limited
a a l consultants limited,software quality consulting limited
a. alderson electrical ltd,software quality services ltd.
a aldridge groundworks ltd,software reference limited
a a leisures ltd,software rentals limited
a. alexander & son (electrical) limited,software safety solutions limited
a alexander builders limited,software radio technology limited
a alexander mechanical ltd,software safety limited
a alexander plumbing and heating limited,software research ltd
a alexander tiling limited,software reflections limited
a alexander tutoring ltd,software recruitment solutions limited
a alfred consultancy services ltd,software safari limited
a ali contracting limited,software risk limited
a ali healthcare limited,software right ltd
a ali logistics ltd,software revelations ltd
a alin varia ltd,software sales & development limited
a a lions ltd,software retail ltd
a ali properties limited,software retailers and developers ltd
a ali property investments limited,software sales management limited
a alisa limited,software rocks ltd
a allan services ltd,software scotland limited
a allen & son limited,software security advocate ltd
a. allen conservation & restoration limited,software sculptors limited
a allen construction ltd,software sciences limited
a. allen developments limited,software shift ltd
a allen electrical ltd,software shark ltd
a. allen investment services limited,software services group ltd
a allison ltd,software 64 ltd
a allman independent social work consultancy limited,software services (uk) limited
a allsopp limited,software server service ltd
a. allsopp marketing ltd,software solution design ltd
a  almuhaimeef ltd,software services worldwide ltd
a. a. locum solutions limited,software service europe limited
a a locums (widnes) limited,software simulations international ltd.
a a london mimi market ltd,software simulations limited
a a lovell ltd,software silo ltd
a alsiagh limited,software signals limited
a alterations ltd,software solutions consultancy limited
a. alterbridge limited,software solutions ai limited
a alvarez ltd,software solutions and training limited
a. alvarez catering ltd,software solutions by steve rowles ltd
a alvarez services ltd,software solutions north west limited
a a lyons ltd,software solutions (midlands) limited
a amac care limited,software solutions management ltd
a a macdonald limited,software solutions india limited
a a macdonald joinery & building contractor limited,software solutions group ltd.
a a macfarlane associates limited,software solutions international limited
a a machin electrical services ltd,software solutions ig limited
a a magdum ltd,software solutions financial ltd
a .amanda's limited,software solutions esd limited
a aman medical services ltd,software solved limited
a a marian ltd,software solution systems limited
a a marquees limited,software solutions south west limited
a a marriott limited,software solutions wigan limited
a a martial arts limited,software solutions (warwick) ltd
a a mason limited,software stack limited
a a mason (consulting) ltd,software space ltd
a a massen trading limited,software spectrum (uk) limited
a a max ltd,software spv 2 limited
a ambrose tm ltd,software spectrum holdings limited
a a m business solutions ltd,softwares systems ltd
a a m construction limited,software support limited
a a mechanise limited,software spv 1 limited
a a medical finance solutions limited,software supplies uk limited
a amer limited,software success limited
a am foods ltd,software subscriptions limited
a a.michaelides limited,software stuntmen limited
a a miller & son ltd,software strategy tools and consulting limited
a a mixers limited,software statements limited
a a modlinski consultancy limited,software strategy limited
a a molyneux builders limited,softwares world ltd
a a molyneux rentals limited,software surf ltd
a a moore & son ltd,software surgery limited
a a moorley limited,software studio ltd
a a morrison ltd,software systems limited
a. a. mortgages ltd.,software syntax limited
a. amor writes limited,software system global uk ltd
a a mosharaf ltd,software t&d limited
"a a mot centre, limited",software system support limited
a a m solutions ltd,software systems open for business limited
a anaesthetics ltd,software talent ltd
a anagnostopoulos limited,software systems developments limited
a a nails limited,software systems europe limited
a a naji transport limited,software systems ltd
a a naji transport ltd,software technology solutions ltd
a ana maria ltd,software systems and services limited
a a nathu limited,software technologies ltd
a a n consulting limited,software technologies consulting limited
a  +  a ltd,software techno limited
a & a accountants limited,software tech services limited
a and a accounting ltd.,software tech ltd
a and a accounting services limited,software technical management limited
a & a accounting solutions limited,food limited
a & a acquistions limited,food abc ltd
a & a administration limited,ahr traders limited
a & a agricultural contractors and plant hire ltd,doughboys group limited
a & a agriculture limited,food about you limited
a and aa ict consultancy ltd,ceres associates ltd
a & a & a ltd,food un limited
a & a and sons roofing ltd,bolek i lolek mansfield ltd
a & a appliance care limited,food abundance network limited
a & a appliances limited,food affair (cottingham) limited
a & aa property ltd,food affairs limited
a & a aquatics ltd,food advisory service limited
a & a arable limited,food adventure group limited
a and a architects llp,food action now! ltd
a & a ashcroft limited,food adventure social enterprise ltd
a & a asset management ltd,food advisor uk ltd
a & a assets ltd,food agro ltd
a & a autocare limited,food african market ltd
a & a auto electrical ltd,food after limited
a & a automatics limited,food academy uk ltd
a & a automotive services ltd,food a.i.d.e consulting ltd
a and a aviation flight department,food allergy immunotherapy limited
a & a bailey ltd,food allergy fit ltd
a & a banerjee ltd,food alchemy limited
a & a barr,food allergy aware limited
a & a bau limited,food allergy immunotherapy education ltd
a & a beauty ltd,food allergy friends limited
a & a beauty training ltd,food alive limited
a. & a. bell marquee hire limited,food alert limited
a & a bird holdings ltd,food and agricultural research management limited
a and a blinds ltd,food alcohol express limited
a & a brown limited,food amigo (quality management collaborations) ltd
a & a building surveyors limited,food and agricultural systems ltd
a & a business solutions ltd,food all lab ltd
a & a business supplies limited,food amalgamations limited
a & a cables ltd,food allergy information management system limited
t limited,food & away ltd.
t & l properties limited,food allergy testing limited
t choithram international sa,food allergy nottingham service ltd
t r t holding trust reg,food and beverage limited
align developments limited,food & behaviour research
the arabic gulf national association ( t a g n a ) ltd,food & bev consulting ltd
the black t company ltd,food & beverage international ltd
blaustein gmbh ltd,food & beverage interior solutions ltd
burnham investments limited,food and beverage ltd
calvert carpentry & construction limited,food & bed ltd
cbt (norfolk) ltd,food & beverage export spain limited
the controversial t shirt company ltd,food and beverage consultants limited
the divine greek t ltd,food & beverage connect ltd
the dotted t limited,food & beverage associates ltd
harbour multi-trades limited,food & beyond holdings limited
hayward wright 2021 limited,food and beverage brands limited
the i t service management forum international limited,food and board ltd
j.a. crescent dental care limited,food & bits ltd
the j & t consultancy (southern) ltd,food & beverage trademarketing limited
the j t l partnership limited,food and beverage network ltd
the j w t partnership ltd,food & beverage solutions (uk) ltd
kennedy logistics ltd,food & beverage (rrl) limited
kgh surfacing limited,food and beverage marketing ltd
kj&b real estate ltd,food and booze (midlands) ltd
the k t wong foundation,food & boundary limited
the lash brand by t ltd,food & catering services ltd
leeds building services limited,food and carry ltd
the london t limited,food & chi limited
marsh tech automotive ltd,food and brain health ltd
the mg 't' society limited,food & body peace ltd
mid rhd ltd,food and booze and co limited
the m t suterwalla family foundation,food and booze minimart limited
the n t pub co ltd,food & curry ltd
omnis global ltd,food and crunch limited
pivot to profit ltd,food and company (cumbria) limited
the players t s limited,food & dairy engineering co limited
the p t room ltd,food and community trust
rmp business services ne ltd,food & coffee ltd
sakeenah foundation,food and dessert station ltd
s&l civil engineering ltd,food and deserts co ltd
s b s metalworks ltd,food and desserts ltd
spares mx limited,food and dairy enterprises ltd
"the swallows (blocks q, r, s and t) management company limited",food & drink devon limited
t a limited,food & drink exportese limited
t a access ltd,food & drink consultancy ltd
t a a consulting limited,food & drink exporters association limited
t a advisory limited,food + drink limited
t a agri ltd,food and drink north east community interest company
t a aiken consulting ltd,food and drink entrepreneur of the year limited
t a a international limited,food and drink maintenance services ltd
t a & co developments ltd,food and drink marketing limited
t a and n catering limited,food & drink guides ltd
t a & robinson ltd,food & drinks grün ltd
t a & s e hollom limited,food and drink festivals uk ltd
t a & sons properties ltd,food and drinks galore limited
t a a work limited,food & drink store limited
t. a. bartlett (pallets) limited,food and drink federation(the)
t a b asset management ltd,food and drink services limited
t a bates limited,food and drink sector skills
t a baylis electrical services ltd,food and drink hub (scotland) limited
t abbott properties ltd,food and drink sector council limited
t a b builders limited,food and drink photos limited
t a bedford limited,food & education enterprise cic
t a b engineering limited,food and drink trails (scotland) limited
t a b enterprises limited,food & drink zone uk ltd
t abernethy and partners limited,food & drink tours ltd
t a best plumbing limited,food and drinks works ltd
t a birks limited,food & entertaining co ltd
t a blackamore limited,food and fat recovery solutions limited
t a blackett consulting limited,food and farming compliance ltd
t a blair funeral directors limited,food and events haven ltd
t a b project solutions limited,food & event design ltd
t abrahams global empire ltd,food & environmental ltd
t abrams limited,food & food ltd
