p a collings limited,all about plumbing and heating ltd
p a collins brickwork ltd,all about oats ltd
p a collins (farrier) limited,all about pies limited
p a colyer limited,all about podiatry ltd
p a comms limited,all about phones ltd
p a communications limited,all about polythene limited
p a conneely construction ltd,all about pets ltd
p a consultants limited,all about people (mediation and hr) ltd
p a contracts ltd,all about pet health limited
p a cook & co (high wycombe) ltd,all about print ltd
p a cookson limited,all about ponds limited
p. a. couriers limited,all about promotions ltd
p a cox trading limited,all about properties ltd
p a c rail ltd,all about rehab ltd
p a creative ltd,all about recruitment ltd
p a creative technical ltd,all about rentals ltd
p a cremin ltd,all about reel ltd
p a crocker limited,all about property investments ltd
p. a. crowe limited,all about publishing ltd
p a crowther transportation limited,all about quality limited
p a c t construction consultancy limited,all about property limited
p a c transport ltd,all about roofing (birmingham) limited
p acupuncture ltd,all about risk solutions ltd
p a dale,all about roofing limited
p adams developments limited,all about risk limited
p adams installations ltd,all about roofing services limited
p adams roofing ltd,all about resto ltd
p a davies electrical limited,all about results limited
p addison medical limited,all about response limited
p. addison removals ltd,all about rose limited
p adeniran consulting limited,all about safety limited
p a dental lab services ltd,all about skips ltd
p a designs architects ltd,all about skin limited
p. a. devlyn (financial services) ltd,all about scaffolding ltd
p a dhaliwal property limited,all about skin studio ltd
p a dodd ltd,all about shopping ltd
p a dodman building services ltd,all about shipping limited
p adrian ltd,all about sound ltd
p a duxbury limited,all about safes ltd
p a e limited,all about security ltd
p a edgar plumbing & heating ltd,all about sharepoint ltd
p a edwards limited,all about solar limited
p a edwards surfacing limited,all about speech therapy ltd
p a electrical and controls ltd,all about soft skills limited
p a electrical (grimsby) limited,all about softplay ltd
p a electrical (herts) ltd,all about sport limited
p a electrical (midlands) limited,all about smart homes ltd
p a electrical services (midlands) ltd,all about spines limited
p a enterprises limited,all about sneakers ltd
p a environmental services limited,all about stone ltd
p a eslick limited,all about stoves ltd
p a evans limited,all about sports events ltd
p a evans electrical limited,all about stem limited
p a excavations limited,all about stem events limited
p a fencing limited,all about that case ltd
p a f engineering services limited,all about thai ltd
p a fineberg limited,all about telecoms ltd
p a fire limited,all about sweets ltd
p a fire and security ltd,all about tailormade travel limited
p a fisher and son ltd,all about success ltd.
p a flooring ltd,all about the beer ltd
p a f media sales limited,all about the bean ltd
p a forestry & rural services ltd,all about the beats ltd
p afro-fusion bbq ltd,all about the baize ltd
p a funerals limited,all about the apps ltd
p a gardens and landscaping ltd,all about the bounce ltd
p a gauranteed limited,all about the boy ltd
p a g builders limited,all about the benjamins ltd
p a geddes consultancy ltd,all about the bees limited
p a g electronics limited,all about the dog ltd
p a general building services limited,all about the dog academy ltd
p a gibbons limited,all about the detail joinery limited
p a gibson engineering services limited,all about the data limited
p a gittins limited,all about stuff ltd
p a g kitchen installations limited,all about technology ltd
p a g leisure limited,all about that glass ltd
p a gooch limited,all about the baby limited
p a goodman ltd,all about the birds ltd
p. a. gotts limited,all about the cooks ltd
p. a. goudie consultancy limited,all about the core limited
p a gough painting contractors limited,all about the buildings limited
p a green brickwork limited,all about the face essex ltd
p a green electrical limited,all about the face ltd
p. a greener limited,all about the energy limited
p a green properties limited,all about the door limited
p a greig ltd.,all about the dress ltd
p. aguila healthcare services limited,all about the doll limited
p a hambling limited,all about the brand limited
p a hanlan ltd,all about the e limited
p a hannah heating and plumbing limited,all about the grind ltd
p a haran electrical contractors limited,all about the girl ltd
p a harper associates limited,all about the hair ltd
p a harris ltd,all about the love ltd
p a haualge limited,all about the magic cic
p a h carpentry & joinery ltd,all about the kids ltd.
p a h construction ltd,all about the love bridal ltd
p a heighton ltd,all about the house ltd
p a henery ltd,all about the journey ltd
p ahern consulting ltd,all about the melts ltd
p a hire limited,all about the home limited
p a home services ltd,all about the pets limited
p a hooley limited,all about the product ltd
p. a. howett limited,all about the people ltd
p a h plumbing & heating ltd,all about the olive wood limited
p a h trading limited,all about the office limited
p a hydraulics (n.e.) ltd,all about the saas ltd
p aiken limited,all about the now limited
p a impey ltd,all about the move ltd
p. ainley joinery ltd,all about the message limited
p a installations ltd,all about the setting ltd
p a investments limited,all about the shoes limited
p a investment solutions limited,all about training limited
p airey tail lifts limited,all about the sparkle beauty limited
p a jackman carpentry limited,all about timing ltd
p. a. james ltd,all about time limited
p a j consultants ltd,all about tours limited
p a jessop limited,all about toys ltd
p .a. jewellery limited,all about the trees limited
p a johnson transport logistics ltd,all about the story ltd
p a joinery and building contractors limited,all about u beauty ltd
p a jolly limited,all about u care services limited
p a jones limited,all about u ltd
p a jones (ivybridge) llp,all about travel ltd
p a jones (partners) llp,all about trust ltd
p. a. jones radiological services limited,all about trucks (geoff sipson) limited
p a j property agency limited,all about us - asd teens ltd
p a j property solutions ltd,all about upvc building plastics ltd
p a k consultants limited,all about transcription ltd
p a keep limited,all about upvc windows and doors ltd.
p akenzua limited,all about venues ltd
p akers flooring ltd,all about waste ltd
p akhtar ltd,all about vending ltd
p a kilby enterprises limited,all about uso ltd
p. a. knight builders limited,all about weddings ltd
p. a. k. o. hui ltd,all about words ltd
p a k services ltd,all about users limited
p a lambert limited,all about wool limited
p albert management company limited,all about windows limited
p alderman ltd.,all about wipes ltd
p a lettings limited,all about wine limited
p a leverton ltd,all about windows (southern) limited
p. a. l. glass machinery limited,all about weeds limited
p ali transport ltd,all about weddings group ltd
p.  allen limited,all about you hair & beauty ltd
p allen builders limited,all about you counselling and psychotherapy ltd
p allen decorating ltd,all about you coaching ltd
p allen management ltd,all about you care services limited
p allen plastering contractors ltd,all about writing ltd
p. allen services limited,all about you by ashley limited
p. allison & sons (demolition contractors) limited,f ltd
p. a. l. management limited,g limited
palmer p ltd,b ltd.
p a logistics t/a st james home improvements ltd,h limited
p a london ltd.,blindspot creative ltd
p alsop logistics limited,alpha studios london ltd
p a martin construction ltd,catlin ltd
p a matthews & co limited,berkeley psychiatrists ltd
p. ambrosch limited,alis designs limited
p. a. m. consultants ltd,q ltd
p a m developments limited,central pothole repairs ltd
p a meade ltd,brown recycling limited
p a mechanical limited,bisha transportation ltd.
p a michel limited,v ltd
p a moody recycling limited,ecobat resources uk limited
p. a. m. software limited,crispies harrow road ltd
p a murphy limited,5d uk real estate ltd
p a murphy carpentry ltd,5d uk operations ltd
p & a company limited,v limited
p & a adams (homes) ltd,h a accountancy limited
p & a advertising and marketing ltd,q abode ltd
p & a agencies limited,go straight solutions ltd.
p & a anderson limited,everton consultancy ltd
p. & a. antiques limited,dixi build ltd
p & a associates limited,alouette drylining limited
p & a audio visual ltd,popat associates limited
p & a automotive services ltd,phone & game wishaw ltd
p & a bakery limited,jm smith properties ltd
p & a barratt limited,prep coach uk ltd
p & a barton limited,q accountants ltd
p & a brickwork limited,'q' accountancy services limited
p. & a. brown (cardon),v a a investment ltd
p and a cabs limited,proud motion limited
p. & a. campbell limited,v a b pelican ltd
p & a carpentry ltd,v a&yanis ltd
p & a carpentry and joinery ltd,v a & j m martin limited
p & a catering group ltd,v a building ltd
p & a cholwill limited,v a building services ltd
p & a commercials (wales) ltd,the dotted t limited
p & a construction co. ltd,h a accountancy services ltd
p & a construction building services limited,the j t l partnership limited
p & a construction (cambridge) limited,h a amos limited
p and a construction group limited,h a agricultural contractors limited
p & a construction solutions ltd,h a accountants ltd
p & a consultancy cymru limited,the j & t consultancy (southern) ltd
p & a consulting (bristol) limited,harbour multi-trades limited
p & a contractors limited,j.a. crescent dental care limited
p & a contracts ltd,h a & sons ltd
p & a contracts (uki) ltd,h a & m properties ltd
p & a croft (farmers) limited,habit h limited
p & a cross investments ltd,h abdullahi limited
p & a cuthbertson ltd,h academy ltd
p & a c whitfield driver solutions limited,h a & t patel limited
p & a developments (devon) ltd,h a & y j a e ltd
p & a developments (london) ltd,v adams group holdings ltd
p & a earth solar project ltd,v a condtuction ltd
p & a electrical contractors limited,h - a business consulting ltd
p & a electrical services limited,v acquisition limited
p & a engineering consultants limited,h a b kindergartens limited
p & a environmental limited,h a b leadworks limited
p & a estate control llp,v a d engineering limited
p & a ettles & son timber harvesting ltd.,v a decor limited
p & a events limited,v a developments ltd
p and a eyecare limited,v a e enterprises limited
p & a fairhurst limited,v accounting ltd
p & a farming limited,v accountants limited
p & a farren ltd,v a electrical & contractors limited
p and a fencing and sheds limited,the k t wong foundation
p & a francis properties limited,kpmg systems ltd
p & a fruit limited,kj&b real estate ltd
p & a gas services limited,kgh surfacing limited
p & ag consulting limited,the lash brand by t ltd
p & a gell-rathbone ltd,leeds building services limited
p & a glazing contractors limited,the mg 't' society limited
p & a global ltd,sakeenah foundation
p & a grey limited,the players t s limited
p & a grieve,omnis global ltd
p & a grounds maintenance limited,s&l civil engineering ltd
p & a groundworks limited,rmp business services ne ltd
p & a group investments limited,the p t room ltd
p & a hannigan limited,h a cars limited
p & a harrison ltd,h accessories limited
p & a harrison builders limited,h a c builders limited
p & a hayward limited,s b s metalworks ltd
p & a henderson limited,the n t pub co ltd
p & a heritage ltd,h accountancy ltd
p and a hodges limited,h a chalmers (glenbarry) limited
p & a holdings (nw) limited,h a c g consultancy ltd
p & a holdings (uk) limited,h a chunu & co limited
p & a home mate ltd,h achouch limited
p & a hurst holdings limited,h a chen limited
p & a hydraulics limited,h a chaudry limited
p & a imaging limited,h accounting  solution limited
p & a insolvency services limited,h a clarkson limited
p & aj limited,v a general service ltd
p & a j cattee (wholesale) ltd.,v a g repair services limited
p & a jennings holdings limited,v a generators limited
p and a jewellers limited,h a company investment limited
p and a joinery limited,v aggarwal estates limited
p & a jordan investments ltd,h a commercial cleaning limited
p. & a.j. pickup limited,v. a. hutchison flooring limited
p & a kennedy limited,v a lawrence limited
p & a king brothers agriculture ltd,v a jones (runcorn) ltd
p & a lamb consulting ltd,v a hoppitt limited
p & a land ltd,v a henderson & son limited
p & a land developments limited,v a heating holdings limited
p & a legacy holding ltd,h a commerce ltd
p & a lettings ltd,h a c m limited
p & a lloyd consulting limited,spares mx limited
p & a london limited,t a access ltd
p & a love limited,t a limited
p & a luker hire limited,v a machinery limited
p & a maintenance ltd,"the swallows (blocks q, r, s and t) management company limited"
p & a maintenance services ltd,t a advisory limited
p & a management limited,t a a consulting limited
p & a management services ltd,t a a international limited
p and a marine services limited,t a aiken consulting ltd
p & a mars motors limited,t a & s e hollom limited
p & a mcguigan limited,t a & robinson ltd
p & a medical limited,t a and n catering limited
p & a m fletcher opticians limited,t a & co developments ltd
p. & a.m. holmes-smith,t a agri ltd
p & a mill construction ltd,h a construction ltd
p & a mining machinery services limited,h a construction services ltd
p & a mitchell limited,t a bates limited
p & a moore ltd,h a c technologies limited
p & a morgan ltd,h a c solutions ltd
p & a morgan optical limited,h a contractors limited
p. & a. motorcycles limited,h a c s engineering limited
p & a multi trader limited,h adamali limited
p and a oliver plumbing & heating limited,t abbott properties ltd
p. & a. packing (northern) limited,h active pt ltd
p & a painting & decorating contractors ltd,h. a. d. enterprise shetland ltd
p and a pallets limited,h a c transport limited
p & a pallets nw ltd,t a baylis electrical services ltd
p & a plant supplies limited,hadassah h ltd
p & a plastering and floor screeding contractors limited,h. adamson & son (farmers) limited
p & a precision (engineering) limited,h a direct ltd
p & a precision (holdings) ltd.,haddad trading h & h limited
p & a projects limited,h advice ltd
p & a properties limited,h a d software limited
p & a properties (cambridge) ltd,h a d international limited
p & a properties (merseyside) limited,t a b asset management ltd
p. & a. properties (1989) limited,h advisors limited
p & a properties services ltd,h adenwalla & co limited
p & a properties (sw) limited,t a & sons properties ltd
p & a properties wirral ltd,t. a. bartlett (pallets) limited
p & a property & finance ltd,t a a work limited
p & a property (weston) limited,t a b builders limited
p & a quinn facilities limited,v & a limited
p & a rann construction limited,v a morrall limited
p & a real estates ltd,val v energy limited
p and a research and consulting limited,t a b enterprises limited
p & a residential parks limited,t a b engineering limited
p and a sales and lettings limited,t a bedford limited
p & a security and facilities management limited,val v limited
p & a services limited,t a best plumbing limited
p & a services (essex) limited,t a blackett consulting limited
p & a services south west limited,t a blair funeral directors limited
p & a sharville limited,t a blackamore limited
p & a s hayselden limited,t abrahams global empire ltd
p & a shopfitting limited,t a b project solutions limited
p & a sidgwick limited,t a brooks consultancy ltd
p & a skibinski contractors limited,t. a. brockbank limited
p & a software solutions (uk) limited,t abrokwa consultancy ltd
,t a building services limited
,t a browne contract services ltd
,t abrams limited
,v & a & r ganatra limited
,v and a artist management ltd
,h a eagle investments limited
,t a burke limited
,v. & a. automotive limited
,v & a associates limited
,t a business european ltd
,v & a chandelier cleaning limited
,v & a coatings limited
,h a fanshawe limited
,v & a building limited
,v & a construction ltd
,v & a communications uk ltd
,v & a auto repairs ltd
,h a f corporation ltd ltd
,v and a consultancy (n.i.) limited
,v & a co (uk) limited
,v & a cottage ltd
,v & a consultancy ltd
,v and a consulting services ltd
,h a 475 limited
,h a for training and consultant ltd
,v & a drylining ltd
,v & a developers ltd
,h. agyemang limited
,h. ahad & co ltd
,h a goddard & sons limited
,v & a creations ltd
,t a carpentry & construction (midlands) limited
,t a callear consultancy ltd
,t accountants & co ltd
,t a c consulting ltd
,t accounts limited
,t accounting advisors ltd
,t a caterers limited
,t a carpentry & joinery limited
,t accounts services limited
,t accounts (nw) ltd
,h. agbaje property ltd
,t a conversions limited
,t a consultancy limited
,t a consultancies ltd
,t a cowperthwaite limited
,t a colbourne projects ltd
,t a cowan ltd
,t a costello & co. ltd.
,v & a (dundee) ltd
,t. a. cloud limited
,t. a. clifford limited
,v & a flooring limited
,v & a entertainment ltd
,v & a finest dry cleaners ltd
,v & a events limited
,v & a it consultant limited
,v & a hydraulics limited
,v and a homes limited
,v & a jobs uk ltd
,v & a holdings limited
,v & a guardians ltd.
,v & a lettings limited
,v & a (glasgow) ltd
,h ahmed investments ltd
,h ahmed contracting ltd
,h ahmed ltd
,h ahmad consulting ltd
,h. a. hyatt & co limited
,h a h south west limited
,h a homes limited
,h aistrop & sons limited
,hair by nic j h ltd
,hair at h ltd
,h a international uk ltd
,h a intercontinental limited
,h a install ltd
,h a incorporations ltd
,t a craig limited
,haideh h consultancy limited
,t. a. d. electrical limited
,t. addison plumbers ltd.
,t. a. d. builders limited
,t adam limited
,t a cullum contracting ltd
,t action films ltd
,t a downey limited
,t a digital marketing ltd
,t a dickson ltd
,t a design limited
,t. adelodun engineering solutions limited
,t a drilling (sales) limited
,t a design and build ltd
,t adomakoh limited
,t a electric company ltd
,t. a. driving services limited
,t. a. d. properties investments limited
,t a d electrics uk limited
,t a dunleavy limited
,h a jaan international limited
,h a hamer & grandson limited
,h a hallyburton ltd
,h a jewellers ltd
,"h a holdings, limited"
,h a k consultancy ltd
,h a l holdings ltd
,h a lettings ltd
,h a lee electrical installation & testing co. ltd
,h a lauste construction and landscaping ltd
,h. ali consultancy ltd
,h alexander trading ltd
,h alajeel ltd
,v & a properties limited
,h a l property limited
,h alissa ltd
,h a logistics ltd
,h. allan & son limited
,h a locum services limited
,h. allott limited
,h alkarnaz ltd
,t a electrical contractors ltd
,v & a real estate limited
,t. a. elliott ltd
,t a electronics ltd
,h ali law ltd
,h ali property ltd
,v & a webb ltd
,t a electrical solutions limited
,h akram ltd
,v & b cards limited
,v & b building construction ltd
,t a fisher limited
,v & b cleaning limited
,t a fisher commercial limited
,t a fisher & sons limited
,v & b hair & beauty ltd
,v & b bathrooms installations limited
,v & b news limited
,v & b investments ltd
,v & b paving limited
,v & b property limited
,v & b holdings limited
,v and b property services ltd
,h a management (nw) limited
,h. a. lyken & sons
,h alsop consulting ltd
,h al-salman car hire limited
,h a m a security & cleaning services ltd
,h a marks homes ltd
,h a manchester ltd
,h a l r o properties ltd
,hamdia h services limited
,h a mckenzie ltd
,hamdan mcr ltd
,h a murphy ltd.
,h. ambler & sons limited
,h a motors ltd
,h a morgan ltd
,h a modern homes ltd
,h a may services ltd
,h a maxwell limited
,h a may services limited
,h a maxwell management limited
,t a francis electrical limited
,v and brother ltd
,v. and.b trans ltd
,v & c family care ltd
,v and b services limited
,v & b virtual building ltd
,v & b uk properties ltd
,v & b's limited
,v & c maintenance ltd
,v & cie ltd
,v & c (sw) commercials limited
,v & c sales limited
,v and c engineering ltd
,v & c (sw) limited
,v and c relocation services ltd
,v & c dispensary north ltd
,v & c property developments ltd
,v & c happy days properties ltd
,v & c goaman properties limited
,h a murphy administrative services ltd
,v & c limited
,t a fitness and health ltd
,v and b retail limited
,hanchant construction ltd
,h & a adventure play limited
,h & aa limited
,t a gaunt limited
,h & a limited
,h & a bal haulage limited
,h & a bella limited
,h & a builders ltd
,h & a bros investors ltd
,h & a buchan ltd
,h & a bespoke metalwork limited
,t. a. green & sons (down farms) limited
,h & a catering ltd.
,h & a cards limited
,h & a building construction ltd
,v & d transport services ltd
,v & d tilling ltd
,v & d motors limited
,t a h construction ltd
,v & e european aircraft sales limited
,v & e estates ltd
,v & e consulting ltd
,v & e marketing ltd
,v & e joiners limited
,v & e transport ltd
,v. anderton holdings limited
,v & e property investment ltd
,v & f estates limited
,v & f beauty lounge ltd
,v & f ltd
,v &e tyres ltd
,v & e properties ltd
,v & e tyre recycling ltd
,v and d construction and maintenance service ltd
,v & c ventilation ltd
,v & c (sw) properties limited
,h & a consortium ltd
,h & a construction ltd
,h & a collection ltd
,t a hardwick construction limited
,t. a. hamilton ltd
,t ahamed ltd
,t a hazelton transport limited
,t ahmad consultants ltd
,t a h industries limited
,t a hearty building services limited
,t a h plumbing limited
,t a hodgson limited
,t ahmed ltd
,t a h maintenance ltd
,t a hill & son limited
,v & f film services ltd
,v & f pub management & catering ltd
,v & f giddings property maintenance limited
,v & f estates (northampton) limited
,v. & f. parker limited
,v & f investments limited
,v & f homes limited
,v & f sheet metal company limited
,h and a convenience store ltd.
,h & a contracts limited
,v and g consultancy ltd
,v & g construction services limited
,h & a couriers ltd
,h & a developments ltd
,h & a developers limited
,v & g italia limited
,h & a corporation ltd
,v & g group limited
,h & a dry cleaners ltd
,h & a equestrian limited
,h & a entertainments ltd
,h and a enterprise holdings limited
,h & a direct limited
,h & a engineering ltd
,v & g (ringwood) limited
,h & a halal meats ltd
,h & a glover limited
,h & a hairstyle ltd
,h & a height services ltd.
,h and a hire ltd
,h & a graphic design limited
,h & a fashion limited
,h & a fitness limited
,v & g holdings ltd
,v. & g. furnishings limited
,v & g flooring limited
,v & g equestrian services limited
,v and g management limited
,v & g company ltd
,v & f services limited
,t ajax electrical and plumbing limited
,v and h developments limited
,t a joinery & construction ltd
,t a joinery ltd
,v & g sisters ltd
,v & h heating & electrical services limited
,v & h joinery ltd
,v and h roofing ltd
,v & h retail limited
,v & h lift contractors limited
,v & h kandala ltd
,v & h investments ltd
,v & h services limited
,v & h sellers ltd
,v & i joinery ltd
,v & i drylining ltd
,h & a holdings limited
,v & i carpet cleaning ltd
,h & a hot food ltd
,h & a it trading limited
,h & a kebab ltd
,h & a leisure ltd
,h & a joinery services limited
,h. & a.k. fletcher limited
,h & a investments limited
,t a jones ltd
,h & a locum ltd
,t. a. k contractors ltd
,t a jones contracting ltd
,t akanni ltd
,t a jones properties limited
,t a knox limited
,t a kittow & sons limited
,t. a. law limited
,t a l computer services limited
,t a lancaster contracting limited
,v & i lettings limited
,t. alexander ltd
,v & j ltd
,v & j developments ltd.
,v & j consultants ltd
,v & j holdings limited
,v & j drinks limited
,v & jj limited
,v. & j. investments limited
,v & j online ltd
,v & j knitwear limited
,v & j consultancy ltd
,v & j property ltd
,v & j inspirations ltd
,v & j properties limited
,v & j quelch & son limited
,v & j private ltd
,v & j baker ltd
,v & j builders limited
,v & j bar and restaurant limited
,talking t's limited
,t a licensed grocers ltd
,t. ali & sons limited
,t a leisure ltd
,t. alexander & co. (lisburn) limited
,t ali & co uk limited
,v & j pharmacy limited
,t alderman limited
,t a l construction ltd
,t alabaster construction limited
,talking t's of cambridge limited
,h & a mechanical services limited
,h & a (marketing) limited
,h & a management services ltd
,t. allen alloys ltd
,t. allen engineering services limited
,t allen developments ltd
,t allen design limited
,t allen holdings limited
,t allen healthcare ltd
,t allen funeral services limited
,t allen engineering services trustees limited
,t. allen stockholders limited
,t alltree & son ltd
,t. allman butchers ltd.
,t. alun jones limited
,v and k builders ltd
,v and k bespoke events limited
,t alun jones & son
,t a locum services limited
,v & k imports ltd
,h & a medical services limited
,v & k potatoes limited
,v & k imports & distribution ltd
,h & a motor services ltd
,v & k immobilien ltd
,h & a motorss ltd
,h & a motivation limited
,h & a patisserie ltd
,h & a partners ltd
,h & a pallets ltd
,h & a properties ltd
,h & a projects limited
,h & a plumbing & heating ltd
,h & a properties (liverpool) ltd
,h & a optometrists limited
,h & a properties (malvern) limited
,h & a properties management ltd
,h and a (notts) ltd
,h & a properties (hull) limited
,h and a pizza limited
,h and a optical group limited
,h & a 10 ltd
,t a l x ltd
,tamara t limited
,t a machines ltd
,v + k steel services limited
,t a magnets limited
,h & a midlands limited
,v & k services limited
,t a medical ltd
,t a m import & export limited
,t ames properties limited
,t a mercer limited
,t a mcmahon optometrists limited
,t a mason ltd
,t a m insulation ltd
,t. a. medical services ltd
,t a morris leisure limited
,t a minimarket ltd
