,beauty bae academy limited
,beauty bankks ltd
,beauty bags limited
,beauty bar (calcot) ltd
,beauty bar at the mill ltd
,beauty banks
,beauty bar desborough ltd
,beauty bar ldn ltd
,beauty barks ltd
,beauty bar (kettering) ltd
,beauty bar (hinckley) ltd
,beauty bargains 2020 limited
,beauty bar products ltd
,beauty bar one limited
,beauty bar nw ltd
,beauty barn training academy ltd
,beauty barn mobberley salon & training academy ltd
,beauty barn clinic limited
,beauty bar salons ltd
,beauty bar surrey ltd
,beauty bar warsash ltd
,beauty bars london limited
,beauty base (blackpool) limited
,beauty base 1 ltd
,beauty base nw ltd
,beauty base by sharnelle limited
,beauty base limited
,beauty basis ltd
,beauty basics glasgow ltd
,beauty basics skincare centre limited
,beauty base (slough) limited
,beauty base on-line limited
,beauty basics limited
,beauty bazaar london ltd
,beauty bazaar limited
,beauty bay limited
,beauty bath junkie limited
,beauty basket ltd
,beauty bean ltd
,beauty be ltd
,beauty beat communications limited
,beauty beat ltd
,beauty beast ltd
,beauty beat events ltd
,beauty beautique ltd
,beauty bee ltd
,beauty bee cosmetics ltd
,beauty beauty hair ltd
,beauty beehive ltd
,beauty beee limited
,beauty belle kent ltd
,beauty bella boutique limited
,beauty bee with debs ltd
,beauty bee studio ltd
,beauty bee services ltd
,beauty beneath limited
,beauty bells ltd
,beauty bench limited
,beauty beneath floor sanding ltd
,beauty beneath hairdressing ltd
,beauty beneath salon limited
,beauty benefits ltd
,beauty beneath weddings limited
,beauty berie ltd
,beauty bey ltd
,beauty bexhill limited
,beauty birdies ltd
,beauty bisou ltd
,beauty biology ltd
,beauty bible limited
,beauty bet ltd
,beauty bi amy ltd
,beauty beyond aesthetics limited
,beauty blends skin care ltd
,beauty blender wash pro limited
,beauty bits limited
,beauty @ blagdon limited
,beauty blends ltd
,beauty blessed ltd
,beauty bliss limited
,beauty bloom ltd
,beauty bloom clinic ltd
,beauty blocks ltd
,beauty bloc limited
,beauty bliss therapies limited
,beauty blushes ltd
,beauty blush bar limited
,beauty blush limited
,beauty b official ltd
,beauty body centre ltd
,beauty bold pr ltd
,beauty bodies ltd
,beauty board for non-surgical beauty education the art of shaving fashion and etiquette ltd
,beauty bloomer limited
,beauty blossom ltd
,beauty bombshell limited
,beauty bomb ltd
,beauty bomb kilmarnock limited
,beauty bond pro ltd
,beauty boost beauty and hair saloon ltd
,beauty boosters ltd
,beauty born ltd
,beauty boss ltd
,beauty boosters aesthetics ltd
,beauty booth (merthyr tydfil) limited
,beauty boulevard ltd
,beauty botanic limited
,beauty boss london ltd
,beauty boss ltd
,beauty bounty limited
,beauty bound (nottingham) limited
,beauty bounce ltd
,beauty bound ltd
,beauty boutique & aesthetics ltd
,beauty boutique (baildon) ltd
,beauty boutique bromyard limited
,beauty boutique fair oak limited
,beauty boutique fife ltd
,beauty boutique of pateley bridge ltd
,beauty boutique nails and beauty bar ltd
,beauty boutique hanbury limited
,beauty boutique kensington ltd
,beauty boutique yorkshire ltd
,beauty boutique (wigston) limited
,beauty boutique spondon limited
,beauty box aesthetics limited
,beauty box limited
,beauty boutique zim ltd
,beauty box birmingham ltd
,beauty box barnt green ltd
,beauty box aesthetics (cardiff) ltd
,beauty box boutique (2020) ltd
,beauty box boutique ltd
,beauty box bw ltd
,beauty box brooklands ltd
,beauty box bristol limited
,accrington road bathrooms ltd
,the auto alchemists ltd
,ammar food service limited
,amg ventures opti ltd
,ak building for you ltd
,bean n baked ltd
,birches care ltd
,blue-chip property developments ltd.
,campervan components limited
,bright vision investment ltd
,bohemia lymington ltd
,claygate distribution holdings limited
,channel b productions ltd
,changs paisley road limited
,conteanent ltd
,cultivate group ltd
,claygate group limited
,cloak lane ec4 limited
,epic mushroom ltd
,copsewood limited
,complete cover recruitment ltd
,eleni dance ltd
,eco marine foods ltd
,east midlands green transit ltd
,dark tales ltd
,cultural infrastructure limited
,era education ltd
,ether property management ltd
,fairgate capital ltd
,eurotex (btp) corporation limited
,food superstores ltd
,financial reporters ltd
,45 sre ltd
,5 why's consulting ltd
,honest-d limited
,hmgs group ltd
,graham house limited
,jc new age entertainment ltd
,indifold doors limited
,id freight ltd
,hurn forest canine rehabilitation ltd
,local charcoal limited
,law quality homes ltd
,kumasi market peckham ltd
,just joe garner ltd
,mings chinese takeaway limited
,metalect ltd
,new aaa ltd
,ndp automotive ltd
,new abaseen limited
,new abbey ltd
,new a+m hire limited
,new abbey stores ltd
,new abbey properties
,new abergavenny sushi ltd
,new aberdour ltd
,new abercrombie limited
,new abc chippie limited
,new ability (torbay) limited
,new ability limited
,new abilities property management ltd
,new abode (london) ltd
,new abode limited
,new abingdon sushi ltd
,new academic science limited
,new access group ltd
,new accounting solutions ltd
,new access uk ltd
,new access (east anglia) limited
,n.e.w. accountancy services limited
,new accountancy and financial services ltd
,new ach limited
,new aceville publications limited
,new aceville magazines limited
,new acoustics limited
,new ace limited
,new accrual limited
,new acorn developments ltd
,new acre electrical limited
,new acre electrical holdings limited
,new acre projects ltd
,new acre living ltd
,new acres limited
,new acres caravans limited
,new acres developments ltd
,new acre tree services ltd
,new acre services limited
,new acre wood management limited
,new a.c.t carpets ltd
,new acton limited
,new action limited
,new addington pathfinders
,new addington peoples' carnival
,new addington ltd
,new addition windows (timber) ltd
,new addition windows limited
,new additions ltd
,new addington peri peri chicken ltd
,new adv ltd
,new ad spot ltd
,new adriatica limited
,new adelaide food ltd
,new adventure homes ltd
,new advance limited
,new adventurelands limited
,new adventure (norfolk) limited
,new adventures limited
,new adventures (doncaster) limited
,new adventures diving ltd
,new adventures charity
,new adventures midnight bell limited
,new adventures nutcracker limited
,new adventures in pixels ltd
,new adventures in enterprise limited
,new adventures sleeping beauty limited
,new adventures red shoes limited
,new adventures r&j limited
,new adventures verona limited
,new adventures services limited
,new adventures partnerships limited
,new adventure travel limited
,new adventures travel limited
,new adventures swan lake limited
,new adyan limited
,new advertising services ltd
,new affirmative limited
,new affinity limited
,new afg supermarket ltd
,new aera ltd
,new africa nation ltd
,new africa food company limited
,new africa comics ltd
,new africa analysis limited
,new african woman magazine ltd
,new africa ltd
,new africa trading limited
,new african tv ltd
,new african beauty uk limited
,new african projects and business ltd
,new afton ltd
,new africa tv ltd
,new afro traders ltd
,new afton spicy limited
,new age abacus limited
,new again ltd
,new age accountants ltd
,new age aesthetics ltd
,new age beauty limited
,new age automotive ltd
,new age agency and services limited
,new age after school club ltd
,new age builds limited
,new age broadcasting ltd
,new age boiler installations ltd
,new age beer limited
,new age climbing ltd
,new age care centre ltd
,new age care limited
,new age capital limited
,new age childcare services limited
,new age cleaning ltd
,new age care solutions limited
,new age clothes ltd
,new age clothing limited
,new age coach ltd
,new age construction ltd
,new age confectionery limited
,new age consult (residential) limited
,new age consulting vigh limited
,new age demand limited
,new age contracting limited
,new age consult limited
,new age data ltd
,new  age crypto gold ltd
,new age contractors limited
,new age developers limited
,new age design uk ltd
,new age developers (lothian) limited
,new age digital media limited
,new age digital limited
,new age developers rentals limited
,new age development group ltd
,new age developers trading limited
,new age dragon clothings limited
,new age distribution ltd
,new age dry cleaners ltd
,new age driveways & patios limited
,new age electrical oxford limited
,new age electrical group limited
,new age drycleaning ltd
,new age entertainment limited
,new age engineering ni ltd
,new age energy ltd
,new age fashion ltd
,new age era limited
,new age fitness ltd
,new age events limited
,new age firm limited
,new age games limited
,new age finance ltd
,new age flooring limited
,new age funding limited
,new age glass limited
,new age global ltd
,new age greenworld limited
,new age health ltd
,new age glazing limited
,new age healthcare solutions limited
,new age healthcare limited
,new age group ltd
,new age human limited
,new age hippy ltd
,new age horizons limited
,new age hipster limited
,new age hemp limited
,new age innovation limited
,new age imagery ltd
,new age hydroponics ltd
,new age interiors ltd
,new age international marketing ltd
,new age international (uk) ltd
,new age it solutions limited
,new age investments limited
,new age leaders ltd
,new age laundry ltd
,new age landscaping ltd
,new age joinery ltd
,new age marketing limited
,new age making ltd
,new age london limited
,new age lettings limited
,new age media enterprises limited
,new age marketing network uk ltd
,new age media limited
,new age marketing agency ltd
,new age metropolis ltd
,new age mep services ltd
,new age marketing & advertising ltd
,new age mental health ltd
,new age medical limited
,new age media (nam) limited
,new age motors limited
,new age motor sales limited
,new age music limited
,new agenda (construction) limited
,new agenda ltd
,new age nomads ltd
,new agenda (london) limited
,new age plant ltd
,new age personal training ltd.
,new age paving limited
,new age pavement lights limited
,new age professionals ltd
,new age of science technology limited
,new age ppe limited
,new age plumbing and heating services ltd
,new age plumbing and heating limited
,new age productions limited
,new age plumbing & heating solutions ltd
,new age property ltd
,new age project limited
,new age publishing limited
,new age property solution (naps) limited
,new age protection limited
,new age property management ltd
,new age realty ltd
,new age pubs & entertainment ltd
,new age pubs limited
,new age resource limited
,new age rebel ltd
,new age removals limited
,new age roofing ltd
,new age renewables ltd
,new age shutters ltd
,new age retro ltd
,new age resource ltd
,new age smoke ltd
,new age services limited
,new age recruitment ltd
,new age security ltd
,new age software solutions (uk) limited
,new age solar systems ltd
,new age solutions limited
,new age spirit limited
,new age sparks ltd
,new age sports group ltd
,new age sports limited
,new age sport management (uk) ltd
,new age sport management ltd
,new age store ltd
,new ages technologies ltd
,new age stone ltd
,new age tk ltd
,new age technologies limited
,new age support services ltd
,new age transport ltd
,new age touring productions limited
,new age trading ltd
,new age uk limited
,new age views ltd
,new age welding & fabrication limited
,new age vision limited
,new agile solutions ltd
,new aggregate limited
,new age wines ltd
,new agravain advisory limited
,new agricultural & industrial technology (nait) limited
,new aitchy ltd
,new airways pension scheme trustee limited
,new air technical services limited
,new air southern limited
,new air climate control ltd
,new al-amir indian cuisine ltd
,new aladdin ltd
,new aj services ltd
,new albany property developments ltd
,new alaska ltd
,new alba (st albans) limited
,new albion ltd
,new albert road kebab ltd
,new albion energy ltd
,new albion property limited
,new alchemy limited
,new albion wind limited
,new albion real estate ltd
,new ali express limited
,new alegria limited
,new alchemy training and consultancy organisation limited
,new alhambra bar bellshill ltd
,new alisha (tipton) supermarket ltd
,new alisha polski sklep limited
,new alisha (cape hill) supermarket ltd
,new alisha (wolverhampton) supermarket ltd
,new alisha (walsall) supermarket ltd
,new alkis restaurant limited
,new all digital marketing ltd
,new all gears limited
,new alley limited
,"new alliance principium, pryncypium nowego przymierza fiducia ltd"
,new alliance capital ltd
,new alliance group ltd
,new alliance (edinburgh) limited
,new alloa ltd
,new allies transport limited
,new allies security services ltd
,new allied stores ltd
,new allotment ltd
,new alliance services limited
,new alphabet limited
,new almond limited
,new al-madina grocers limited
,new alpha partners ltd
,new alphabet group limited
,new alpha innovation uk limited
,good abees limited
,give pay limited
,barworks (haggerston) ltd
,give finance limited
,cleaning bio ltd
,britz health care ltd
,good company limited
,good accountant ltd
,good accountancy services limited
,good accounts uk ltd
,good able international trading limited
,good adam consultancy limited
,good ad ltd
,good advice debt company limited
,good advice ltd
,good activities ltd
,good adventures cic
,good advices consulting ltd
,good advice public relations limited
,good advice for living ltd
,good african brand ltd
,good advice uk limited
,good afro ltd
,good aim limited
,good agricultural environment company limited
,good age care limited
,good afternoon ltd
,good ancestor movement limited
,good alpha limited
,good ancestor limited
,good alternatives limited
,good & co solicitors ltd
,good & cheap limited
,good and better ltd
,good and drink plus ltd
,good & bad limited
,good and design ltd
,good and evil capital ltd
,good & good limited
,good and fine limited
,good and faithful un- limited
,good and green ltd
,good and fair shop ltd
,good & good investments limited
,good and lucky ltd
,good & honest limited
,good & proper limited
,good & novel limited
,good and grey ltd
,good & proper studio ltd
,good and proper stuff limited
,good & proper tea co ltd
,good and nice limited
,good and proper bristol ltd.
,good & son limited
,good and proper zero weston cic
,good and sheppard consulting ltd
,good & stewart limited
,good & trusted wills ltd
,good & trusted storage ltd
,good & tillotson ltd
,good and useful ltd
,good annotations limited
,good & trusted legal services ltd
,good angels propety ltd
,good & young ltd
,good appearance ltd
,good and useful trading ltd
,good app guide ltd.
,good answers ltd
,good apple independent school ltd
,good apple limited
,good as gold childminding services ltd
,good as gold limited
,good apps ltd
,good as gold jewellers limited
,good as gold group limited
,good as gold london limited
,good as gold tattoos limited
,good as gold writing services limited
,good as media ltd
,good as new ltd
,good as new gifts ltd
,good as medical ltd
,good as new ( n i ) limited
,good as new emergency cleaning ltd
,good as new developments ltd
,good as new cleaning services ltd
,good as property limited
,good at work ltd
,good attitude ltd
,good associates limited
,good as new windscreens ltd
,good autos service centre ltd
,good autos limited
,good az new windscreens ltd
,good aviation limited
,good barbers ltd
,good baby pte. ltd
,good barber club limited
,good baby uk ltd
,good bbq uk ltd
,good balance limited
,good bargain traders ltd
,good bargains ltd
,good bare ltd
,good barbers guide limited
,good beans ltd
,good beans ltd
,good bean mad coffee limited
,good beagle international ltd
,good beauty international holding limited
,good beauty guide limited
,good bear films ltd
,good bee projects ltd
,good bee co london ltd
,good behaviour education limited
,good beginnings ltd
,good beer club ltd
,good bi ltd.
,good beyond ltd
,good beverage company limited
,good behaviour limited
,good better best training ltd.
,good belly vegan pizzeria ltd
,good bluehouse limited
,good blue limited
,good bones limited
,good big brother limited
,good bicycles ltd
,good binary ltd
,good bookkeeping (uk) ltd
,good books accounting services limited
,good books and services limited
,good boy ltd
,good boost wellbeing limited
,good botanics cic
,good books (farnham) limited
,good boost community wellbeing cic
,good boyfriend ltd.
,good boy films limited
,good boy records ltd
,good boy burger ltd
,good boy developments limited
,good boy.com (yorkshire) limited
,good boy technologies ltd
,good boy group ltd
,good boy london ltd
,good boy inc. ltd
,good boy pet foods limited
,good boy trading limited
,good brands for good people ltd
,good brains for good brands limited
,good brand group ltd
,good boy wolf limited
,good bricks limited
,good brew media ltd
,good bros (timber merchants) limited
,good bread brothers ltd.
,good brew coffee limited
,good broadcast limited
,good brothers ltd
,"good brother industry co., ltd"
,good brothers trading co. ltd
,good bubble limited
,good brothers west ltd
,good brothers boyd ltd
,good builders ltd
,good build company (london) limited
,good building (cambridge) ltd
,good burger ltd
,good building services ltd
,good bureau care limited
,good burger 1 ltd
,good burger official limited
,good burger limited
,good burger (mak) limited
,good burgers london limited
,good burgers e town limited
,good business brokerage ltd
,good business limited
,good business initiative limited
,good business networking ltd
,good business solutions ltd
,good business partnership ltd
,good business logistics limited
,good business pays cic
,good business sustainability ltd
,good business ventures limited
,good buy stores limited
,good buy estate agents limited
,good buys limited
,good by design limited
,good buyys limited
,good buy trading limited
,good cable people ltd
,good cake day ltd
,good byte works limited
,good cafe company limited
,good call mobile cic
,good call marketing ltd
,good call network limited
,good call ltd
,good calibrations ltd
,good caesar ltd
,good call property ltd
,good candles ltd
,good business foundation
,good bye ltd
,good campaigns company limited
,good bear digital limited
,good beef index limited
,good books limited
,good car limited
,good capital ltd
,good call property maintenance ltd
,good care business support limited
,good careers limited
,good care help ltd
,good care derby limited
,good care dusks limited
,good cat limited
,good care veterinary services limited
,good cars ltd
,good car prices ltd
,good cat capital limited
,good care providers limited
,good care matters ltd
,good carma limited
,good care 24 ltd
,good catch limited
,good catch entertainment limited
,good catch casting ltd
,good cause communications limited
,"good catch europe, ltd"
,good cause consulting ltd.
,good cause central store ltd
,good cause services ltd
,good cause group ltd
,good chance theatre
,good chance ltd
,good cause marketing limited
,good cause digital ltd
,good cell ltd
,good causes trading limited
,good causes (silloth) community interest company
,good chat ltd
,good chef (cardiff) ltd
,good chaos ltd
,good chauffeur ltd
,good chef (hua) limited
,good chemistry brewing limited
,good chemistry apparatus limited
,good chen chef ltd
,good chemistry pubs limited
,good chips ltd
,good child louis limited
,good chief defence limited
,good chicken round egg limited
,good choice asia food ltd
,good choice builders ltd
,good choice ltd
,good choice ltd
,good choi limited
,good chi services limited
,good choice edinburgh ltd
,good choice dog training ltd
,good choice cosmetics ltd
,good choice cleaning service ltd
,good choice catering ltd
,good choice furniture ltd
,good choice foods ltd
,good choice property sales ltd
,good choice management ltd
,good choice joinery ltd
,good choice 2016 limited
,good choice zr ltd
,good choice trading ltd
,good choice takeaway limited
,good choice money limited
,good choice services ltd
,good clean energy limited
,good clean ltd
,good city circle ltd
,good citizen studio limited
,good citizens ltd
,good chose ltd
,good clean fun ltd
,good cleaners limited
,good clean folk ltd
,good clean fun glasgow cic
,good cleaning ltd
,good clean words ltd
,good cleaning services limited
,good coaching limited
,good clinical people ltd.
,good clubs limited
,good clic limited
,good coffee & co ltd
,good cod london ltd
,good code software limited
,good code ltd
,good cod ltd
,good commerce media ltd
,good commerce ltd
,good coffee n7 ltd
,good coffee n16 ltd
,good communications ltd
,good commodities ltd
,good coffee london limited
,good comp limited
,good companions limited
,good companions (cumbria) limited
,good company escorts ltd
,good company entertainment ltd
,good companions student living limited
,good company creative ltd
,good companions spalding ltd
,good companions (neston) limited
,good company collective ltd
,good company blendery limited
,good company network ltd
,good company music ltd
,good company management ltd
,good company events ltd
,good company (poole) limited
,good company records ltd
,good company (travel) limited
,good company wealth limited
,good computers uk ltd
,good conduct enterprises ltd
,good connections electrical ltd
,good connection limited
,good condition limited
,good construction ltd
,good construct cristi limited
,good connexions (sussex) limited
,good connexion ltd
,good consulting global limited
,good consultants uk ltd
,good consultancy limited
,good construction (sussex) limited
,good cooking limited
,g.o.o.d consulting limited
,good content ltd
,good contact limited
,good cop bad cop consultants ltd
,good cop bad cop ltd
,good cook inn limited
,good cop limited
,good corp ltd
,good copy ltd
,good cop9 (ni) ltd
,good couple limited
,good cotton limited
,good cost apartments ltd
,good courage ltd
,good country builders limited
,good cost properties ltd
,good crew ltd
,good creation services ltd
,good craic cafe ltd
,"good crow, bad crow limited"
,good culture kombucha limited
,good curries ltd
,good craic limited
,good cycle ltd
,good data limited
,good day agency limited
,good customer check ltd
,good data solutions ltd
,good day aesthetics & beauty ltd
,good data production ltd
,good day limited
,good day coffee ltd
,good day care homes ltd
,good day home bargains limited
,good day cases ltd
,good day cafe limited
,good day lounge ltd
,good day fruit & veg limited
,good day overseas services (uk) limited
,good day foods limited
,good day out ltd
,good day mini market ltd
,good day organics ltd
,arh enterprises limited
,bad & boujiee ltd
,bad & boujee aesthetics ltd
,bad and boozy cocktails ltd
,bad & boujee limited
,bad angels limited
,b.a.d ltd
,bad alex productions ltd
,bad and boujee nail salon ltd
,bad & poochie ltd
,bad & boujee cookies ltd
,bad and boujee lounge ltd
,bad antics ltd
,bad apple limited
,bad apple cider limited
,bad apple clothing limited
,bad apple engineering ltd
,bad apple hair birmingham limited
,bad ant ltd
,bad angle limited
,bad apple hair concessions limited
,bad apple hair lichfield limited
,bad apple hair derby limited
,bad apple hair solihull ltd
,bad apple hair stafford limited
,bad apple hair stratford limited
,bad apple projects ltd
,bad apple hair salons uk limited
,bad apple productions limited
,bad apple mobile repair ltd
,bad apple hair wolverhampton ltd
,bad apple hair uk ltd
,bad ass bikes ltd
,bad art life limited
,bad art limited
,bad apple solutions ltd
,bad ass baboon group ltd
,bad associates ltd
,bad ass clothing ltd
,bad apples north east cic
,bad baby ltd
,bad aunt clothing ltd
,bad bad donkey ltd
,bad balloon limited
,bad baby productions ltd
,bad bear and the rats cleaning ltd
,bad b bodywear ltd
,bad b**** beauty ltd
,bad barnet (hailsham) limited
,bad badger ltd
,bad bambi ltd
,bad bee ltd
,bad beauty ltd
,bad beez studio ltd
,bad beat games limited
,bad bear transport ltd
,bad bear fitness ltd
,bad bees ltd
,bad bear consulting limited
,bad bees management ltd
,bad behaviour ltd
,bad betty designs ltd
,bad behaviour films ltd
,bad b frames limited
,bad betty press limited
,bad betty media ltd
,bad bird limited
,bad b health & fashion ltd
,bad billy studio ltd
,bad billy ltd
,bad b hypnotherapy ltd
,bad bird kink ltd
,bad blood films limited
,bad bitch illustrations ltd
,bad bitch bakes ltd
,bad box ltd
,bad boujiee ltd
,bad bot studio limited
,bad blvd ltd
,bad boy barber ltd
,bad boy baby ltd
,bad boy animations ltd
,bad boy bosses ltd
,bad boy burgers mobile ltd
,bad boy burgers ltd
,bad boy bullyz ltd
,bad boy brownies ltd
,bad boy chilli mash limited
,bad boy car accessories limited
,bad boy investments limited
,bad boy fireworks limited
,bad boy developments ltd
,bad boy cleaners ltd
,bad boy motorz ltd
,bad boy lanyards ltd
,bad boy media limited
,bad boy pizza society ltd
,bad boy productions limited
,bad boy promotions limited
,bad boys limited
,bad boy records ltd
,bad boys corner uk ltd
,bad boys chicken ltd
,bad boy reputation ltd
,bad boys grill ltd
,bad boys foods ltd
,bad boys elite ltd
,bad boy services ltd
,bad boys security uk ltd
,bad boy sports ltd
,bad boys records limited
,bad boys fish & chips ltd
,bad boys make noise ltd
,bad boyz diner limited
,bad boyz burgers ltd
,bad boy vaping ltd
,bad boy tuning ltd
,bad boy vapes ltd
,bad boyz kitchens ltd
,bad breeding limited
,bad brambach holding company limited
,bad bud company ltd
,bad bulls uk limited
,bad bruno limited
,bad brownie ltd
,bad bs clothing ltd
,b.a.d burgers and doughnuts limited
,bad buddha events ltd
,bad bunny merch ltd
,bad bunny management ltd
,bad bunny brewery ltd
,bad byte software ltd
,bad bxtch tragedy ltd
,bad bunnies limited
,bad b’s beauty by claudia ltd
,bad card games ltd
,bad buunda ltd
,bad burro limited
,bad caribou ltd
,bad cat barbering ltd
,bad cat limited
,bad cat design ltd
,bad cat technologies ltd
,bad clothing ltd
,bad cat it limited
